"listing_value","tweets_Name","tweets_Date","tweets_Replies","tweets_Retweets","tweets_Likes","tweets_Images","tweets_Text","tweets_imageURL","tweets_hrefURL","remove"
"","CNN Breaking News","Jan 12","98","129","670","https://pbs.twimg.com/media/EOF50VIWAAEJ_oZ?format=jpg&name=small","Rep. Dave Loebsack announces he's endorsing Pete Buttigieg for president, delivering the former mayor his biggest Iowa endorsement weeks ahead of the state's key caucuses https://cnn.it/3a4PYGX","","","1"
"","CNN Breaking News","Jan 12","128","1K","9.6K","https://pbs.twimg.com/media/EOF0E9LWkAAbn3L?format=jpg&name=small","Serena Williams wins her first title since becoming a mom
https://cnn.it/2R9fuSV","","","1"
"","CNN Breaking News","Jan 12","302","90","252","https://pbs.twimg.com/media/EOFW6BZX4AE2s5I?format=jpg&name=small","Libya's renegade Gen. Khalifa Haftar has declared a ceasefire, ending a nine-month campaign to seize the capital, Tripoli https://cnn.it/2uHinTu","","","1"
"","CNN Breaking News","Jan 12","131","494","658","https://pbs.twimg.com/media/EOEhIwUWAAEhyo8?format=jpg&name=small","A gunman is on the run after shooting five people at an apartment complex in Aurora, Colorado, police say https://cnn.it/2FIgJ6i","","","1"
"","CNN Breaking News","Jan 12","158","414","1.2K","","More than a dozen Saudi servicemen training at US military installations will be expelled from the US after a review that followed the deadly shooting last month at a base in Pensacola, Florida, sources tell CNN https://cnn.it/2uH8F3t","","","1"
"","CNN Breaking News","Jan 11","50","204","420","https://pbs.twimg.com/media/EOBcb3OWAAEf8Zj?format=jpg&name=small","At least six people have died in Louisiana and Alabama as a result of severe weather moving across the eastern half of the US. Follow live updates. https://cnn.it/37WmPMn","","","1"
"","CNN Breaking News","Jan 11","67","438","1.9K","https://pbs.twimg.com/media/EOAfpZ6W4AAGnxr?format=jpg&name=small","Taiwan's President Tsai Ing-wen wins reelection after securing more than 57% of the vote https://cnn.it/2R5Ebjb","","","1"
"","CNN Breaking News","Jan 11","114","760","903","https://pbs.twimg.com/media/EOAVH28XkAA_mSg?format=jpg&name=small","Another earthquake with a preliminary magnitude of 6.0 rattled Puerto Rico on Saturday morning, the US Geological Survey reports https://cnn.it/37Y27fb","","","1"
"","CNN Breaking News","Jan 11","933","3.5K","4.5K","https://pbs.twimg.com/media/EN-QDO2XsAAaLmS?format=jpg&name=small","Iran admits it shot down a Ukrainian passenger plane unintentionally, according to Iranian state TV. 176 people died in the crash outside Tehran. https://cnn.it/2uFhZF5","","","1"
"","CNN Breaking News","Jan 10","60","265","432","https://pbs.twimg.com/media/EN9OCZ6WoAABKP0?format=jpg&name=small","A 5.4 magnitude aftershock hit Puerto Rico's southern coast on Friday afternoon, days after an earthquake shook the island and left much of it without power https://cnn.it/2sWWXBq","","","1"
"","CNN Breaking News","Jan 10","81","127","418","https://pbs.twimg.com/media/EN8-XK4XsAEXj5z?format=jpg&name=small","Ousted Boeing CEO Dennis Muilenburg will not receive severance as part of his departure, the company say https://cnn.it/2R65iL2","","","1"
"","CNN Breaking News","Jan 10","232","1.1K","2K","https://pbs.twimg.com/media/EN86jtqWoAcAdyw?format=jpg&name=small","Neil Peart, the drummer and lyricist for Canadian rock band Rush has died at age 67 after battling brain cancer, his family said https://cnn.it/2tN8mnc","","","1"
"","CNN Breaking News","Jan 10","44","161","307","https://pbs.twimg.com/media/EN8LD0HW4AAbuZM?format=jpg&name=small","Boeing's largest supplier is laying off about 2,800 employees because of the suspension of the 737 Max production https://cnn.it/39ZAmoc","","","1"
"","CNN Breaking News","Jan 10","311","391","671","https://pbs.twimg.com/media/EN8HJRkW4AERN07?format=jpg&name=small","On the night the US killed Iranian commander Qasem Soleimani, it tried to kill another senior Iranian military official in Yemen, two sources say https://cnn.it/39VBN7b","","","1"
"","CNN Breaking News","Jan 10","204","220","671","https://pbs.twimg.com/media/EN73cjeWsAMtQSV?format=jpg&name=small","House Speaker Nancy Pelosi signals there will be a vote next week on appointing impeachment managers and transmitting articles of impeachment to the Senate https://cnn.it/2tNMlVc","","","1"
"","CNN Breaking News","Jan 10","214","211","574","https://pbs.twimg.com/media/EN5_Th0WoAUPisy?format=jpg&name=small","A spokesman for the Iranian government says reports that missiles downed the Ukraine International Airlines flight that crashed near Tehran are ""a big lie,"" state-run media reports https://cnn.it/2QCRE2W","","","1"
"","CNN Breaking News","Jan 10","822","1.5K","4.8K","https://pbs.twimg.com/media/EN43YTLX4AMPzpf?format=jpg&name=small","A Justice Department review of business dealings tied to Hillary Clinton has wound down with officials not finding enough evidence to recommend the formal opening of a criminal investigation, officials say https://cnn.it/2t52CoL","","","1"
"","CNN Breaking News","Jan 10","38","143","347","https://pbs.twimg.com/media/EN4ybyoXkAEWQv6?format=jpg&name=small","Boeing releases a trove of more than 100 pages of internal company communications that further casts the company's actions around the troubled 737 Max in a bad light https://cnn.it/382Aq55","","","1"
"","CNN Breaking News","Jan 10","223","413","3K","https://pbs.twimg.com/media/EN4wz0OUUAAZIE_?format=jpg&name=small","Retired Army Maj. Matt Golsteyn, who was charged with murder and pardoned by President Trump, has been denied having his status as a member of Army Special Forces reinstated https://cnn.it/37SxOq9","","","1"
"","CNN Breaking News","Jan 10","62","200","559","https://pbs.twimg.com/media/EN4kK_BU8AAkq3D?format=jpg&name=small","A federal judge ruled that the private border wall effort underway in south Texas can move forward https://cnn.it/35Drql2","","","1"
"","CNN Breaking News","Jan 10","73","170","504","https://pbs.twimg.com/media/EN4aAZgXUAAKhTu?format=jpg&name=small","The US National Transportation Safety Board will participate in the investigation into the Ukrainian Airlines flight that crashed in Iran, the agency says https://cnn.it/2semtBG","","","1"
"","CNN Breaking News","Jan 10","524","219","646","https://pbs.twimg.com/media/EN4T_kpU0AAKUEx?format=jpg&name=small","President Trump asserts that Iranian Gen. Qasem Soleimani was plotting to blow up a US embassy before he was killed by a US drone strike last week https://cnn.it/2NaqL4n","","","1"
"","CNN Breaking News","Jan 9","550","1K","5.5K","https://pbs.twimg.com/media/EN4CXeUU8AEXgCx?format=jpg&name=small","The House votes to restrain Trump's ability to use military action against Iran without congressional approval https://cnn.it/39T6c65","","","1"
"","CNN Breaking News","Jan 9","301","816","1.1K","https://pbs.twimg.com/media/EN3bQkoU8AAD0Oi?format=jpg&name=small","The Ukrainian airliner was shot down by Iran with Russian-made surface-to-air missiles, a US official says. Follow live updates.
https://cnn.it/35DY6er","","","1"
"","CNN Breaking News","Jan 9","132","224","573","https://pbs.twimg.com/media/EN3VQV1XkAAtvgh?format=jpg&name=small","The US increasingly believes that Iran mistakenly shot down a Ukrainian passenger jet over Tehran earlier this week, officials say https://cnn.it/2FDa8d6
(A previous tweet displayed an incorrect photo, and it has been removed)","","","1"
"","CNN Breaking News","Jan 9","356","707","1.9K","https://pbs.twimg.com/media/EN1rvo1X4AEsfaV?format=jpg&name=small","Harry and Meghan, the Duke and Duchess of Sussex, have been granted a trademark by the UK's Intellectual Property Office for their brand ""Sussex Royal"" https://cnn.it/2FwaS3S","","","1"
"","CNN Breaking News","Jan 9","317","326","823","","Mitch McConnell walked the President through the format of the Senate impeachment trial and discussed how GOP lawmakers were reacting to it, a source says","","","1"
"","McConnell and Trump talk impeachment at White House meeting","","317","326","823","","Mitch McConnell walked the President through the format of the Senate impeachment trial and discussed how GOP lawmakers were reacting to it, a source says","","","1"
"","Senate Majority Leader Mitch McConnell and President Donald Trump met Wednesday at the White House and discussed the upcoming Senate impeachment trial, according to multiple sources familiar with the...","","317","326","823","","Mitch McConnell walked the President through the format of the Senate impeachment trial and discussed how GOP lawmakers were reacting to it, a source says","","","1"
"","cnn.com","","317","326","823","","Mitch McConnell walked the President through the format of the Senate impeachment trial and discussed how GOP lawmakers were reacting to it, a source says","","","1"
"","CNN Breaking News","Jan 8","316","388","1.8K","https://pbs.twimg.com/media/ENyijRXW4AENtGO?format=jpg&name=small","House Democrats will take up legislation Thursday to restrain President Trump's military actions amid hostilities with Iran, Speaker Pelosi announced https://cnn.it/37OScZm","","","1"
"","CNN Breaking News","Jan 8","96","270","580","https://pbs.twimg.com/media/ENyPcakWkAAavwR?format=jpg&name=small","The FBI and Department of Homeland Security warn of the cyber threats Iran poses to the US in an intelligence bulletin sent to law enforcement https://cnn.it/2s5gtej","","","1"
"","CNN Breaking News","Jan 8","351","1.2K","3.1K","https://pbs.twimg.com/media/ENx9gseXYAAyWkG?format=jpg&name=small","Prince Harry and Meghan, the Duchess of Sussex, are stepping back from their roles as senior members of the British royal family https://cnn.it/2Fz6FfY","","","1"
"","CNN Breaking News","Jan 8","31","132","305","https://pbs.twimg.com/media/ENx3XZsXsAEXXq4?format=jpg&name=small","The family of ""Ugly Betty"" creator Silvio Horta releases a statement confirming his death, saying he struggled ""with addiction and depression"" https://cnn.it/2s2mW9Q","","","1"
"","CNN Breaking News","Jan 8","73","239","646","https://pbs.twimg.com/media/ENxsPfuWsAAFWoX?format=jpg&name=small","Oil prices fall sharply, reversing the initial panic spike caused by fears of a deeper conflict between the US and Iran https://cnn.it/37Kpb0O","","","1"
"","CNN Breaking News","Jan 8","431","547","2K","https://pbs.twimg.com/media/ENxf2RLXYAAFe5G?format=jpg&name=small","President Trump says Iran ""appears to be standing down"" and no Americans were harmed in the attack on bases housing US troops in Iraq https://cnn.it/37QyRqL","","","1"
"","CNN Breaking News","Jan 8","140","196","601","https://pbs.twimg.com/media/ENxa2-qX0AAHvPd?format=jpg&name=small","President Trump makes a statement following Iran's missile attack on bases in Iraq that house American troops. Follow live updates. https://cnn.it/37QyRqL","","","1"
"","CNN Breaking News","Jan 8","23","108","304","https://pbs.twimg.com/media/ENxNjIsWkAA-_Fd?format=jpg&name=small","An individual is still at large in a shooting that killed one person and injured three more in Ottawa https://cnn.it/2Fv3HJp","","","1"
"","CNN Breaking News","Jan 8","317","535","1.6K","https://pbs.twimg.com/media/ENxAok5XsAAOUGG?format=jpg&name=small","President Trump will deliver a statement on Iran at 11 a.m. ET, the White House says. Follow live updates.
https://cnn.it/37Kg28v","","","1"
"","CNN Breaking News","Jan 8","51","121","271","https://pbs.twimg.com/media/ENwt3YKXYAA3BJ_?format=jpg&name=small","Former auto chief and fugitive Carlos Ghosn speaks to reporters in Beirut in his first major public appearance since his stunning escape from Japan https://cnn.it/2T0P9Jn","","","1"
"","CNN Breaking News","Jan 8","92","585","2.7K","https://pbs.twimg.com/media/ENwilx4WsAER6JG?format=jpg&name=small","The US saw its largest-ever single-year drop in overall cancer deaths, a 2.2% plunge spurred in part by a sharp decline in lung cancer deaths https://cnn.it/2ZYNMwg","","","1"
"","CNN Breaking News","Jan 8","430","2.3K","3.1K","https://pbs.twimg.com/card_img/1336657574519857152/iDL_wa0f?format=jpg&name=small","All 176 people aboard the Ukraine International Airlines Boeing 737 plane that crashed after takeoff in Tehran have died, Iranian state TV reports","https://pbs.twimg.com/card_img/1336657574519857152/iDL_wa0f?format=jpg&name=small","https://t.co/UKELsE2Gh3?amp=1","1"
"","All passengers and crew on board are dead","","430","2.3K","3.1K","https://pbs.twimg.com/card_img/1336657574519857152/iDL_wa0f?format=jpg&name=small","All 176 people aboard the Ukraine International Airlines Boeing 737 plane that crashed after takeoff in Tehran have died, Iranian state TV reports","https://pbs.twimg.com/card_img/1336657574519857152/iDL_wa0f?format=jpg&name=small","https://t.co/UKELsE2Gh3?amp=1","1"
"","All passengers and crew members on board the Ukrainian flight that crashed in Tehran have died, according to Iran's state-run Press TV.","","430","2.3K","3.1K","https://pbs.twimg.com/card_img/1336657574519857152/iDL_wa0f?format=jpg&name=small","All 176 people aboard the Ukraine International Airlines Boeing 737 plane that crashed after takeoff in Tehran have died, Iranian state TV reports","https://pbs.twimg.com/card_img/1336657574519857152/iDL_wa0f?format=jpg&name=small","https://t.co/UKELsE2Gh3?amp=1","1"
"","cnn.com","","430","2.3K","3.1K","https://pbs.twimg.com/card_img/1336657574519857152/iDL_wa0f?format=jpg&name=small","All 176 people aboard the Ukraine International Airlines Boeing 737 plane that crashed after takeoff in Tehran have died, Iranian state TV reports","https://pbs.twimg.com/card_img/1336657574519857152/iDL_wa0f?format=jpg&name=small","https://t.co/UKELsE2Gh3?amp=1","1"
"","CNN Breaking News","Jan 8","544","3.6K","3.2K","https://pbs.twimg.com/media/ENuuDgFXYAcW8kt?format=jpg&name=small","A Ukrainian Airlines Boeing 737 with 180 passengers onboard crashed shortly after takeoff in Tehran, according to Iranian reports https://cnn.it/2N2eE99","","","1"
"","CNN Breaking News","Jan 8","301","1.9K","2.1K","https://pbs.twimg.com/media/ENt5sYBWkAU5sGu?format=jpg&name=small","Iran takes credit for rocket attack on base housing US troops. Follow live updates. https://cnn.it/2QYfqp5","","","1"
"","CNN Breaking News","Jan 7","778","7K","4.9K","https://pbs.twimg.com/media/ENt0z-QXUAgayq7?format=jpg&name=small","At least 10 rockets have hit an airbase that houses US forces in Iraq https://cnn.it/2QAaPdQ","","","1"
"","CNN Breaking News","Jan 7","114","178","551","https://pbs.twimg.com/media/ENtkLE_XUAACwi0?format=jpg&name=small","Republican Rep. Duncan Hunter of California will leave office on January 13, more than a month after he pleaded guilty to campaign finance violations https://cnn.it/37O1cxV","","","1"
"","CNN Breaking News","Jan 7","308","180","597","https://pbs.twimg.com/media/ENsx4tGW4AAOVhV?format=jpg&name=small","Senate Majority Leader Mitch McConnell appears to have the votes to set the ground rules of Trump's impeachment trial without Democrats' support https://cnn.it/37HfeBe","","","1"
"","CNN Breaking News","Jan 7","136","133","566","https://pbs.twimg.com/media/ENspuLgWsAYnvIp?format=jpg&name=small","Former Trump national security adviser Michael Flynn is unrepentant and should serve up to six months in jail, prosecutors say https://cnn.it/2s2JyqN","","","1"
"","CNN Breaking News","Jan 7","32","85","378","https://pbs.twimg.com/media/ENscb-mXUAoZw7o?format=jpg&name=small","The estranged husband of missing Connecticut mom Jennifer Dulos has been arrested again and is expected to face a murder charge, sources say https://cnn.it/2sUZ3l8","","","1"
"","CNN Breaking News","Jan 7","82","1.4K","1.9K","https://pbs.twimg.com/media/ENsG5XkWoAEV2t9?format=jpg&name=small","Puerto Rico's governor signs a state of emergency declaration following the most damaging quake to impact the island since 1918 https://cnn.it/2FpjlpB","","","1"
"","CNN Breaking News","Jan 7","247","137","363","https://pbs.twimg.com/media/ENsGJ4OXUAA5Yg3?format=jpg&name=small","Secretary of State Mike Pompeo insists that Iran will not build nuclear weapons ""on our watch"" https://cnn.it/36yXHuK","","","1"
"","CNN Breaking News","Jan 7","34","171","258","https://pbs.twimg.com/media/ENsDDcpUYAAmFwW?format=jpg&name=small","A crash involving as many as 60 vehicles shuts down I-95 North in Maine https://cnn.it/2QN9v5W","","","1"
"","CNN Breaking News","Jan 7","69","228","546","https://pbs.twimg.com/media/ENr3_EuX0AEok71?format=jpg&name=small","Forces across the Middle East were placed on alert to possibly shoot down Iranian drones due to threat of an imminent attack, US officials say https://cnn.it/2s1apn5","","","1"
"","CNN Breaking News","Jan 7","64","100","275","https://pbs.twimg.com/media/ENrcBndX0AApGSU?format=jpg&name=small","Japanese prosecutors issue an arrest warrant for Carole Ghosn  the latest twist in the case involving her husband, former auto executive and now international fugitive Carlos Ghosn https://cnn.it/2N3cEOi","","","1"
"","CNN Breaking News","Jan 7","103","1.1K","1.2K","https://pbs.twimg.com/card_img/1334994294135009285/jN2bnOBe?format=jpg&name=small","A 6.4-magnitude earthquake rocked Puerto Rico early Tuesday morning, just one day after a 5.8 magnitude quake shook the island, according to the US Geological Survey","https://pbs.twimg.com/card_img/1334994294135009285/jN2bnOBe?format=jpg&name=small","https://t.co/MDLW8xgGvu?amp=1","1"
"","A deadly earthquake has most of Puerto Rico with no power, no water and residents fear tremors will...","","103","1.1K","1.2K","https://pbs.twimg.com/card_img/1334994294135009285/jN2bnOBe?format=jpg&name=small","A 6.4-magnitude earthquake rocked Puerto Rico early Tuesday morning, just one day after a 5.8 magnitude quake shook the island, according to the US Geological Survey","https://pbs.twimg.com/card_img/1334994294135009285/jN2bnOBe?format=jpg&name=small","https://t.co/MDLW8xgGvu?amp=1","1"
"","Hours after a deadly 6.4 magnitude earthquake rocked Puerto Rico, people on the southern coast fear more homes could collapse and most of the people on the island remain without power.","","103","1.1K","1.2K","https://pbs.twimg.com/card_img/1334994294135009285/jN2bnOBe?format=jpg&name=small","A 6.4-magnitude earthquake rocked Puerto Rico early Tuesday morning, just one day after a 5.8 magnitude quake shook the island, according to the US Geological Survey","https://pbs.twimg.com/card_img/1334994294135009285/jN2bnOBe?format=jpg&name=small","https://t.co/MDLW8xgGvu?amp=1","1"
"","cnn.com","","103","1.1K","1.2K","https://pbs.twimg.com/card_img/1334994294135009285/jN2bnOBe?format=jpg&name=small","A 6.4-magnitude earthquake rocked Puerto Rico early Tuesday morning, just one day after a 5.8 magnitude quake shook the island, according to the US Geological Survey","https://pbs.twimg.com/card_img/1334994294135009285/jN2bnOBe?format=jpg&name=small","https://t.co/MDLW8xgGvu?amp=1","1"
"","CNN Breaking News","Jan 7","86","115","325","https://pbs.twimg.com/card_img/1334178966731689986/iDq2iP7Y?format=jpg&name=small","A number of people died during a funeral procession for Iranian commander Qasem Soleimani in his hometown of Kerman, Iran's Press TV says","https://pbs.twimg.com/card_img/1334178966731689986/iDq2iP7Y?format=jpg&name=small","https://t.co/nkEjeZNJCe?amp=1","1"
"","BREAKING: People killed in stampede at Soleimani's funeral, says state media","","86","115","325","https://pbs.twimg.com/card_img/1334178966731689986/iDq2iP7Y?format=jpg&name=small","A number of people died during a funeral procession for Iranian commander Qasem Soleimani in his hometown of Kerman, Iran's Press TV says","https://pbs.twimg.com/card_img/1334178966731689986/iDq2iP7Y?format=jpg&name=small","https://t.co/nkEjeZNJCe?amp=1","1"
"","""A number of people"" have died in a stampede at General Qasem Soleimani's funeral Tuesday in his hometown of Kerman, Iran's Press TV reported, citing the head of Iran's emergency organization.","","86","115","325","https://pbs.twimg.com/card_img/1334178966731689986/iDq2iP7Y?format=jpg&name=small","A number of people died during a funeral procession for Iranian commander Qasem Soleimani in his hometown of Kerman, Iran's Press TV says","https://pbs.twimg.com/card_img/1334178966731689986/iDq2iP7Y?format=jpg&name=small","https://t.co/nkEjeZNJCe?amp=1","1"
"","cnn.com","","86","115","325","https://pbs.twimg.com/card_img/1334178966731689986/iDq2iP7Y?format=jpg&name=small","A number of people died during a funeral procession for Iranian commander Qasem Soleimani in his hometown of Kerman, Iran's Press TV says","https://pbs.twimg.com/card_img/1334178966731689986/iDq2iP7Y?format=jpg&name=small","https://t.co/nkEjeZNJCe?amp=1","1"
"","CNN Breaking News","Jan 7","231","288","1.1K","https://pbs.twimg.com/card_img/1336600400330420230/pTSwE2Xo?format=jpg&name=small","Threats to strike Irans cultural sites show President Trump has no respect for international law, the countrys foreign minister says","https://pbs.twimg.com/card_img/1336600400330420230/pTSwE2Xo?format=jpg&name=small","https://t.co/G7YoEJPc7z?amp=1","1"
"","January 6 US-Iran news","","231","288","1.1K","https://pbs.twimg.com/card_img/1336600400330420230/pTSwE2Xo?format=jpg&name=small","Threats to strike Irans cultural sites show President Trump has no respect for international law, the countrys foreign minister says","https://pbs.twimg.com/card_img/1336600400330420230/pTSwE2Xo?format=jpg&name=small","https://t.co/G7YoEJPc7z?amp=1","1"
"","The US is sending thousands of additional troops to the Middle East as tensions grow following the killing of Iran's top general. Follow here for the latest news.","","231","288","1.1K","https://pbs.twimg.com/card_img/1336600400330420230/pTSwE2Xo?format=jpg&name=small","Threats to strike Irans cultural sites show President Trump has no respect for international law, the countrys foreign minister says","https://pbs.twimg.com/card_img/1336600400330420230/pTSwE2Xo?format=jpg&name=small","https://t.co/G7YoEJPc7z?amp=1","1"
"","cnn.com","","231","288","1.1K","https://pbs.twimg.com/card_img/1336600400330420230/pTSwE2Xo?format=jpg&name=small","Threats to strike Irans cultural sites show President Trump has no respect for international law, the countrys foreign minister says","https://pbs.twimg.com/card_img/1336600400330420230/pTSwE2Xo?format=jpg&name=small","https://t.co/G7YoEJPc7z?amp=1","1"
"","CNN Breaking News","Jan 6","73","239","334","https://pbs.twimg.com/media/ENn_vkCX0AANimH?format=jpg&name=small","The US issues a travel advisory for Israel, Jerusalem, the West Bank and Gaza because of what it called heightened tension https://cnn.it/35n1dao","","","1"
"","CNN Breaking News","Jan 6","21","59","289","https://pbs.twimg.com/media/ENn1pBWWoAA3Tf-?format=jpg&name=small","University of Alabama quarterback Tua Tagovailoa, who suffered a season-ending injury in November, says he will enter the NFL draft https://cnn.it/2sRwK76","","","1"
"","CNN Breaking News","Jan 6","87","324","1.1K","https://pbs.twimg.com/media/ENnwnhTWwAAmcIt?format=jpg&name=small","Harvey Weinstein, whose sexual assault trial in New York began today, has been charged with rape and other sex crimes in Los Angeles, DA says https://cnn.it/35uaXiU","","","1"
"","CNN Breaking News","Jan 6","71","331","632","https://pbs.twimg.com/media/ENnlnXrWkAEbBY5?format=jpg&name=small","Chevron has evacuated all of its American oil workers from Iraq following last week's US airstrike in Baghdad. The oil giant called it a precautionary measure. https://cnn.it/37GOfFS","","","1"
"","CNN Breaking News","Jan 6","130","288","1.1K","https://pbs.twimg.com/media/ENnRWnRWoAUOtV2?format=jpg&name=small","Ex-White House national security adviser John Bolton says he is willing to testify in the Senate's impeachment trial if he's subpoenaed https://cnn.it/2NfUBVd","","","1"
"","CNN Breaking News","Jan 6","19","53","214","https://pbs.twimg.com/media/ENm0u-rUcAEFrLV?format=jpg&name=small","One of two violent inmates who escaped a Mississippi penitentiary last week has been apprehended, officials say. Escapee Dillion Williams, 27, remains at large. https://cnn.it/2sIUkmC","","","1"
"","CNN Breaking News","Jan 6","38","388","527","https://pbs.twimg.com/media/ENmt4IfUUAAqJSV?format=jpg&name=small","People in Puerto Rico post photos of deep cracks in walls caused by magnitude 5.8 earthquake. An emergency official says at least two houses collapsed in the coastal town of Guanica. https://cnn.it/2QsuNqN","","","1"
"","CNN Breaking News","Jan 6","59","313","467","https://pbs.twimg.com/media/ENmSpXeU8AEVmzt?format=jpg&name=small","A magnitude 5.8 earthquake has struck Puerto Rico, the USGS says. There are no immediate reports of significant damage or injuries. https://cnn.it/2QqhcjI","","","1"
"","CNN Breaking News","Jan 6","90","186","507","https://pbs.twimg.com/media/ENkRPbjUUAEGEb1?format=jpg&name=small","Two women and a baby were killed when a semi crashed into eight vehicles on I-65 in Indiana, police said. The semi driver has been charged with three counts of reckless homicide. https://cnn.it/2FonhH4","","","1"
"","CNN Breaking News","Jan 6","75","437","659","https://pbs.twimg.com/media/ENj-PTyXkAYlhd6?format=jpg&name=small","Boeing has found another potential design flaw with the 737 Max, which has been grounded since March after two crashes that killed 346 people https://cnn.it/2QtaXM1","","","1"
"","CNN Breaking News","Jan 6","1.1K","1.2K","2.5K","https://pbs.twimg.com/media/ENj7bt6VAAAFfCf?format=jpg&name=small","President Trump said that if Iraq expels US troops from the country, he could impose sanctions ""like they've never seen before"" https://cnn.it/39K70Kk","","","1"
"","CNN Breaking News","Jan 5","307","595","991","https://pbs.twimg.com/media/ENi6QolVAAA2Y0Z?format=jpg&name=small","A US service member and two civilian contractors were killed by Al-Shabaab in Kenya, US Africa Command says
https://cnn.it/2FoB9RG","","","1"
