"listing_value","tweets_Name","tweets_Date","tweets_Replies","tweets_Retweets","tweets_Likes","tweets_Images","tweets_Text","tweets_imageURL","tweets_hrefURL","remove"
"","CNN Breaking News","Jan 5","586","1.2K","1.7K","https://pbs.twimg.com/media/ENigGA2WsAUNM8V?format=jpg&name=small","Iran will no longer limit itself to the uranium enrichment restrictions of the 2015 nuclear deal, days after a US strike killed its top military commander https://cnn.it/39zURro","","","1"
"","CNN Breaking News","Jan 5","194","82","280","https://pbs.twimg.com/media/ENiIossXsAEu3Vo?format=jpg&name=small","Rush Limbaugh, whose contract was due to expire later this year, has renewed his deal, the syndication company Premiere Radio Networks confirms https://cnn.it/2rW8jF3","","","1"
"","CNN Breaking News","Jan 5","37","100","280","https://pbs.twimg.com/media/ENiFhPxXYAAu0vZ?format=jpg&name=small","A fire destroys much of a five-star Black Forest hotel, home to Michelin star restaurants, causing an estimated $1.1 million in damage https://cnn.it/35oL83V","","","1"
"","CNN Breaking News","Jan 5","327","970","1.5K","https://pbs.twimg.com/media/ENfOdc8X0AA4nJL?format=jpg&name=small","DHS is monitoring the apparent hack of a government website that displayed an image of Trump bleeding from his mouth with an Iranian Revolutionary Guard fist in his face, a senior official says https://cnn.it/2QpSsrW","","","1"
"","CNN Breaking News","Jan 4","1K","1.3K","3.1K","https://pbs.twimg.com/media/ENeXqgbUwAA1Dvb?format=jpg&name=small","Trump warns Iran that if it retaliates against Americans or American assets, the US has 52 Iranian sites targeted for attack https://cnn.it/2QZ8ok3","","","1"
"","CNN Breaking News","Jan 4","187","167","465","https://pbs.twimg.com/media/ENeREoZXUAMLPGW?format=jpg&name=small","The Trump administration formally notifies Congress regarding the drone strike that killed Iranian military commander Qasem Soleimani, sources say https://cnn.it/2Fhw9hI","","","1"
"","CNN Breaking News","Jan 4","150","582","1.2K","https://pbs.twimg.com/media/ENd8ZpTVAAAvkbP?format=jpg&name=small","The British Navy will accompany UK ships crossing the Strait of Hormuz after the US killing of Iran's most senior military commander https://cnn.it/2um2m5n","","","1"
"","CNN Breaking News","Jan 4","51","125","512","https://pbs.twimg.com/media/ENaKz_dWsAIV1X2?format=jpg&name=small","A gunman holding a woman hostage inside an Illinois bank has surrendered, police say https://cnn.it/2MRHyc0","","","1"
"","CNN Breaking News","Jan 4","29","110","289","https://pbs.twimg.com/media/ENZ2x_6XkAIMQqu?format=jpg&name=small","A suspected armed robber is holding a person hostage inside a Rockford, Illinois, credit union, police say https://cnn.it/2twtkq9","","","1"
"","CNN Breaking News","Jan 4","28","77","178","https://pbs.twimg.com/media/ENZk9aGXsAEkPhE?format=jpg&name=small","Mexico's ex-public security secretary pleads not guilty to charges related to a drug trafficking conspiracy in which he allegedly accepted millions in bribes from Joaquin ""El Chapo"" Guzman https://cnn.it/2MVIDjb","","","1"
"","CNN Breaking News","Jan 4","164","550","853","https://pbs.twimg.com/media/ENZkYRyWoAAVXJX?format=jpg&name=small","A convoy including Iran-backed Popular Mobilization Forces was hit by an airstrike in north Baghdad, killing and wounding several, according to the PMF https://cnn.it/2SXi5SF","","","1"
"","CNN Breaking News","Jan 4","443","660","1.2K","https://pbs.twimg.com/media/ENZc451UwAIfDNN?format=jpg&name=small","Iran's ambassador to the United Nations says the killing of Iranian Gen. Qasem Soleimani is an ""act of war."" Follow live updates. https://cnn.it/2FkSwTg","","","1"
"","CNN Breaking News","Jan 3","1.7K","1.1K","2.2K","https://pbs.twimg.com/media/ENYjZgcW4AA6o-M?format=jpg&name=small","President Trump says the US ""did not take action to start a war"" following an attack that killed a top Iranian general. Follow live updates. https://cnn.it/2uc34Sl","","","1"
"","CNN Breaking News","Jan 3","60","116","479","https://pbs.twimg.com/media/ENYd84BWkAYzUML?format=jpg&name=small","The man accused of stabbing people in a rabbi's home in Monsey, New York, during a Hanukkah celebration has been indicted on attempted murder and assault charges https://cnn.it/2FjzNHK","","","1"
"","CNN Breaking News","Jan 3","115","272","427","https://pbs.twimg.com/media/ENYVPhkWkAAtH-E?format=jpg&name=small","United Methodist Church leaders propose a historic split into two denominations to end debate on gay marriage and LGBT clergy https://cnn.it/36oeJM6","","","1"
"","CNN Breaking News","Jan 3","20","70","255","https://pbs.twimg.com/media/ENYDw5OXkAASEpG?format=jpg&name=small","Former NFL coach Sam Wyche dies at 74. He helped popularize the no-huddle offense and brought the Cincinnati Bengals tantalizingly close to a Super Bowl win in the late 1980s. https://cnn.it/35oKcMS","","","1"
"","CNN Breaking News","Jan 3","327","1.6K","1.3K","https://pbs.twimg.com/media/ENX6z6nWsAMJPfk?format=jpg&name=small","Thousands of additional US troops are being deployed to the Middle East as tensions with Iran mount, a defense official says. Follow live updates. https://cnn.it/2rWQPbO","","","1"
"","CNN Breaking News","Jan 3","526","717","1.7K","https://pbs.twimg.com/media/ENXo9QmX0AM9mX4?format=jpg&name=small","The US had intelligence that Iranian military commander Qasem Soleimani was in multiple countries in the region planning specific attacks on US interests, including US personnel, a congressional source tells CNN https://cnn.it/2tppM9i","","","1"
"","CNN Breaking News","Jan 3","350","1.1K","1.7K","https://pbs.twimg.com/media/ENU5KzrXkAAvyrs?format=jpg&name=small","The commander of Iran's Quds Force has been killed in a United States strike ordered by President Donald Trump and aimed at ""deterring future Iranian attack plans,"" the Pentagon said https://cnn.it/2tt2qPW","","","1"
"","CNN Breaking News","Jan 3","239","760","1.3K","","A rocket attack near a Baghdad airport killed the head of Iran's Quds military force, as well as a senior Iraqi paramilitary leader https://cnn.it/2tt2qPW","","","1"
"","CNN Breaking News","Jan 3","104","261","417","https://pbs.twimg.com/media/ENUY0HrX0AATBKS?format=jpg&name=small","A senior official of an Iranian-backed paramilitary force was among those killed by rockets near Baghdad International Airport, sources say https://cnn.it/2tt2qPW","","","1"
"","CNN Breaking News","Jan 2","116","155","340","https://pbs.twimg.com/media/ENTt2GdW4AEk_E0?format=jpg&name=small","Democratic presidential candidate Marianne Williamson has laid off her campaign staff nationally, a former staffer says https://cnn.it/35hksSD","","","1"
"","CNN Breaking News","Jan 2","41","73","223","https://pbs.twimg.com/media/ENTXLU_WoAAx4k6?format=jpg&name=small","The Food and Drug Administration announced a plan to clear the market of most e-cigarette cartridge flavors, but not menthol https://cnn.it/2MNxyk6","","","1"
"","CNN Breaking News","Jan 2","305","602","1.5K","https://pbs.twimg.com/media/ENTKaT5WsAEi88A?format=jpg&name=small","A White House budget official told the Pentagon that the order to hold Ukraine aid came from Trump, a national security site reports
https://cnn.it/2MOuMew","","","1"
"","CNN Breaking News","Jan 2","24","156","268","https://pbs.twimg.com/media/ENS-ypFW4AMwdeR?format=jpg&name=small","At least 30 people have been killed as severe flooding leaves swaths of Jakarta underwater, Indonesia's disaster agency says https://cnn.it/35jMPzD","","","1"
"","CNN Breaking News","Jan 2","40","76","178","https://pbs.twimg.com/media/ENSmI2IWsAAbdD0?format=jpg&name=small","Fugitive auto executive Carlos Ghosn denies reports that his family was involved in helping him flee https://cnn.it/2FdwEcr","","","1"
"","CNN Breaking News","Jan 2","193","241","795","https://pbs.twimg.com/card_img/1336331535805423619/49i9OnmA?format=jpg&name=small","Julin Castro ends his US presidential campaign after failing to gain traction in the large field of Democratic candidates","https://pbs.twimg.com/card_img/1336331535805423619/49i9OnmA?format=jpg&name=small","https://t.co/ZSU3KxbOKx?amp=1","1"
"","Julin Castro ends presidential campaign","","193","241","795","https://pbs.twimg.com/card_img/1336331535805423619/49i9OnmA?format=jpg&name=small","Julin Castro ends his US presidential campaign after failing to gain traction in the large field of Democratic candidates","https://pbs.twimg.com/card_img/1336331535805423619/49i9OnmA?format=jpg&name=small","https://t.co/ZSU3KxbOKx?amp=1","1"
"","Julin Castro ended his presidential campaign on Thursday after the former Housing and Urban Development secretary failed to gain traction in the large field of Democratic candidates.","","193","241","795","https://pbs.twimg.com/card_img/1336331535805423619/49i9OnmA?format=jpg&name=small","Julin Castro ends his US presidential campaign after failing to gain traction in the large field of Democratic candidates","https://pbs.twimg.com/card_img/1336331535805423619/49i9OnmA?format=jpg&name=small","https://t.co/ZSU3KxbOKx?amp=1","1"
"","cnn.com","","193","241","795","https://pbs.twimg.com/card_img/1336331535805423619/49i9OnmA?format=jpg&name=small","Julin Castro ends his US presidential campaign after failing to gain traction in the large field of Democratic candidates","https://pbs.twimg.com/card_img/1336331535805423619/49i9OnmA?format=jpg&name=small","https://t.co/ZSU3KxbOKx?amp=1","1"
"","CNN Breaking News","Jan 2","73","185","409","https://pbs.twimg.com/media/ENQsoBPWwAAWN2n?format=jpg&name=small","Taiwan's top military official was among eight people killed when their Black Hawk helicopter crashed in mountains in the north of the island https://cnn.it/36gNiUF","","","1"
"","CNN Breaking News","Jan 2","50","202","619","https://pbs.twimg.com/media/ENPLCiRXUAE2HJg?format=jpg&name=small","Jazz great Jack Sheldon, known for his work on ""Schoolhouse Rock!"" and ""The Merv Griffin Show,"" has died. He was 88. https://cnn.it/2MM3oOg","","","1"
"","CNN Breaking News","Jan 1","84","335","694","https://pbs.twimg.com/media/ENOymWkXkAEKHNI?format=jpg&name=small","Real estate tycoon Robert Durst admits he wrote a note that gave police the location of the body of a close friend he is accused of killing almost 20 years ago, his lawyer says https://cnn.it/37vVvoe","","","1"
"","CNN Breaking News","Jan 1","50","351","715","https://pbs.twimg.com/media/ENOcvVdWkAIo9uE?format=jpg&name=small","David Stern, the former NBA commissioner who grew the league into one of the world's most prominent sports brands, dies at age 77 https://cnn.it/2tklccw","","","1"
"","CNN Breaking News","Jan 1","258","278","495","","Israeli Prime Minister Benjamin Netanyahu has requested immunity from prosecution in three corruption cases in which he faces indictment on charges of bribery, fraud and breach of trust https://cnn.it/2MNXhZT","","","1"
"","CNN Breaking News","Jan 1","82","67","186","https://pbs.twimg.com/media/ENN68YsWwAEzwdW?format=jpg&name=small","Secretary of State Pompeo postpones a planned trip to Ukraine to deal with the ongoing developments out of Baghdad
https://cnn.it/2FdLsbe","","","1"
"","CNN Breaking News","Jan 1","84","335","694","https://pbs.twimg.com/media/ENOymWkXkAEKHNI?format=jpg&name=small","Real estate tycoon Robert Durst admits he wrote a note that gave police the location of the body of a close friend he is accused of killing almost 20 years ago, his lawyer says https://cnn.it/37vVvoe","","","1"
"","CNN Breaking News","Jan 1","50","351","715","https://pbs.twimg.com/media/ENOcvVdWkAIo9uE?format=jpg&name=small","David Stern, the former NBA commissioner who grew the league into one of the world's most prominent sports brands, dies at age 77 https://cnn.it/2tklccw","","","1"
"","CNN Breaking News","Jan 1","258","278","495","https://pbs.twimg.com/media/ENOGY--XsAAa_-G?format=jpg&name=small","Israeli Prime Minister Benjamin Netanyahu has requested immunity from prosecution in three corruption cases in which he faces indictment on charges of bribery, fraud and breach of trust https://cnn.it/2MNXhZT","","","1"
"","CNN Breaking News","Jan 1","82","67","186","https://pbs.twimg.com/media/ENN68YsWwAEzwdW?format=jpg&name=small","Secretary of State Pompeo postpones a planned trip to Ukraine to deal with the ongoing developments out of Baghdad
https://cnn.it/2FdLsbe","","","1"
"","CNN Breaking News","Jan 1","62","118","323","https://pbs.twimg.com/media/ENNkO65X0AAyFkl?format=jpg&name=small","Iraqi security forces regain control of area around US Embassy after second day of protests https://cnn.it/2ZHD3pL","","","1"
"","CNN Breaking News","Jan 1","48","88","281","https://pbs.twimg.com/media/ENNFhAeXUAELbHF?format=jpg&name=small","Doctors are not optimistic that one of the men stabbed at a New York Hanukkah celebration will regain consciousness, according to the victim's family https://cnn.it/2tkCZ38","","","1"
"","CNN Breaking News","Jan 1","115","843","3.9K","https://pbs.twimg.com/media/ENJ2qSzXsAot8lX?format=jpg&name=small","The governor of Illinois pardoned more than 11,000 people for low-level marijuana convictions one day before a sweeping law makes cannabis legal in the state for people 21 and older https://cnn.it/2QdvKmD","","","1"