"listing_value","tweets_Name","tweets_Date","tweets_Replies","tweets_Retweets","tweets_Likes","tweets_Images","tweets_Text","tweets_imageURL","tweets_hrefURL","remove"
"","CNN Breaking News","Jan 21","119","95","205","https://pbs.twimg.com/media/EO1o0rSWoAUDhw8?format=jpg&name=small","Senate Majority Leader Mitch McConnell hopes to finish the impeachment trial in about 10 days, two sources say
https://cnn.it/3aBD0kD","","","1"
"","CNN Breaking News","Jan 21","894","398","830","https://pbs.twimg.com/media/EO1nfUxWsA8BT9I?format=jpg&name=small","Susan Collins says she will ""likely"" support having witnesses in the impeachment trial, but only after both sides present their cases https://cnn.it/38shDA7","","","1"
"","CNN Breaking News","Jan 21","54","133","180","https://pbs.twimg.com/media/EO1d_mcWkAEZXTi?format=jpg&name=small","Two inmates were killed at a Mississippi State Penitentiary after an altercation, officials say, bringing the total number of inmates who have died at the facility this year to seven https://cnn.it/37mo9sg","","","1"
"","CNN Breaking News","Jan 21","166","1.5K","1K","https://pbs.twimg.com/media/EO1E-HmWoAEqs2U?format=jpg&name=small","A man who lives in Snohomish County, Washington, is confirmed to have the first US case of Wuhan coronavirus https://cnn.it/36fKrdI","","","1"
"","CNN Breaking News","Jan 21","31","100","175","https://pbs.twimg.com/media/EO0-nczX0AAE98u?format=jpg&name=small","Brazilian prosecutors file charges against American journalist Glenn Greenwald, alleging he aided in cybercrimes and ""helped, encouraged and oriented"" hackers https://cnn.it/2RfR0J9","","","1"
"","CNN Breaking News","Jan 21","73","110","348","https://pbs.twimg.com/media/EO03kERW4AACiw0?format=jpg&name=small","In a significant change that was quietly made to Sen. Mitch McConnell's resolution, there are now three days of opening arguments over 24 hours in the Senate impeachment trial https://cnn.it/3ayJksK","","","1"
"","CNN Breaking News","Jan 21","234","237","782","https://pbs.twimg.com/media/EO0M_cyWkAA7JFo?format=jpg&name=small","The resolution introduced by Senate Majority Leader Mitch McConnell ""does not prescribe a process for a fair trial,"" lead House impeachment manager Adam Schiff says at a news conference https://cnn.it/2TJx5E0","","","1"
"","CNN Breaking News","Jan 21","31","98","330","https://pbs.twimg.com/media/EO0EzO1WkAAu-5_?format=jpg&name=small","The Supreme Court signals that it's unlikely to consider the fate of the Affordable Care Act before the 2020 presidential election https://cnn.it/36jZ6Vr","","","1"
"","CNN Breaking News","Jan 21","491","405","829","https://pbs.twimg.com/media/EOz4yCZXkAAC93z?format=jpg&name=small","Hillary Clinton blasts Sen. Bernie Sanders in a new documentary and tells The Hollywood Reporter that she won't commit to endorsing him if he's the Democratic 2020 nominee https://cnn.it/2Re7jpF","","","1"
"","CNN Breaking News","Jan 21","317","373","567","https://pbs.twimg.com/media/EOzrUHOW4AE_vo5?format=jpg&name=small","President Trump attacks climate activists as ""perennial prophets of doom"" while addressing the World Economic Forum https://cnn.it/2GbXvpW","","","1"
"","CNN Breaking News","Jan 21","288","127","397","https://pbs.twimg.com/media/EOxhl6CX0AAiXzu?format=jpg&name=small","Several House Republicans will join President Trump's impeachment team following an internal debate https://cnn.it/2Rz7v1D","","","1"
"","CNN Breaking News","Jan 20","100","218","630","https://pbs.twimg.com/media/EOw1GSIW4AAtNqA?format=jpg&name=small","President Trump, after talking with French President Macron, has agreed to hold off on massive new tariffs on French goods such as wine, cheese and handbags, a French official says https://cnn.it/36gr585","","","1"
"","CNN Breaking News","Jan 20","151","104","238","https://pbs.twimg.com/media/EOwn5oEXUAEOibu?format=jpg&name=small","The proposed impeachment trial rules from Senate Majority Leader McConnell give House impeachment managers and the President's legal team 24 hours each to make their opening arguments over two days https://cnn.it/3asBLnB","","","1"
"","CNN Breaking News","Jan 20","1.1K","938","4.6K","https://pbs.twimg.com/media/EOwWQXIX0AAHQYO?format=jpg&name=small","About half of Americans say the Senate should convict President Trump in the upcoming impeachment trial and remove him from office, a new CNN poll finds https://cnn.it/30BHiUo","","","1"
"","CNN Breaking News","Jan 20","204","107","346","https://pbs.twimg.com/media/EOvbPaEW4AEjod0?format=jpg&name=small","Trump's legal team submits a detailed response to impeachment charges, calling the process a ""charade"" https://cnn.it/38tpeP3","","","1"
"","CNN Breaking News","Jan 20","29","105","187","https://pbs.twimg.com/media/EOvGaSWXUAAY01d?format=jpg&name=small","Memphis police are searching for a suspect in the fatal shooting of a 10-year-old boy https://cnn.it/2sHoYwB","","","1"
"","CNN Breaking News","Jan 20","42","139","316","https://pbs.twimg.com/media/EOumRjgXkAEFiRK?format=jpg&name=small","Kansas City Mayor Quinton Lucas gives credit to bar security after shooting that left two dead and 15 injured, saying it could have been worse https://cnn.it/2G655Cz","","","1"
"","CNN Breaking News","Jan 20","81","269","852","https://pbs.twimg.com/media/EOsIqGnX4AAueh6?format=jpg&name=small","Singer-songwriter David Olney, whose songs were recorded by Linda Ronstadt, Emmylou Harris and others, died on stage while performing at a festival in Florida, his website says. He was 71. https://cnn.it/2TEvSOg","","","1"
"","CNN Breaking News","Jan 19","77","289","436","https://pbs.twimg.com/media/EOrQJOfWsAIxfV_?format=jpg&name=small","At least two Honolulu police officers died in a shooting in the Diamond Head area, a report says, and the suspect appears to have set a home on fire https://cnn.it/2NHGAQe","","","1"
"","CNN Breaking News","Jan 19","70","369","544","https://pbs.twimg.com/media/EOrA3LCXsAUAQlX?format=jpg&name=small","The FBI says authorities are responding to an ""active shooter"" in the Waikiki area of Honolulu https://cnn.it/2NHGAQe","","","1"
"","CNN Breaking News","Jan 19","34","170","706","https://pbs.twimg.com/media/EOqK_QcX4AAfKpm?format=jpg&name=small","SpaceX's Crew Dragon completes a fiery emergency escape test, the last major milestone in a years-long testing program, ahead of its first astronaut mission https://cnn.it/2uauqsj","","","1"
"","CNN Breaking News","Jan 18","870","1.2K","5.3K","https://pbs.twimg.com/media/EOlb_pLU0AIiFV5?format=jpg&name=small","Harry and Meghan will no longer use the titles His and Her Royal Highness after announcing they would step back from their roles as senior members of the royal family, Buckingham Palace announced https://cnn.it/2NyYLYj","","","1"
"","CNN Breaking News","Jan 18","66","182","593","https://pbs.twimg.com/media/EOkmz_8XkAA8QNY?format=jpg&name=small","Iran will send the black boxes of a Ukrainian airliner that its military accidentally shot down this month to Ukraine for analysis, Iranian media reports https://cnn.it/2FYKK1M","","","1"
"","CNN Breaking News","Jan 18","67","135","276","https://pbs.twimg.com/media/EOiY-u3WkAAt02d?format=jpg&name=small","Four people were shot to death in a residence in Grantsville, Utah, according to police https://cnn.it/2G4U4kA","","","1"
"","CNN Breaking News","Jan 18","166","235","1K","https://pbs.twimg.com/media/EOh2hOCW4AU4Wn2?format=jpg&name=small","Four teachers from a California elementary school are suing Delta Airlines, alleging negligence, after the school was doused by fuel dumped from one of the airlines' jets this week, their attorney says https://cnn.it/2TxT1BS","","","1"
"","CNN Breaking News","Jan 17","67","160","360","https://pbs.twimg.com/media/EOhXrIgWsAAWSWs?format=jpg&name=small","Two actors fell off a bridge and died while working on the TV series ""Sin Miedo a la Verdad,"" Mexican network Televisa announced on Friday https://cnn.it/3ahlQIR","","","1"
"","CNN Breaking News","Jan 17","91","169","718","https://pbs.twimg.com/media/EOhPvkBXkAEJRyO?format=jpg&name=small","Former New York Rep. Chris Collins was sentenced to 26 months in prison after pleading guilty to federal charges in an insider trading case https://cnn.it/377wL5U","","","1"
"","CNN Breaking News","Jan 17","145","227","374","https://pbs.twimg.com/media/EOhNyFpXsAIhsio?format=jpg&name=small","Rapper Pop Smoke was arrested on a charge of interstate transport of a stolen vehicle. The federal indictment alleges he took a $375,000 Rolls Royce Wraith across state lines. https://cnn.it/2ttfTb4","","","1"
"","CNN Breaking News","Jan 17","38","110","203","https://pbs.twimg.com/card_img/1335209497489526785/Lxj-kTWh?format=jpg&name=small","The Supreme Court will review cases challenging the Obamacare requirement that employer-provided health insurance plans pay for contraceptives","https://pbs.twimg.com/card_img/1335209497489526785/Lxj-kTWh?format=jpg&name=small","https://t.co/lGr9aWEMyC?amp=1","1"
"","Supreme Court to take up contraceptive mandate","","38","110","203","https://pbs.twimg.com/card_img/1335209497489526785/Lxj-kTWh?format=jpg&name=small","The Supreme Court will review cases challenging the Obamacare requirement that employer-provided health insurance plans pay for contraceptives","https://pbs.twimg.com/card_img/1335209497489526785/Lxj-kTWh?format=jpg&name=small","https://t.co/lGr9aWEMyC?amp=1","1"
"","The Supreme Court agreed on Friday to step in and review the Trump administration's attempt to weaken the so-called ""contraceptive mandate,"" the Affordable Care Act's long-controversial requirement...","","38","110","203","https://pbs.twimg.com/card_img/1335209497489526785/Lxj-kTWh?format=jpg&name=small","The Supreme Court will review cases challenging the Obamacare requirement that employer-provided health insurance plans pay for contraceptives","https://pbs.twimg.com/card_img/1335209497489526785/Lxj-kTWh?format=jpg&name=small","https://t.co/lGr9aWEMyC?amp=1","1"
"","cnn.com","","38","110","203","https://pbs.twimg.com/card_img/1335209497489526785/Lxj-kTWh?format=jpg&name=small","The Supreme Court will review cases challenging the Obamacare requirement that employer-provided health insurance plans pay for contraceptives","https://pbs.twimg.com/card_img/1335209497489526785/Lxj-kTWh?format=jpg&name=small","https://t.co/lGr9aWEMyC?amp=1","1"
"","CNN Breaking News","Jan 17","21","104","158","https://pbs.twimg.com/media/EOg7u_qX4AUebG5?format=jpg&name=small","One person was killed and another seriously injured in an avalanche at a ski resort near Tahoe City, California, officials say https://cnn.it/2G1tTeI","","","1"
"","CNN Breaking News","Jan 17","55","167","482","https://pbs.twimg.com/media/EOg23YmWkAEG1qD?format=jpg&name=small","The Supreme Court agrees to hear Electoral College cases concerning whether states can force electors to vote for that state's popular vote winner https://cnn.it/35YUiV6","","","1"
"","CNN Breaking News","Jan 17","87","453","549","https://pbs.twimg.com/media/EOgWisrXUAUQ7OO?format=jpg&name=small","The CDC will screen passengers arriving from Wuhan, China, for symptoms of a mysterious new deadly virus. The screenings will be at airports in Los Angeles and San Francisco, and New York's JFK. https://cnn.it/366oJbU","","","1"
"","CNN Breaking News","Jan 17","120","163","413","https://pbs.twimg.com/media/EOgO5g2X0AAd4Ux?format=jpg&name=small","A federal appeals court threw out a lawsuit by a group of children and teenagers trying to force the US government to take action to address the climate crisis https://cnn.it/2NzlVxA","","","1"
"","CNN Breaking News","Jan 17","246","195","347","https://pbs.twimg.com/media/EOffD-JW4AEiXCh?format=jpg&name=small","Clinton impeachment investigator Kenneth Starr and constitutional lawyer Alan Dershowitz are expected to join President Trump's defense team, sources say https://cnn.it/2RprPm1","","","1"
"","CNN Breaking News","Jan 17","28","140","384","https://pbs.twimg.com/media/EOfLq9UXUAAbz1N?format=jpg&name=small","No injuries have been reported after a Delta flight slid off the runway at Kansas City International Airport. The airfield has closed and is expected to reopen by 9 a.m. CT. https://cnn.it/30wsrdC","","","1"
"","CNN Breaking News","Jan 16","418","268","1.1K","https://pbs.twimg.com/media/EOcG-HzWkAAHhd-?format=jpg&name=small","The Trump administration announced it is updating federal guidance for prayer in public schools and other initiatives aimed at protecting religious freedom https://cnn.it/2RmhGXi","","","1"
"","CNN Breaking News","Jan 16","59","668","1.6K","https://pbs.twimg.com/media/EOb-3k3WsAEGIdo?format=jpg&name=small","Christopher Tolkien, the son of ""The Lord of the Rings"" author J.R.R. Tolkien, has died at 95 https://cnn.it/3agGo43","","","1"
"","CNN Breaking News","Jan 16","25","158","417","https://pbs.twimg.com/media/EOb2XU1XsAAsyp1?format=jpg&name=small","Shares of Google parent company Alphabet hit a new all-time high, pushing the company's market value to $1 trillion https://cnn.it/3ai8SKM","","","1"
"","CNN Breaking News","Jan 16","23","68","205","https://pbs.twimg.com/media/EObSMhuWoAEFxHp?format=jpg&name=small","Carlos Beltran and the New York Mets agree to part ways after baseball cheating scandal https://cnn.it/3aa2hBY","","","1"
"","CNN Breaking News","Jan 16","30","97","292","https://pbs.twimg.com/media/EObNUH8XsAAG21b?format=jpg&name=small","Supreme Court Justice John Roberts is sworn in for the Senate impeachment trial. Follow live updates: https://cnn.it/2FVAOpR","","","1"
"","CNN Breaking News","Jan 16","57","106","268","https://pbs.twimg.com/media/EObNQTmW4AY7eeU?format=jpg&name=small","The New Orleans Police Department has obtained an arrest warrant for Cleveland Browns star wide receiver Odell Beckham Jr. on a charge of misdemeanor simple battery https://cnn.it/2TvH280","","","1"
"","CNN Breaking News","Jan 16","37","91","431","https://pbs.twimg.com/media/EObKHnDXUAA0Wsy?format=jpg&name=small","Supermodel Gigi Hadid was dismissed from the jury pool in the Harvey Weinstein trial https://cnn.it/36Y93ZK","","","1"
"","CNN Breaking News","Jan 16","111","180","261","https://pbs.twimg.com/media/EObGNz8XkAE6TUS?format=jpg&name=small","Intelligence officials ask Congress not to hold public hearings on this year's World Wide Threats Assessment after testimony from agency chiefs last year prompted an angry response from Trump https://cnn.it/2TshpVk","","","1"
"","CNN Breaking News","Jan 16","84","111","513","https://pbs.twimg.com/media/EOa0pWhX0AUuXMe?format=jpg&name=small","House managers are reading the articles of impeachment against President Trump on the Senate floor. Follow live updates: https://cnn.it/2FVAOpR","","","1"
"","CNN Breaking News","Jan 16","22","46","185","https://pbs.twimg.com/media/EOayoWTX0AEv0Rw?format=jpg&name=small","The Senate passes Trump's foremost legislative priority -- the revised trade pact with Mexico and Canada
https://cnn.it/36VRadU","","","1"
"","CNN Breaking News","Jan 16","188","468","1.4K","https://pbs.twimg.com/media/EOavAhUWkAUcbCj?format=jpg&name=small","FBI investigators visit the home and business of Connecticut congressional candidate Robert Hyde, who has been caught up in the scandal about efforts to remove US Ambassador Marie Yovanovitch from Ukraine https://cnn.it/36Ybjju","","","1"
"","CNN Breaking News","Jan 16","179","527","1.6K","https://pbs.twimg.com/media/EOaY_0nWsAAWnZq?format=jpg&name=small","The Trump administration broke the law when it withheld US security aid to Ukraine last year, the Government Accountability Office says https://cnn.it/2TswAhh","","","1"
"","CNN Breaking News","Jan 16","165","139","592","https://pbs.twimg.com/media/EOaS1RYWAAAlLxQ?format=jpg&name=small","Rep. Liz Cheney, a Wyoming Republican and member of GOP House leadership, will not run for Senate this year https://cnn.it/364S72w","","","1"
"","CNN Breaking News","Jan 16","105","429","1.9K","https://pbs.twimg.com/media/EOaOyeFWAAAUSD0?format=jpg&name=small","Demi Lovato will perform the national anthem at the Super Bowl https://cnn.it/35XocsV","","","1"
"","CNN Breaking News","Jan 16","69","227","352","https://pbs.twimg.com/media/EOaMebNW4AAFyqS?format=jpg&name=small","Bose is closing more than 100 stores worldwide because of the ""dramatic shift"" to online shopping https://cnn.it/2RlCaj4","","","1"
"","CNN Breaking News","Jan 15","267","488","976","https://pbs.twimg.com/media/EOWe7CMWAAALR_P?format=jpg&name=small","The Trump administration abruptly canceled three classified congressional briefings tied to the Iran crisis. In some cases, little or no explanation was given. https://cnn.it/3acUnrE","","","1"
"","CNN Breaking News","Jan 15","86","275","1.1K","https://pbs.twimg.com/media/EOWOzOcWkAQnpW9?format=jpg&name=small","A federal judge in Maryland has temporarily blocked President Donald Trump's executive order that allows governors to stop refugee resettlement in their states
https://cnn.it/30sZIqb","","","1"
"","CNN Breaking News","Jan 15","90","169","755","https://pbs.twimg.com/media/EOV9MgaW4Acnbh5?format=jpg&name=small","The House votes to send impeachment articles to the Senate https://cnn.it/3ad9QrO","","","1"
"","CNN Breaking News","Jan 15","77","253","454","https://pbs.twimg.com/media/EOV5JPWWkAYoEjL?format=jpg&name=small","Last year was Earth's second-hottest year on record, NASA says https://cnn.it/2QXXlbG","","","1"
"","CNN Breaking News","Jan 15","108","145","468","https://pbs.twimg.com/media/EOV2EzjWAAEnYco?format=jpg&name=small","President Trump signs an initial trade deal with China that includes pledges from Beijing to more than double its purchases from American farmers in the first year https://cnn.it/2tbMG4r","","","1"
"","CNN Breaking News","Jan 15","25","154","645","https://pbs.twimg.com/media/EOVy8IwWAAA9rg_?format=jpg&name=small","""Star Wars: The Rise of Skywalker"" becomes Disney's seventh billion-dollar film released in 2019 https://cnn.it/2NJtMZN","","","1"
"","CNN Breaking News","Jan 15","64","254","344","https://pbs.twimg.com/media/EOVk9L9X0AAniye?format=jpg&name=small","Russian President Vladimir Putin nominates Mikhail Mishustin, head of the Federal Tax Service, to be Prime Minister after the entire government resigned. Follow live updates: https://cnn.it/3ahKn0r","","","1"
"","CNN Breaking News","Jan 15","793","864","3.7K","https://pbs.twimg.com/media/EOVRQ7lWAAAHSj2?format=jpg&name=small","House Speaker Pelosi announces that seven House Democrats, including chairmen Jerry Nadler and Adam Schiff, will prosecute the case against President Trump at the Senate trial https://cnn.it/2QWoThV","","","1"
"","CNN Breaking News","Jan 15","148","760","851","https://pbs.twimg.com/media/EOU_UlXWsAE4eci?format=jpg&name=small","The entire Russian government resigns, clearing a way for President Vladimir Putin to enact reforms that would weaken his successor https://cnn.it/2RicnIy","","","1"
"","CNN Breaking News","Jan 15","104","287","866","https://pbs.twimg.com/media/EOUygC_XsAAhR39?format=jpg&name=small","This year's list of artists entering the Rock and Roll Hall of Fame is out. Four of the six picks were on the ballot for the first time. https://cnn.it/372mwji","","","1"
"","CNN Breaking News","Jan 15","95","488","2K","https://pbs.twimg.com/media/EOUnm2uWoAAsmns?format=jpg&name=small","The first spacewalk of 2020 will become the second mission in history to be conducted entirely by women astronauts https://cnn.it/384nQlu","","","1"
"","CNN Breaking News","Jan 15","158","59","198","https://pbs.twimg.com/media/EOSz-uJXUAAeiun?format=jpg&name=small","Democrats are defending their electability and saying how they'll beat Trump. Follow live debate updates: https://cnn.it/36W6xD4","","","1"
"","CNN Breaking News","Jan 15","58","24","105","https://pbs.twimg.com/media/EOSmWgHXsAAIkVo?format=jpg&name=small","Halfway through tonight's Democratic debate, here's who has talked the most https://cnn.it/2QRHWd8","","","1"
"","CNN Breaking News","Jan 15","136","48","173","https://pbs.twimg.com/media/EOSldrTWoAAJRSK?format=jpg&name=small","As they debate in Iowa, Bernie Sanders and Elizabeth Warren discuss reports that he said a woman could not be president. Follow live updates: https://cnn.it/2sotksb","","","1"
"","CNN Breaking News","Jan 15","48","30","115","https://pbs.twimg.com/media/EOSeX0vW4AcZLBJ?format=jpg&name=small","Democrats debate military action in the wake of America's attack on an Iranian commander. Follow live updates: https://cnn.it/36SPT7m","","","1"
"","CNN Breaking News","Jan 14","59","203","753","https://pbs.twimg.com/media/EOR4d6TXsAM7KAg?format=jpg&name=small","Text messages and handwritten notes supplied by an indicted Giuliani associate are made public as House Democrats hand over their impeachment case https://cnn.it/2Rgev3w","","","1"
"","CNN Breaking News","Jan 14","61","308","377","https://pbs.twimg.com/media/EOR0qAdWkAEDZRK?format=jpg&name=small","A dam in eastern Mississippi is in imminent danger of failing and officials are warning residents to be ready to leave https://cnn.it/2ta1oca","","","1"
"","CNN Breaking News","Jan 14","120","240","1.3K","https://pbs.twimg.com/media/EORmF88XUAAmCib?format=jpg&name=small","Senate Minority Leader Schumer believes Democrats have the 51 votes needed to pass a resolution limiting President Trump's ability to take military action against Iran https://cnn.it/2uKgKUV","","","1"
"","CNN Breaking News","Jan 14","202","734","1K","","Fire officials say at least 17 children received minor injuries after a Delta flight dumped fuel over a school playground near Los Angeles International Airport https://cnn.it/2RupjLB","","","1"
"","CNN Breaking News","Jan 14","69","106","275","https://pbs.twimg.com/media/EORFfRdWkAA0Xey?format=jpg&name=small","Sen. Mitch McConnell says the Senate impeachment trial will likely begin next Tuesday. Follow live updates: https://cnn.it/30iwIS4","","","1"
"","CNN Breaking News","Jan 14","38","101","263","https://pbs.twimg.com/media/EOQlsixXsAIwhsF?format=jpg&name=small","Boeing reported more cancellations than new business in 2019, and its order book for the troubled 737 Max shrank by 183 jets https://cnn.it/2RgeBYN","","","1"
"","CNN Breaking News","Jan 14","128","156","647","https://pbs.twimg.com/media/EOQEgQ4XUAAL99_?format=jpg&name=small","Speaker Nancy Pelosi indicates the House will vote Wednesday on a resolution to name impeachment managers and send articles to the Senate https://cnn.it/2RkrAso","","","1"
"","CNN Breaking News","Jan 14","203","166","745","https://pbs.twimg.com/media/EOPgn--WoAIVPB2?format=jpg&name=small","Meghan, the Duchess of Sussex, did not dial into royal crisis talks with Queen, a source says https://cnn.it/2RgMrNq","","","1"
"","CNN Breaking News","Jan 14","56","473","1.2K","https://pbs.twimg.com/media/EOPgD4GW4AEN3KW?format=jpg&name=small","BlackRock, the massive asset manager in charge of $7 trillion, will ditch investments that it considers a sustainability risk, including thermal coal producers
https://cnn.it/2FKCNgy","","","1"
"","CNN Breaking News","Jan 14","111","299","674","https://pbs.twimg.com/media/EONcOfYWoAEXHtI?format=jpg&name=small","Amazon will ask a federal court to temporarily block Microsoft from working on a $10B cloud computing contract for the military, a court filing says. Amazon has contended President Trump's dislike of its CEO influenced the contract going to Microsoft. https://cnn.it/37ZyJoE","","","1"
"","CNN Breaking News","Jan 14","255","378","735","","A 16-month-old child's parents face charges in Texas after they allegedly left the toddler in an unlocked and running car as they gambled. Two men were arrested for allegedly stealing that car and leaving the child in a parking lot. https://cnn.it/30oa6zx","","","1"
"","CNN Breaking News","Jan 13","90","238","555","https://pbs.twimg.com/media/EOMU-lzX4AkH8vy?format=jpg&name=small","The Houston Astros fire their manager and GM after they were punished for cheating during the team's World Series title-winning season https://cnn.it/36Qr9wD","","","1"
"","CNN Breaking News","Jan 13","38","111","201","https://pbs.twimg.com/media/EOL5OAyW4AYrCql?format=jpg&name=small","MLB suspends the Houston Astros' manager and GM for a year for using technology to steal signs in the 2017 season https://cnn.it/36Qr9wD","","","1"
"","CNN Breaking News","Jan 13","60","122","322","","The deadly shooting last month at a Florida naval air station was an act of terrorism, the Justice Department says https://cnn.it/35L2KXP","","","1"
"","CNN Breaking News","Jan 13","12","94","186","https://pbs.twimg.com/media/EOK7nmAX0AAHtt5?format=jpg&name=small","Heavy rain and flooding could slam the Southeast over the next two days, the National Weather Service says https://cnn.it/2FNi3VC","","","1"
"","CNN Breaking News","Jan 13","211","355","1K","https://pbs.twimg.com/media/EOKrixfWoAAaA6V?format=jpg&name=small","""Joker"" racks up the most Academy Award nominations and again, no women are nominated for directing. Here's the full list of Oscar contenders. https://cnn.it/2RbMkTl","","","1"
"","CNN Breaking News","Jan 12","130","307","775","https://pbs.twimg.com/media/EOHEenEWoAIQeic?format=jpg&name=small","The Pentagon identified the two soldiers killed Saturday in a roadside bombing in Afghanistan as Staff Sgt. Ian P. McLaughlin, 29, of Newport News, Virginia, and Pfc. Miguel A. Villalon, 21, of Joliet, Illinois https://cnn.it/37RRbjc","","","1"
"","CNN Breaking News","Jan 12","187","686","816","https://pbs.twimg.com/media/EOGaVhaWkAE1I-A?format=jpg&name=small","Eight rockets hit Iraq's Balad Air Base today, wounding four Iraqi air force officers https://cnn.it/36KBGJO","","","1"
"","CNN Breaking News","Jan 12","82","738","1.5K","https://pbs.twimg.com/media/EOGSo4MWkAMgTta?format=jpg&name=small","Experts warn of an ""explosive eruption"" after the Taal Volcano in the Philippines spews ash near Manila
https://cnn.it/2RdvuU9","","","1"
