"listing_value","tweets_Name","tweets_Date","tweets_Text","tweets_Replies","tweets_Retweets","tweets_Likes","tweets_Images","tweets_imageURL","tweets_hrefURL","remove"
"1","WASHINGTON (CNN) -- This year, for the first time in the history of the Marine Corps, the graduation class at its infantry training course will include women. Fifteen women voluntarily began the...","","3 women are first to pass grueling 59-day Marine infantry training course.","105","664","436","https://pbs.twimg.com/card_img/1335436966054137859/nDvDXLYI?format=jpg&name=240x240","https://pbs.twimg.com/card_img/1335436966054137859/nDvDXLYI?format=jpg&name=240x240","http://t.co/bzOkcgFSSC?amp=1","1"
"1","security.blogs.cnn.com","","3 women are first to pass grueling 59-day Marine infantry training course.","105","664","436","https://pbs.twimg.com/card_img/1335436966054137859/nDvDXLYI?format=jpg&name=240x240","https://pbs.twimg.com/card_img/1335436966054137859/nDvDXLYI?format=jpg&name=240x240","http://t.co/bzOkcgFSSC?amp=1","1"
"1","CNN Breaking News","Nov 19, 2013","Obama: Washington politics holding back economic growth.","67","68","48","","","","1"
"1","CNN Breaking News","Nov 19, 2013","Investigators say Virginia state Sen. Deeds likely was stabbed by son, who then shot himself.","31","170","58","","","","1"
"1","CNN Breaking News","Nov 19, 2013","Bail for George Zimmerman set at $9,000; conditions include no weapons possession.","112","327","111","","","","1"
"1","CNN Breaking News","Nov 19, 2013","Police confirm son of Virginia state senator died after being shot; lawmaker in hospital after stabbing.","37","214","70","","","","1"
"1","CNN Breaking News","Nov 19, 2013","Paris police issue second photo of newspaper shooting suspect.","16","65","39","","","","1"
"1","CNN Breaking News","Nov 19, 2013","At least 7 people were killed in a blast Tuesday in front of the Iranian embassy in southern Beirut","33","191","91","","","","1"
"1","CNN Breaking News","Nov 20, 2013","Serial killer gets stay of execution over issue of lethal-injection drugs.","48","128","67","","","","1"
"1","CNN Breaking News","Nov 19, 2013","U.S. Supreme Court won't block Texas abortion law.","71","182","85","","","","1"
"1","CNN Breaking News","Nov 19, 2013","Woman cited as Obamacare success story doesn't qualify for assistance in buying insurance.","106","508","193","","","","1"
"1","CNNPolitics - Political News, Analysis and Opinion","","Woman cited as Obamacare success story doesn't qualify for assistance in buying insurance.","106","508","193","","","","1"
"1","Politics at CNN has news, opinion and analysis of American and global politics Find news and video about elections, the White House, the U.N and much more.","","Woman cited as Obamacare success story doesn't qualify for assistance in buying insurance.","106","508","193","","","","1"
"1","cnn.com","","Woman cited as Obamacare success story doesn't qualify for assistance in buying insurance.","106","508","193","","","","1"
"1","CNN Breaking News","Nov 19, 2013","George Zimmerman posts bail in domestic violence case, leaves jail.","74","130","41","","","","1"
"1","CNN Breaking News","Nov 19, 2013","200,000 Chinese dolls deemed dangerous, seized at U.S. ports.","38","151","72","","","","1"
"1","CNN Breaking News","Nov 19, 2013","3 women are first to pass grueling 59-day Marine infantry training course.","105","664","436","https://pbs.twimg.com/card_img/1335436966054137859/nDvDXLYI?format=jpg&name=240x240","https://pbs.twimg.com/card_img/1335436966054137859/nDvDXLYI?format=jpg&name=240x240","http://t.co/bzOkcgFSSC?amp=1","1"
"1","Women will be first to graduate from Marine Corps infantry training course","","3 women are first to pass grueling 59-day Marine infantry training course.","105","664","436","https://pbs.twimg.com/card_img/1335436966054137859/nDvDXLYI?format=jpg&name=240x240","https://pbs.twimg.com/card_img/1335436966054137859/nDvDXLYI?format=jpg&name=240x240","http://t.co/bzOkcgFSSC?amp=1","1"
"1","WASHINGTON (CNN) -- This year, for the first time in the history of the Marine Corps, the graduation class at its infantry training course will include women. Fifteen women voluntarily began the...","","3 women are first to pass grueling 59-day Marine infantry training course.","105","664","436","https://pbs.twimg.com/card_img/1335436966054137859/nDvDXLYI?format=jpg&name=240x240","https://pbs.twimg.com/card_img/1335436966054137859/nDvDXLYI?format=jpg&name=240x240","http://t.co/bzOkcgFSSC?amp=1","1"
"1","security.blogs.cnn.com","","3 women are first to pass grueling 59-day Marine infantry training course.","105","664","436","https://pbs.twimg.com/card_img/1335436966054137859/nDvDXLYI?format=jpg&name=240x240","https://pbs.twimg.com/card_img/1335436966054137859/nDvDXLYI?format=jpg&name=240x240","http://t.co/bzOkcgFSSC?amp=1","1"
"1","CNN Breaking News","Nov 19, 2013","Obama: Washington politics holding back economic growth.","67","68","48","","","","1"
"1","CNN Breaking News","Nov 19, 2013","Investigators say Virginia state Sen. Deeds likely was stabbed by son, who then shot himself.","31","170","58","","","","1"
"1","CNN Breaking News","Nov 19, 2013","Bail for George Zimmerman set at $9,000; conditions include no weapons possession.","112","327","111","","","","1"
"1","CNN Breaking News","Nov 19, 2013","Police confirm son of Virginia state senator died after being shot; lawmaker in hospital after stabbing.","37","214","70","","","","1"
"1","CNN Breaking News","Nov 19, 2013","Paris police issue second photo of newspaper shooting suspect.","16","65","39","","","","1"
"1","CNN Breaking News","Nov 19, 2013","At least 7 people were killed in a blast Tuesday in front of the Iranian embassy in southern Beirut","33","191","91","","","","1"
"1","CNN Breaking News","Nov 19, 2013","John Edwards will soon begin practicing law again","58","108","108","","","","1"
"1","CNN Breaking News","Nov 18, 2013","Toronto's City Council votes to strip Mayor Rob Ford of most of his powers.","77","233","151","","","","1"
"1","CNN Breaking News","Nov 18, 2013","George Zimmerman arrested after he allegedly pointed shotgun at girlfriend, Seminole County Sheriff's Office says.","304","2.2K","420","","","","1"
"1","CNN Breaking News","Nov 18, 2013","First on CNN from Rene Marsh: Education Sec. Arne Duncan apologizes for 'white suburban moms' comment.","41","70","69","","","","1"
"1","CNN Breaking News","Nov 18, 2013","George Zimmerman arrested in Florida, sheriff's office says.","212","857","236","","","","1"
"1","CNN Breaking News","Nov 18, 2013","NASA launches MAVEN spacecraft to study Mars' atmosphere.","32","200","130","","","","1"
"1","CNN Breaking News","Nov 18, 2013","Mine blast kills 7 children in Afghanistan.","27","132","79","","","","1"
"1","CNN Breaking News","Nov 18, 2013","Supreme Court allows NSA to continue looking at telephone records for now.","46","292","69","","","","1"
"1","CNN Breaking News","Nov 18, 2013","he would've admitted to smoking crack earlier but no one asked him right question.","115","505","158","","","","1"
"1","CNN Breaking News","Nov 18, 2013","22 killed Sunday night when train slammed into two cars near Cairo, Egypt","31","186","127","","","","1"
"1","CNN Breaking News","Nov 18, 2013","that struck Midwest Sunday. Latest death was in Massac County, Illinois","27","331","108","","","","1"
"1","CNN Breaking News","Nov 17, 2013","2 killed in Colorado mine accident; 20 injured.","30","184","123","","","","1"
"1","CNN Breaking News","Nov 17, 2013","Official: 2 dead, 37 injured in Illinois.","68","613","135","","","","1"
"1","CNN Breaking News","Nov 17, 2013","NWS: Nearly 50 tornadoes had been reported as of 4 p.m. ET as a severe weather system moved through the Midwest.","53","1.1K","179","","","","1"
"1","CNN Breaking News","Nov 17, 2013","National Weather Service: Tornado in Paducah, Kentucky.","33","240","61","","","","1"
"1","CNN Breaking News","Nov 17, 2013","NFL game between Chicago Bears and Baltimore Ravens delayed in first quarter due to severe weather in Chicago area.","22","406","121","","","","1"
"1","CNN Breaking News","Nov 17, 2013","Tornado touches down near Washington, Illinois.","60","517","120","","","","1"
"1","CNN Breaking News","Nov 17, 2013","Russian jetliner crashes on landing in Kazan, with 50 aboard feared dead, emergency situations ministry says.","24","359","100","","","","1"
"1","CNN Breaking News","Nov 17, 2013","Nobel Prize-winning author Doris Lessing has died at age 94, her publisher says.","35","301","135","","","","1"
"1","CNN Breaking News","Nov 17, 2013","Drone malfunctions, hits Navy ship during test; 2 sailors treated for burns.","55","216","159","","","","1"
"1","CNN Breaking News","Nov 17, 2013","Man arrested in 2008 sword death of L.A. woman.","25","96","147","","","","1"
"1","CNN Breaking News","Nov 17, 2013","Authorities looking into report paramedics kept out of LAX after TSA agent was shot.","31","141","120","","","","1"
"1","CNN Breaking News","Nov 17, 2013","Texas scrambling to find drugs for its executions.","152","240","145","","","","1"
"1","CNN Breaking News","Nov 16, 2013","assassination theory he can't debunk.","57","246","307","","","","1"
"1","CNN Breaking News","Nov 16, 2013","Joan Jett off Macy's South Dakota float after complaints.","75","125","120","","","","1"
"1","CNN Breaking News","Nov 16, 2013","Body found Saturday may be that of 42-year-old passenger who fell from small plane, police said.","20","122","63","","","","1"
"1","CNN Breaking News","Nov 16, 2013","Princeton weighing whether to offer meningitis vaccines.","15","76","41","","","","1"
"1","CNN Breaking News","Nov 16, 2013","Alec Baldwin apologizes for anti-gay slur.","118","143","218","","","","1"
"1","CNN Breaking News","Nov 16, 2013","College players accused of beating opposing quarterback at awards luncheon.","64","211","198","","","","1"
"1","CNN Breaking News","Nov 16, 2013","Congressional source: Benghazi contractors contradict CIA chief about nondisclosure agreements.","16","85","48","","","","1"
"1","CNN Breaking News","Nov 16, 2013","Obamacare fix could add millions of dollars in government costs.","110","207","58","","","","1"
"1","CNN Breaking News","Nov 16, 2013","Alec Baldwin apologizes for anti-gay slur.","118","143","218","","","","1"
"1","CNN Breaking News","Nov 16, 2013","College players accused of beating opposing quarterback at awards luncheon.","64","211","198","","","","1"
"1","CNN Breaking News","Nov 16, 2013","Congressional source: Benghazi contractors contradict CIA chief about nondisclosure agreements.","16","85","48","","","","1"
"1","CNN Breaking News","Nov 16, 2013","Obamacare fix could add millions of dollars in government costs.","110","207","58","","","","1"
"1","CNN Breaking News","Nov 16, 2013","Online gratuities pour in for waitress who was refused a tip for being gay.","85","341","236","","","","1"
"1","CNN Breaking News","Nov 16, 2013","Judge's sentence lets man convicted of forcibly raping a minor avoid prison.","85","150","84","","","","1"
"1","CNN Breaking News","Nov 15, 2013","U.S. offers up to $10 million reward for info leading to arrest in Benghazi attack.","59","129","51","https://pbs.twimg.com/card_img/1334670067871621120/3KW3wTl0?format=jpg&name=240x240","https://pbs.twimg.com/card_img/1334670067871621120/3KW3wTl0?format=jpg&name=240x240","http://t.co/XLU0EbSPNd?amp=1","1"
"1","U.S. offers up to $10 million reward over Benghazi","","U.S. offers up to $10 million reward for info leading to arrest in Benghazi attack.","59","129","51","https://pbs.twimg.com/card_img/1334670067871621120/3KW3wTl0?format=jpg&name=240x240","https://pbs.twimg.com/card_img/1334670067871621120/3KW3wTl0?format=jpg&name=240x240","http://t.co/XLU0EbSPNd?amp=1","1"
"1","By Jamie Crawford The United States has a reward of up to $10 million on the table for information leading to the arrest of anyone involved in the deadly terror attack last year on the U.S. diploma...","","U.S. offers up to $10 million reward for info leading to arrest in Benghazi attack.","59","129","51","https://pbs.twimg.com/card_img/1334670067871621120/3KW3wTl0?format=jpg&name=240x240","https://pbs.twimg.com/card_img/1334670067871621120/3KW3wTl0?format=jpg&name=240x240","http://t.co/XLU0EbSPNd?amp=1","1"
"1","security.blogs.cnn.com","","U.S. offers up to $10 million reward for info leading to arrest in Benghazi attack.","59","129","51","https://pbs.twimg.com/card_img/1334670067871621120/3KW3wTl0?format=jpg&name=240x240","https://pbs.twimg.com/card_img/1334670067871621120/3KW3wTl0?format=jpg&name=240x240","http://t.co/XLU0EbSPNd?amp=1","1"
"1","CNN Breaking News","Nov 15, 2013","Ex-L.A. teacher sentenced to 25 years after pleading no contest to lewd acts on children.","29","94","51","","","","1"
"1","CNN Breaking News","Nov 15, 2013","Two other sets of remains believed to be McStays' sons, but DNA confirmation needed, police say.","14","60","27","","","","1"
"1","CNN Breaking News","Nov 15, 2013","Remains found in desert are those of missing Calif. couple Joseph and Summer McStay, police say.","23","146","74","","","","1"
"1","CNN Breaking News","Nov 15, 2013","Talks ""getting close"" to deal with Iran on nuclear program, U.S. official says.","19","91","43","","","","1"
"1","CNN Breaking News","Nov 15, 2013","Detroit-area man charged with murder in woman's shooting on porch; self-defense rejected.","56","324","101","","","","1"
"1","CNN Breaking News","Nov 15, 2013","Toronto's City Council votes to take emergency management duties from embattled mayor.","25","120","53","","","","1"
"1","CNN Breaking News","Nov 15, 2013","Police expand search for man who fell from small plane off Florida coast.","22","107","42","","","","1"
"1","CNN Breaking News","Nov 15, 2013","Toronto's City Council votes to strip embattled mayor of power to appoint, fire deputy mayor and others.","21","148","71","","","","1"
"1","CNN Breaking News","Nov 15, 2013","Reports: China to ease one-child policy, abolish labor camps.","43","344","139","","","","1"
"1","CNN Breaking News","Nov 15, 2013","Brother of Toronto Mayor Ford urging him to take leave, city council source says.","36","105","68","","","","1"
"1","CNN Breaking News","Nov 15, 2013","Pope's anti-corruption crusade ""disturbs the Mafia very much,"" Italian prosecutor says.","62","284","137","","","","1"
"1","Prosecutor: Pope faces threat from the mafia","","Pope's anti-corruption crusade ""disturbs the Mafia very much,"" Italian prosecutor says.","62","284","137","","","","1"
"1","By Daniel Burke and Livia Borghese, CNN ROME (CNN) -- Pope Francis' crusade against corruption in the Catholic Church, including an overhaul of the scandal-scarred Vatican Bank, has put the new...","","Pope's anti-corruption crusade ""disturbs the Mafia very much,"" Italian prosecutor says.","62","284","137","","","","1"
"1","religion.blogs.cnn.com","","Pope's anti-corruption crusade ""disturbs the Mafia very much,"" Italian prosecutor says.","62","284","137","","","","1"
"1","CNN Breaking News","Nov 15, 2013","Toronto mayor will be taking his act to television.","78","125","68","","","","1"
"1","CNN Breaking News","Nov 15, 2013","Was Andy Kaufman's brother the victim of a hoax?","18","64","61","","","","1"
"1","CNN Breaking News","Nov 14, 2013","Pilot of single-engine plane reports passenger fell out off Florida coast.","57","174","77","","","","1"
"1","CNN Breaking News","Nov 14, 2013","Sheriff: Suspect pulled gun on police trying to arrest him on neonatal intensive care floor.","20","113","43","","","","1"
"1","CNN Breaking News","Nov 14, 2013","Armed man shot and captured at Milwaukee-area children's hospital, sheriff says.","24","178","58","","","","1"
"1","CNN Breaking News","Nov 14, 2013","Obama to reporters: ""I am not a perfect man and I will not be a perfect president.""","208","346","214","","","","1"
"1","CNNPolitics - Political News, Analysis and Opinion","","Obama to reporters: ""I am not a perfect man and I will not be a perfect president.""","208","346","214","","","","1"
"1","Politics at CNN has news, opinion and analysis of American and global politics Find news and video about elections, the White House, the U.N and much more.","","Obama to reporters: ""I am not a perfect man and I will not be a perfect president.""","208","346","214","","","","1"
"1","cnn.com","","Obama to reporters: ""I am not a perfect man and I will not be a perfect president.""","208","346","214","","","","1"
"1","CNN Breaking News","Nov 14, 2013","Obama: ""No doubt"" fumbled health care rollout put ""burden on Democrats.""","36","74","29","","","","1"
"1","CNNPolitics - Political News, Analysis and Opinion","","Obama: ""No doubt"" fumbled health care rollout put ""burden on Democrats.""","36","74","29","","","","1"
"1","Politics at CNN has news, opinion and analysis of American and global politics Find news and video about elections, the White House, the U.N and much more.","","Obama: ""No doubt"" fumbled health care rollout put ""burden on Democrats.""","36","74","29","","","","1"
"1","cnn.com","","Obama: ""No doubt"" fumbled health care rollout put ""burden on Democrats.""","36","74","29","","","","1"
"1","CNN Breaking News","Nov 14, 2013","Obama on Iran: Aim is to resolve nuclear issue peacefully.","18","51","30","","","","1"
"1","CNNPolitics - Political News, Analysis and Opinion","","Obama on Iran: Aim is to resolve nuclear issue peacefully.","18","51","30","","","","1"
"1","Politics at CNN has news, opinion and analysis of American and global politics Find news and video about elections, the White House, the U.N and much more.","","Obama on Iran: Aim is to resolve nuclear issue peacefully.","18","51","30","","","","1"
"1","cnn.com","","Obama on Iran: Aim is to resolve nuclear issue peacefully.","18","51","30","","","","1"
"1","CNN Breaking News","Nov 14, 2013","website will ""be a lot better"" by month's end.","37","54","22","","","","1"
"1","CNNPolitics - Political News, Analysis and Opinion","","website will ""be a lot better"" by month's end.","37","54","22","","","","1"
"1","Politics at CNN has news, opinion and analysis of American and global politics Find news and video about elections, the White House, the U.N and much more.","","website will ""be a lot better"" by month's end.","37","54","22","","","","1"
"1","cnn.com","","website will ""be a lot better"" by month's end.","37","54","22","","","","1"
"1","CNN Breaking News","Nov 14, 2013","Obama: We don't want Iran to have nuclear weapons,"" leaving all options on the table to meet that goal.","24","52","25","","","","1"
"1","CNNPolitics - Political News, Analysis and Opinion","","Obama: We don't want Iran to have nuclear weapons,"" leaving all options on the table to meet that goal.","24","52","25","","","","1"
"1","Politics at CNN has news, opinion and analysis of American and global politics Find news and video about elections, the White House, the U.N and much more.","","Obama: We don't want Iran to have nuclear weapons,"" leaving all options on the table to meet that goal.","24","52","25","","","","1"
"1","cnn.com","","Obama: We don't want Iran to have nuclear weapons,"" leaving all options on the table to meet that goal.","24","52","25","","","","1"
"1","CNN Breaking News","Nov 14, 2013","Toronto mayor apologizes for graphic remarks, cites ""tremendous, tremendous stress.""","36","72","51","","","","1"
"1","CNN Breaking News","Nov 14, 2013","President Obama ""deeply regrets"" insurance cancellations under Obamacare.","72","132","42","","","","1"
"1","CNNPolitics - Political News, Analysis and Opinion","","President Obama ""deeply regrets"" insurance cancellations under Obamacare.","72","132","42","","","","1"
"1","Politics at CNN has news, opinion and analysis of American and global politics Find news and video about elections, the White House, the U.N and much more.","","President Obama ""deeply regrets"" insurance cancellations under Obamacare.","72","132","42","","","","1"
"1","cnn.com","","President Obama ""deeply regrets"" insurance cancellations under Obamacare.","72","132","42","","","","1"
"1","CNN Breaking News","Nov 14, 2013","Obama says he will resist efforts in Congress to undermine Obamacare.","29","59","38","","","","1"
"1","CNNPolitics - Political News, Analysis and Opinion","","Obama says he will resist efforts in Congress to undermine Obamacare.","29","59","38","","","","1"
"1","Politics at CNN has news, opinion and analysis of American and global politics Find news and video about elections, the White House, the U.N and much more.","","Obama says he will resist efforts in Congress to undermine Obamacare.","29","59","38","","","","1"
"1","cnn.com","","Obama says he will resist efforts in Congress to undermine Obamacare.","29","59","38","","","","1"
"1","CNN Breaking News","Nov 14, 2013","Obama: We'll do ""everything we can to help"" people who've received policy cancellations.","26","63","30","","","","1"
"1","CNNPolitics - Political News, Analysis and Opinion","","Obama: We'll do ""everything we can to help"" people who've received policy cancellations.","26","63","30","","","","1"
"1","Politics at CNN has news, opinion and analysis of American and global politics Find news and video about elections, the White House, the U.N and much more.","","Obama: We'll do ""everything we can to help"" people who've received policy cancellations.","26","63","30","","","","1"
"1","cnn.com","","Obama: We'll do ""everything we can to help"" people who've received policy cancellations.","26","63","30","","","","1"
"1","CNN Breaking News","Nov 14, 2013","Obama: Health care fix won't solve ""every problem for every person.""","41","57","22","","","","1"
"1","CNNPolitics - Political News, Analysis and Opinion","","Obama: Health care fix won't solve ""every problem for every person.""","41","57","22","","","","1"
"1","Politics at CNN has news, opinion and analysis of American and global politics Find news and video about elections, the White House, the U.N and much more.","","Obama: Health care fix won't solve ""every problem for every person.""","41","57","22","","","","1"
"1","cnn.com","","Obama: Health care fix won't solve ""every problem for every person.""","41","57","22","","","","1"
"1","CNN Breaking News","Nov 14, 2013","Obama offers administrative solution to address cancellation notices","12","27","27","","","","1"
"1","CNNPolitics - Political News, Analysis and Opinion","","Obama offers administrative solution to address cancellation notices","12","27","27","","","","1"
"1","Politics at CNN has news, opinion and analysis of American and global politics Find news and video about elections, the White House, the U.N and much more.","","Obama offers administrative solution to address cancellation notices","12","27","27","","","","1"
"1","cnn.com","","Obama offers administrative solution to address cancellation notices","12","27","27","","","","1"
"1","CNN Breaking News","Nov 14, 2013","President Obama: Health care rollout ""rough so far.""","32","58","24","","","","1"
"1","CNNPolitics - Political News, Analysis and Opinion","","President Obama: Health care rollout ""rough so far.""","32","58","24","","","","1"
"1","Politics at CNN has news, opinion and analysis of American and global politics Find news and video about elections, the White House, the U.N and much more.","","President Obama: Health care rollout ""rough so far.""","32","58","24","","","","1"
"1","cnn.com","","President Obama: Health care rollout ""rough so far.""","32","58","24","","","","1"
"1","CNN Breaking News","Nov 14, 2013","UPDATE: Actress guilty of stalking actor Alec Baldwin gets 210 days in jail","20","79","58","","","","1"
"1","CNN Breaking News","Nov 14, 2013","Actress guilty of stalking actor Alec Baldwin gets 225 days in jail","42","147","124","","","","1"
"1","CNN Breaking News","Nov 14, 2013","reports.","57","109","48","","","","1"
"1","CNNPolitics - Political News, Analysis and Opinion","","reports.","57","109","48","","","","1"
"1","Politics at CNN has news, opinion and analysis of American and global politics Find news and video about elections, the White House, the U.N and much more.","","reports.","57","109","48","","","","1"
"1","cnn.com","","reports.","57","109","48","","","","1"
"1","CNN Breaking News","Nov 14, 2013","reports.","22","71","31","","","","1"
"1","CNNPolitics - Political News, Analysis and Opinion","","reports.","22","71","31","","","","1"
"1","Politics at CNN has news, opinion and analysis of American and global politics Find news and video about elections, the White House, the U.N and much more.","","reports.","22","71","31","","","","1"
"1","cnn.com","","reports.","22","71","31","","","","1"
"1","CNN Breaking News","Nov 14, 2013","Former Boston gangster James ""Whitey"" Bulger sentenced to two life sentences plus five years.","53","191","61","","","","1"
"1","CNN Breaking News","Nov 14, 2013","Toronto police: The arrested in child sex abuse case include 40 teachers, six law enforcement workers.","73","475","78","","","","1"
"1","CNN Breaking News","Nov 14, 2013","Toronto police: 45 terabytes of media seized from company in child sex abuse probe.","19","133","51","","","","1"
"1","CNN Breaking News","Nov 14, 2013","Toronto police: Child sex probe began in 2010, centering on company that distributed child porn films.","18","127","37","","","","1"
"1","CNN Breaking News","Nov 14, 2013","President Obama ""deeply regrets"" insurance cancellations under Obamacare.","72","132","42","","","","1"
"1","CNNPolitics - Political News, Analysis and Opinion","","President Obama ""deeply regrets"" insurance cancellations under Obamacare.","72","132","42","","","","1"
"1","Politics at CNN has news, opinion and analysis of American and global politics Find news and video about elections, the White House, the U.N and much more.","","President Obama ""deeply regrets"" insurance cancellations under Obamacare.","72","132","42","","","","1"
