"listing_value","tweets_Name","tweets_Date","tweets_Text","tweets_Replies","tweets_Retweets","tweets_Likes","tweets_Images","tweets_imageURL","tweets_hrefURL","remove"
"1","CNN Breaking News","Oct 4, 2013","President Obama cancels trip to Indonesia and Brunei due to government shutdown, White House announces.","113","362","49","","","","1"
"1","CNN Breaking News","Oct 4, 2013","Florida governor declares state of emergency in 18 counties; Tropical Storm Karen expected to strengthen.","51","390","31","","","","1"
"1","CNN Breaking News","Oct 4, 2013","Hospital: U.S. Capitol Police officer injured in today's incident has been released.","20","90","28","","","","1"
"1","CNN Breaking News","Oct 4, 2013","Source: House Speaker Boehner said he'd be willing to rely on Democrats to help pass measure to raise debt ceiling.","81","196","51","","","","1"
"1","CNN Breaking News","Oct 3, 2013","Madonna launches a new project to fight oppression and shares it with Anderson Cooper.","60","224","95","","","","1"
"1","CNN Breaking News","Oct 4, 2013","Florida governor declares state of emergency in 18 counties; Tropical Storm Karen expected to strengthen.","51","390","31","","","","1"
"1","CNN Breaking News","Oct 4, 2013","Hospital: U.S. Capitol Police officer injured in today's incident has been released.","20","90","28","","","","1"
"1","CNN Breaking News","Oct 4, 2013","Source: House Speaker Boehner said he'd be willing to rely on Democrats to help pass measure to raise debt ceiling.","81","196","51","","","","1"
"1","CNN Breaking News","Oct 3, 2013","Madonna launches a new project to fight oppression and shares it with Anderson Cooper.","60","224","95","","","","1"
"1","CNN Breaking News","Oct 3, 2013","DC Police: Suspect in police chase has been pronounced dead.","64","234","17","","","","1"
"1","CNN Breaking News","Oct 3, 2013","Capitol police on injured officer: ""He'll be fine.""","18","64","14","","","","1"
"1","CNN Breaking News","Oct 3, 2013","A task force is preparing to execute search warrant at the driver's Connecticut home, law enforcement sources said.","22","88","20","","","","1"
"1","CNN Breaking News","Oct 3, 2013","Sources: Driver of car chased by police in the heart of Washington was shot several times while inside her vehicle.","43","231","31","","","","1"
"1","CNN Breaking News","Oct 3, 2013","Sources: No shots believed fired from car in Capitol Hill incident.","40","180","22","","","","1"
"1","CNN Breaking News","Oct 3, 2013","Capitol Police: Officer injured in the incident was hurt in a crash and has been transported to a local hospital.","25","219","18","","","","1"
"1","CNN Breaking News","Oct 3, 2013","Source: The female driver of car in chase ending at Capitol Hill apparently hit by gunfire. A child was in the car.","53","886","47","","","","1"
"1","CNN Breaking News","Oct 3, 2013","Federal law enforcement believes shooting at U.S. Capitol has been resolved. Intelligence source says so far, no tie to terrorism.","89","619","62","","","","1"
"1","CNN Breaking News","Oct 3, 2013","Multiple sources say that the Capitol Hill shooting suspect was a female.","69","559","34","","","","1"
"1","CNN Breaking News","Oct 3, 2013","Secret Service source: Vehicle hit security barrier at 15th and Pennsylvania; car chased from White House to Capitol Hill where shots fired.","19","798","56","","","","1"
"1","CNN Breaking News","Oct 3, 2013","Police have lifted the lock down of the U.S. Capitol following a shooting, Dana Bash reports.","29","465","28","","","","1"
"1","CNN Breaking News","Oct 3, 2013","Source: Car chase ended at Capitol; driver got out of car and was fired upon.","34","526","35","","","","1"
"1","CNN Breaking News","Oct 3, 2013","Pennsylvania Avenue in front of White House is closed to public in wake of report of shots fired on Capitol Hill.","19","549","27","","","","1"
"1","CNN Breaking News","Oct 3, 2013","Senate Majority Leader Harry Reid said 1 person was injured in shooting on Capitol Hill, CNN's Dana Bash reports.","73","1.1K","77","","","","1"
"1","CNN Breaking News","Oct 3, 2013","People were seen running after reports of multiple shots fired on Capitol Hill.","140","1.5K","70","","","","1"
"1","CNN Breaking News","Oct 3, 2013","Capitol Police say they're reacting to reports of shots fired on Capitol Hill.","108","1.4K","61","","","","1"
"1","CNN Breaking News","Oct 3, 2013","Plane crash kills at least 14 at Nigeria airport (correcting link and updating death toll).","14","170","17","","","","1"
"1","CNN Breaking News","Oct 3, 2013","Congress is still getting paid, but who's keeping the paycheck? We have a running count:","83","402","54","","","","1"
"1","CNN Breaking News","Oct 3, 2013","Gay Florida teen pleads no contest to battery, other charges in relationship with 14-year-old girl.","18","70","23","","","","1"
"1","CNN Breaking News","Oct 3, 2013","Roughly 20 more bodies found in sinking of boat off Italy's Lampedusa.","10","60","7","","","","1"
"1","CNN Breaking News","Oct 3, 2013","Obama to Congress: Pass a budget ""with no partisan strings attached.""","82","200","51","","","","1"
"1","CNN Breaking News","Oct 3, 2013","Plane crash kills at least 8 at Nigeria airport.","56","290","21","","","","1"
"1","CNN Breaking News","Oct 3, 2013","Death toll in boat's sinking off Lampedusa, Italy, is at least 94, coast guard says.","18","141","34","","","","1"
"1","CNN Breaking News","Oct 3, 2013","‘Glee’ star Cory Monteith's death due to heroin, alcohol, ruled accidental by British Columbia Coroners Service.","65","346","70","","","","1"
"1","CNN Breaking News","Oct 3, 2013","Kaitlyn Hunt takes plea deal in case of lewd and lascivious battery against 14-year-old girl.","15","48","20","","","","1"
"1","CNN Breaking News","Oct 2, 2013","Congressional leaders emerge from meeting pointing fingers at opposing parties for government shutdown.","211","245","29","","","","1"
"1","CNN Breaking News","Oct 2, 2013","The verdict brings the 5-month-long Michael Jackson death trial to a close. Complete coverage on CNN TV and","16","131","23","","","","1"
"1","CNN Breaking News","Oct 2, 2013","Jury finds AEG Live hired Dr. Conrad Murray, but the concert promoter was not liable for Michael Jackson's drug overdose death.","30","328","29","","","","1"
"1","CNN Breaking News","Oct 2, 2013","Decision whether concert promoter AEG Live is liable in Michael Jackson's death expected to be read in 90 minutes.","30","284","47","","","","1"
"1","CNN Breaking News","Oct 2, 2013","and CNN TV.","9","150","34","","","","1"
"1","CNN Breaking News","Oct 2, 2013","Obama on shutdown:""I am absolutely exasperated, because this is entirely unnecessary.""","133","549","162","","","","1"
"1","CNN Breaking News","Oct 2, 2013","A tractor-trailer, tour bus and passenger vehicle wreck in Tennessee results in multiple fatalities and injuries.","12","107","16","","","","1"
"1","CNN Breaking News","Oct 2, 2013","Multiple fatalities reported in wreck involving truck, tour bus and passenger vehicle, Tennessee Highway Patrol says.","10","114","9","","","","1"
"1","CNN Breaking News","Oct 2, 2013","Third plea deal offered to Florida gay teen accused of having sexual relationship with 14-year-old girl.","27","77","24","","","","1"
"1","CNN Breaking News","Oct 2, 2013",". Here's a searchable list of what's closed and what's open","47","460","93","","","","1"
"1","CNN Breaking News","Oct 2, 2013","at 5:30 p.m. ET.","67","188","29","","","","1"
"1","CNN Breaking News","Oct 2, 2013","Charges dropped against one of two bikers arrested in attack on SUV driver.","60","127","29","","","","1"
"1","CNN Breaking News","Oct 2, 2013","Pennsylvania Superior Court denies Jerry Sandusky's appeal.","48","133","45","","","","1"
"1","CNN Breaking News","Oct 2, 2013","Government shutdown ""extremely damaging"" to U.S. intelligence operations, Clapper says","88","241","42","","","","1"
"1","CNN Breaking News","Oct 2, 2013",". Here's a searchable list of what's closed and what's open","37","481","142","","","","1"
"1","CNN Breaking News","Oct 2, 2013","Charges dropped against one of two bikers arrested in attack on SUV driver.","60","127","29","","","","1"
"1","CNN Breaking News","Oct 2, 2013","Pennsylvania Superior Court denies Jerry Sandusky's appeal.","48","133","45","","","","1"
"1","CNN Breaking News","Oct 2, 2013","Government shutdown ""extremely damaging"" to U.S. intelligence operations, Clapper says","88","241","42","","","","1"
"1","CNN Breaking News","Oct 2, 2013",". Here's a searchable list of what's closed and what's open","37","481","142","","","","1"
"1","CNN Breaking News","Oct 2, 2013","Best-selling author Tom Clancy has died, according to sources with his publisher and family.","226","2K","147","","","","1"
"1","CNN Breaking News","Oct 2, 2013","Suspect to be charged after hoax bomb threat shut Jacksonville airport","20","121","21","","","","1"
"1","CNN Breaking News","Oct 2, 2013","A device found at Jacksonville Airport was taken away by bomb squad; airport has reopened.","35","201","40","","","","1"
"1","CNN Breaking News","Oct 2, 2013","Terminally ill former Black Panther released from prison after more than 40 years in solitary.","66","379","89","","","","1"
"1","CNN Breaking News","Oct 2, 2013","Twitter founder Dorsey and Iran President Rouhani exchange tweets.","64","226","56","","","","1"
"1","CNN Breaking News","Oct 2, 2013","House GOP fails to pass measures to fund veterans programs, national parks and DC government during shutdown.","109","406","42","","","","1"
"1","CNN Breaking News","Oct 1, 2013","Congressional pay protected during government shutdown.","600","619","59","","","","1"
"1","CNN Breaking News","Oct 1, 2013","Jacksonville International Airport has been evacuated and halted operations due to suspicious package. More on","57","400","36","","","","1"
"1","CNN Breaking News","Oct 1, 2013","Monday's rock slide in Colorado killed five members of one family, authorities say.","17","79","18","","","","1"
"1","CNN Breaking News","Oct 1, 2013","International inspectors arrive in Damascus to help rid Syria of chemical weapons.","14","125","25","","","","1"
"1","CNN Breaking News","Oct 1, 2013","Sheriff: Shooter thought wife had sex with Louisiana pastor.","25","138","12","","","","1"
"1","CNN Breaking News","Oct 1, 2013","Obama blames sluggish economic growth on GOP-led fights over government funding.","102","119","35","","","","1"
"1","CNN Breaking News","Oct 1, 2013","Obamacare is a life-changing opportunity for uninsured Americans, President Obama says.","86","230","66","","","","1"
"1","CNN Breaking News","Oct 1, 2013","Obama to House Republicans: ""Reopen the government.""","91","236","62","","","","1"
"1","CNN Breaking News","Oct 1, 2013","Netanyahu to UNGA: It's not hard to find evidence of Iran's nuclear program.","17","57","9","","","","1"
"1","CNN Breaking News","Oct 1, 2013","Israeli PM Netanyahu calls Iran's president ""a wolf in sheep's clothing.""","54","138","34","","","","1"
"1","CNN Breaking News","Oct 1, 2013","Sunday's crash of a business jet that crashed in Santa Monica killed 4, coroner says.","12","46","12","","","","1"
"1","CNN Breaking News","Oct 1, 2013","House GOPers vote to reaffirm Obamacare amendments they attached to spending bill that would have kept gov't going","44","262","44","","","","1"
"1","CNN Breaking News","Oct 1, 2013","As House Republicans vote again on a spending plan, the Senate leaves and will reconvene at 9:30 a.m.","55","330","40","","","","1"
"1","CNN Breaking News","Oct 1, 2013","U.S. government shutdown is in effect after House and Senate could not agree on spending bill to fund the government","257","4.6K","457","","","","1"
"1","CNN Breaking News","Oct 1, 2013","President Obama late tonight signed the military pay bill into law, a White House official tells CNN's Jim Acosta.","53","453","92","","","","1"
"1","CNN Breaking News","Oct 1, 2013","For 2nd time today, Senate rejects a House effort to derail Obamacare tied to spending bill that would avert shutdown","58","438","30","","","","1"
"1","CNN Breaking News","Oct 1, 2013","House passes spending plan with amendment to delay the individual mandate in President Obama's health care law.","55","261","45","","","","1"
"1","CNN Breaking News","Sep 30, 2013","Two Marine generals lose their jobs over deadly Taliban attack","22","115","24","","","","1"
"1","CNN Breaking News","Sep 30, 2013","First on CNN: Moderates revolt against House GOP plan.","64","196","51","","","","1"
"1","CNN Breaking News","Sep 30, 2013","CNN/ORC Poll: 54% say they hold an unfavorable view of the of tea party movement, an all time high in CNN polling","122","499","109","","","","1"
"1","CNN Breaking News","Sep 30, 2013","Obama said he hopes Congress, and in particular the House of Representatives, will elect to do ""the right thing.""","49","137","27","","","","1"
"1","CNN Breaking News","Sep 30, 2013","Obama: You don't get to extract a ransom for doing your job.","66","326","95","","","","1"
"1","CNN Breaking News","Sep 30, 2013","Obama: One faction of one party doesn't get to shut down government.","59","297","73","","","","1"
"1","CNN Breaking News","Sep 30, 2013","Obama: A government shutdown is not inevitable. ""It does not have to happen.""","28","158","22","","","","1"
"1","CNN Breaking News","Sep 30, 2013","Obama: A government shutdown would represent the ""height of irresponsibility,"" Watch live on CNN TV.","36","215","39","","","","1"
"1","CNN Breaking News","Sep 30, 2013","Obama: A federal shutdown would throw wrench into the gears of the economy. Watch live on CNN TV.","20","113","12","","","","1"
"1","CNN Breaking News","Sep 30, 2013","Obama on the fate of furloughed federal workers: ""What will not be furloughed are the bills they have to pay.""","31","233","40","","","","1"
"1","CNN Breaking News","Sep 30, 2013","Obama: Social Security, Medicare, mail and gov't operations on nat'l security will continue if government shutdowns.","18","241","33","","","","1"
"1","CNN Breaking News","Sep 30, 2013","Building company: CEO and his son believed dead in Santa Monica plane crash.","12","59","19","","","","1"
"1","CNN Breaking News","Sep 30, 2013","Senate rejects House proposal to derail Obamacare, sharply raising chances of a shutdown beginning at midnight.","54","513","49","","","","1"
"1","CNN Breaking News","Sep 30, 2013","Keep track of the latest developments on a possible government shutdown with our live blog:","30","136","39","","","","1"
"1","CNN Breaking News","Sep 30, 2013","String of deadly car bombings highlights rising concern about security in Iraq.","18","66","13","","","","1"
"1","CNN Breaking News","Sep 30, 2013","Syrian foreign minister at U.N. General Assembly: ""There is no civil war""","69","93","21","","","","1"
"1","CNN Breaking News","Sep 30, 2013","Dozens injured when two commuter trains collide near Chicago.","51","302","36","","","","1"
"1","CNN Breaking News","Sep 30, 2013","Dozens injured when two commuter trains collide near Chicago.","51","302","36","","","","1"
"1","CNN Breaking News","Sep 30, 2013","""Breaking Bad"" ends final show with a bang. (Spoiler Alert!)","46","244","149","","","","1"
"1","CNN Breaking News","Sep 30, 2013","No survivors in Santa Monica plane crash, number of people on board unknown","46","368","34","","","","1"
"1","CNN Breaking News","Sep 30, 2013","Small plane crashes at Santa Monica Airport","28","167","28","","","","1"
"1","CNN Breaking News","Sep 29, 2013","Gunmen open fire on sleeping college students in Nigeria.","127","526","42","","","","1"
"1","CNN Breaking News","Sep 29, 2013","Bomb blast in Peshawar, Pakistan, kills at least 38, injures about 100, hospital officials say.","30","176","31","","","","1"
"1","CNN Breaking News","Sep 29, 2013","USC fires head football coach Lane Kiffin.","145","591","127","https://pbs.twimg.com/card_img/1335500630396301314/6TZHhi7H?format=jpg&name=small","https://pbs.twimg.com/card_img/1335500630396301314/6TZHhi7H?format=jpg&name=small","http://t.co/TcdXxXW1RI?amp=1","1"
"1","Lane Kiffin Fired as USC Trojans Head Coach","","USC fires head football coach Lane Kiffin.","145","591","127","https://pbs.twimg.com/card_img/1335500630396301314/6TZHhi7H?format=jpg&name=small","https://pbs.twimg.com/card_img/1335500630396301314/6TZHhi7H?format=jpg&name=small","http://t.co/TcdXxXW1RI?amp=1","1"
"1","Lane Kiffin has been removed from his post as head coach of USC's football team following the team's 62-41 loss to Arizona State on Saturday night...","","USC fires head football coach Lane Kiffin.","145","591","127","https://pbs.twimg.com/card_img/1335500630396301314/6TZHhi7H?format=jpg&name=small","https://pbs.twimg.com/card_img/1335500630396301314/6TZHhi7H?format=jpg&name=small","http://t.co/TcdXxXW1RI?amp=1","1"
"1","bleacherreport.com","","USC fires head football coach Lane Kiffin.","145","591","127","https://pbs.twimg.com/card_img/1335500630396301314/6TZHhi7H?format=jpg&name=small","https://pbs.twimg.com/card_img/1335500630396301314/6TZHhi7H?format=jpg&name=small","http://t.co/TcdXxXW1RI?amp=1","1"
"1","CNN Breaking News","Sep 29, 2013","House Republicans push through amended spending plan that would delay Obamacare a year, wipe out medical devices tax.","60","334","77","","","","1"
"1","CNN Breaking News","Sep 29, 2013","Kenyan intelligence warned officials of Al-Shabaab threat before mall attack.","28","153","30","","","","1"
"1","CNN Breaking News","Sep 29, 2013","House begins debate on Obamacare amendments to federal funding bill.","55","147","24","","","","1"
"1","CNN Breaking News","Sep 29, 2013","Louisiana pastor shot and killed while preaching.","257","804","92","","","","1"
"1","CNN Breaking News","Sep 28, 2013","White House says Obama would veto the House funding bill proposal if it reached his desk.","88","187","51","","","","1"
"1","CNN Breaking News","Sep 28, 2013","through a govt. funding bill ""reckless and irresponsible."" //on.cnn.com/163qipq","73","163","44","","","","1"
"1","CNN Breaking News","Sep 28, 2013","Harry Reid: House vote on Obamacare amendments is ""pointless,"" a revised bill won't pass Senate.","37","79","23","","","","1"
"1","CNN Breaking News","Sep 28, 2013","Cuba to allow athletes to seek pro contracts abroad.","62","406","78","","","","1"
"1","CNN Breaking News","Sep 28, 2013","Boehner: House to vote today on amendments to funding bill that would delay Obamacare, repeal medical devices tax.","50","177","26","","","","1"
"1","CNN Breaking News","Sep 28, 2013","Dozens dead, 100 missing in Nigeria boat accident.","40","333","33","","","","1"
"1","CNN Breaking News","Sep 28, 2013","Miss World 2013 is crowned, was born in U.S.","286","611","168","","","","1"
"1","CNN Breaking News","Sep 28, 2013",".","124","224","59","","","","1"
"1","CNN Breaking News","Sep 28, 2013","Mitt Romney reveals his ""largest strategic error"" from 2012 campaign to CNN's Jake Tapper.","177","161","80","","","","1"
"1","CNN Breaking News","Sep 28, 2013","Resolution doesn't authorize automatic use of force if Syria is in violation.","24","98","18","","","","1"
"1","CNN Breaking News","Sep 28, 2013","Security Council unanimously adopts resolution requiring Syria to eliminate chemical weapons.","28","201","30","","","","1"
"1","CNN Breaking News","Sep 27, 2013","Group OKs plan to fast-track Syria's addition to Chemical Weapons Convention.","4","36","9","","","","1"
"1","CNN Breaking News","Sep 27, 2013","National Security Adviser Susan Rice tells CNN's Fareed Zakaria that Rouhani asked Obama to call him.","36","102","19","","","","1"
"1","CNN Breaking News","Sep 27, 2013","Mitt Romney tells CNN's Jake Tapper that he disagrees with GOP ""tactics"" on Obamacare.","57","182","47","","","","1"
"1","CNN Breaking News","Sep 27, 2013","Obama after talk with Rouhani: Comprehensive deal possible on Iran's nuclear ambitions.","22","107","29","","","","1"
"1","CNN Breaking News","Sep 27, 2013","Imprisoned Pussy Riot member in hospital after 5 days without food.","52","203","37","","","","1"
"1","CNN Breaking News","Sep 27, 2013","Administration spending $45 million to put armed police officers in schools.","85","189","40","","","","1"
"1","CNN Breaking News","Sep 27, 2013","Same-sex marriages must be allowed in New Jersey, judge rules.","81","652","240","","","","1"
"1","CNN Breaking News","Sep 27, 2013","Dow and S&P finish the week down 1%.","11","28","6","","","","1"
"1","CNN Breaking News","Sep 27, 2013","Obama: GOP ""grandstanding"" on shutdown ""has real effects on real people.""","39","93","17","","","","1"
"1","CNN Breaking News","Sep 27, 2013","President Obama says he has spoken with Iranian President Rouhani.","32","127","43","","","","1"
"1","CNN Breaking News","Sep 27, 2013","Imprisoned Pussy Riot member in hospital after 5 days without food","70","235","41","","","","1"
"1","CNN Breaking News","Sep 27, 2013","Hostage standoff between Philippines forces, separatist rebels over, military says.","10","68","13","","","","1"
"1","CNN Breaking News","Sep 27, 2013","At least 13 dead after Mumbai building collapse; dozens feared trapped","14","85","14","","","","1"
"1","CNN Breaking News","Sep 27, 2013","Democratic-led Senate tosses shutdown hot potato back to House","22","62","21","","","","1"
"1","CNN Breaking News","Sep 27, 2013","Airline captain dies after suffering in-flight heart attack","72","299","37","","","","1"
"1","CNN Breaking News","Sep 27, 2013","Resolution on Syria's chemical weapons could be up for vote at Security Council Friday.","9","100","17","","","","1"
"1","CNN Breaking News","Sep 27, 2013","2 plead not guilty in killing of British soldier near London barracks.","19","58","15","","","","1"
"1","CNN Breaking News","Sep 27, 2013","At least 5 dead, dozens feared trapped after Mumbai building collapse.","15","89","9","","","","1"
"1","CNN Breaking News","Sep 27, 2013","U.N.: Human activity caused at least half of climate change in the last half century,","80","253","42","","","","1"
"1","CNN Breaking News","Sep 27, 2013","Resolution on Syria's chemical weapons could be up for vote at Security Council Friday.","9","100","17","","","","1"
"1","CNN Breaking News","Sep 27, 2013","2 plead not guilty in killing of British soldier near London barracks.","19","58","15","","","","1"
"1","CNN Breaking News","Sep 27, 2013","At least 5 dead, dozens feared trapped after Mumbai building collapse.","15","89","9","","","","1"
"1","CNN Breaking News","Sep 27, 2013","U.N.: Human activity caused at least half of climate change in the last half century,","80","253","42","","","","1"
"1","CNN Breaking News","Sep 27, 2013","Bus blast in Pakistan kills at least 17 people, wounds more than 30 others.","17","98","19","","","","1"
"1","CNN Breaking News","Sep 27, 2013","UN climate change report says it's ""extremely likely"" that human activity accounts for at least half of global warming since 1950s.","59","326","76","","","","1"
"1","CNN Breaking News","Sep 27, 2013","NSA report: Some NSA workers used surveillance power to snoop on their love interests.","206","475","103","","","","1"
"1","CNN Breaking News","Sep 27, 2013","U.N. Security Council could vote Friday on Syria resolution.","16","116","27","","","","1"
"1","CNN Breaking News","Sep 27, 2013","Republican divisions force delay in Boehner's debt strategy.","25","54","15","","","","1"
"1","CNN Breaking News","Sep 27, 2013","Admitted rapist released after serving month long prison sentence.","128","199","14","","","","1"
"1","CNN Breaking News","Sep 27, 2013","Arrest made in Miss Teen USA 'sextortion' case.","21","102","39","","","","1"
"1","CNN Breaking News","Sep 27, 2013","Six people arrested after former NFL player's home is trashed.","47","158","50","","","","1"
"1","CNN Breaking News","Sep 26, 2013","U.S. officials: Some of the Kenya mall attackers may have escaped.","25","142","26","","","","1"
"1","CNN Breaking News","Sep 26, 2013","New trial ordered for woman who got 20 years for firing a gun to scare off husband.","167","761","223","","","","1"
"1","CNN Breaking News","Sep 26, 2013","Al Qaeda reportedly focusing on low-cost attacks at places like schools and hotels.","112","310","47","","","","1"
"1","CNN Breaking News","Sep 26, 2013","Jurors begin deliberations in the Michael Jackson wrongful-death trial.","16","114","18","","","","1"
"1","CNN Breaking News","Sep 26, 2013","A man is being held at a Kenyan military hospital in connection with the Nairobi mall attack.","9","104","15","","","","1"
"1","CNN Breaking News","Sep 26, 2013","Montana rapist freed after monthlong sentence.","113","181","17","","","","1"
"1","CNN Breaking News","Sep 26, 2013","9 Japanese auto parts manufacturers, 2 execs plead guilty for price-fixing conspiracies.","15","128","70","","","","1"
"1","CNN Breaking News","Sep 26, 2013","At Kenya's request, Interpol issues alert for 'White Widow'","24","156","19","","","","1"
"1","CNN Breaking News","Sep 26, 2013","New trial ordered for woman in controversial Florida warning-shot case","99","466","79","","","","1"
"1","CNN Breaking News","Sep 26, 2013","Iranian President Hassan Rouhani calls for ""total elimination"" of nuclear weapons.","82","338","93","","","","1"
"1","CNN Breaking News","Sep 26, 2013","Human remains have been found on wrecked Costa Concordia, Italian agency says.","22","163","27","","","","1"
"1","CNN Breaking News","Sep 26, 2013","via","13","63","18","","","","1"
"1","CNN Breaking News","Sep 26, 2013","via","55","192","97","","","","1"
"1","CNN Breaking News","Sep 26, 2013","Court upholds war crimes conviction of ex-Liberian president Charles Taylor","15","70","14","","","","1"
"1","CNN Breaking News","Sep 26, 2013","Blasts rock outdoor markets in Baghdad; 18 dead, 50 wounded","17","74","15","","","","1"
"1","CNN Breaking News","Sep 26, 2013","Death toll in Pakistan earthquake rises to 350.","10","167","25","","","","1"
