"listing_value","tweets_Name","tweets_Date","tweets_Text","tweets_Replies","tweets_Retweets","tweets_Likes","tweets_Images","tweets_imageURL","tweets_hrefURL","remove"
"1","CNN Breaking News","Dec 31, 2013","Utah asks Supreme Court to block same-sex marriage.","85","131","96","","","","1"
"1","CNN Breaking News","Dec 31, 2013","Catholic groups ask Supreme Court to delay Obamacare mandate.","48","177","102","","","","1"
"1","CNNPolitics - Political News, Analysis and Opinion","","Catholic groups ask Supreme Court to delay Obamacare mandate.","48","177","102","","","","1"
"1","Politics at CNN has news, opinion and analysis of American and global politics Find news and video about elections, the White House, the U.N and much more.","","Catholic groups ask Supreme Court to delay Obamacare mandate.","48","177","102","","","","1"
"1","cnn.com","","Catholic groups ask Supreme Court to delay Obamacare mandate.","48","177","102","","","","1"
"1","CNN Breaking News","Dec 31, 2013","In loving memory of the incandescent light bulb, flickering towards oblivion, we offer this obit. RIP, ye bulbs.","59","590","242","https://pbs.twimg.com/card_img/1335318165811814402/8btY8pkS?format=jpg&name=240x240","https://pbs.twimg.com/card_img/1335318165811814402/8btY8pkS?format=jpg&name=240x240","http://t.co/7Y8IAX6BBN?amp=1","1"
"1","Obit: RIP, light bulb","","In loving memory of the incandescent light bulb, flickering towards oblivion, we offer this obit. RIP, ye bulbs.","59","590","242","https://pbs.twimg.com/card_img/1335318165811814402/8btY8pkS?format=jpg&name=240x240","https://pbs.twimg.com/card_img/1335318165811814402/8btY8pkS?format=jpg&name=240x240","http://t.co/7Y8IAX6BBN?amp=1","1"
"1","It lit up the world and showed us all our way. It served presidents, princes, and paupers alike. RIP, traditional light bulb.","","In loving memory of the incandescent light bulb, flickering towards oblivion, we offer this obit. RIP, ye bulbs.","59","590","242","https://pbs.twimg.com/card_img/1335318165811814402/8btY8pkS?format=jpg&name=240x240","https://pbs.twimg.com/card_img/1335318165811814402/8btY8pkS?format=jpg&name=240x240","http://t.co/7Y8IAX6BBN?amp=1","1"
"1","cnn.com","","In loving memory of the incandescent light bulb, flickering towards oblivion, we offer this obit. RIP, ye bulbs.","59","590","242","https://pbs.twimg.com/card_img/1335318165811814402/8btY8pkS?format=jpg&name=240x240","https://pbs.twimg.com/card_img/1335318165811814402/8btY8pkS?format=jpg&name=240x240","http://t.co/7Y8IAX6BBN?amp=1","1"
"1","CNN Breaking News","Dec 31, 2013","More than 2 million people will have health insurance under Obamacare at the start of 2014.","139","442","217","","","","1"
"1","CNN Breaking News","Dec 31, 2013","Did you give someone a Target gift card for the holidays? It may not be activated.","91","443","141","","","","1"
"1","Target's latest holiday shopping problem","","Did you give someone a Target gift card for the holidays? It may not be activated.","91","443","141","","","","1"
"1","Target confirms that some gift cards aren't working properly, but it's not related to the recent credit card breach.","","Did you give someone a Target gift card for the holidays? It may not be activated.","91","443","141","","","","1"
"1","money.cnn.com","","Did you give someone a Target gift card for the holidays? It may not be activated.","91","443","141","","","","1"
"1","CNN Breaking News","Dec 31, 2013","Journalist tries to sneak into Michael Schumacher's hospital room where the F1 driver is being treated for a severe brain injury....","130","270","75","","","","1"
"1","CNN Breaking News","Dec 31, 2013","Court orders arrest of apparel factory owner, five others, in deadly blaze","6","172","50","","","","1"
"1","CNN Breaking News","Dec 31, 2013","Death toll from Russia's Volgograd attacks rises to 34","25","279","73","","","","1"
"1","CNN Breaking News","Dec 31, 2013","Sorry about that, Nicole.","1","6","5","","","","1"
"1","CNN Breaking News","Dec 31, 2013",". Sorry, Raissa. There really is a human behind this account.","2","8","6","","","","1"
"1","CNN Breaking News","Dec 31, 2013","Sorry, Sarah.","2","4","3","","","","1"
"1","CNN Breaking News","Dec 31, 2013","Arizona mother accused of poisoning children on Christmas. This is the correct link.","58","201","211","","","","1"
"1","CNN Breaking News","Dec 31, 2013","Arizona mother accused of poisoning children on Christmas.","121","286","97","","","","1"
"1","CNN Breaking News","Dec 31, 2013",".","32","286","91","","","","1"
"1","CNN Breaking News","Dec 31, 2013","Judge extends TRO for Jahi McMath, meaning hospital can't disconnect her from life support until Jan. 7.","44","154","67","","","","1"
"1","CNN Breaking News","Dec 30, 2013","Bad weather forces 2nd icebreaker trying to reach ship stuck in Antarctic ice to suspend rescue effort","31","202","92","","","","1"
"1","CNN Breaking News","Dec 30, 2013","At least 10 killed in trolleybus explosion Monday morning in Volgograd, Russia. Explosion comes day after suicide bombing at train station","35","536","111","","","","1"
"1","CNN Breaking News","Dec 30, 2013","Man missing after jumping from cruise ship.","106","199","228","","","","1"
"1","CNN Breaking News","Dec 29, 2013","Suspected cop killer and bank robber Identified after being shot to death.","25","182","106","","","","1"
"1","CNN Breaking News","Dec 29, 2013","Michael Schumacher in critical condition after skiing accident.","236","1.8K","344","https://pbs.twimg.com/card_img/1335906014516928512/tJwDI7wc?format=jpg&name=small","https://pbs.twimg.com/card_img/1335906014516928512/tJwDI7wc?format=jpg&name=small","http://t.co/utbmTH82NV?amp=1","1"
"1","Michael Schumacher in critical condition after skiing accident","","Michael Schumacher in critical condition after skiing accident.","236","1.8K","344","https://pbs.twimg.com/card_img/1335906014516928512/tJwDI7wc?format=jpg&name=small","https://pbs.twimg.com/card_img/1335906014516928512/tJwDI7wc?format=jpg&name=small","http://t.co/utbmTH82NV?amp=1","1"
"1","Retired Formula One driver Michael Schumacher is in critical condition after a skiing accident in the French Alps Sunday.","","Michael Schumacher in critical condition after skiing accident.","236","1.8K","344","https://pbs.twimg.com/card_img/1335906014516928512/tJwDI7wc?format=jpg&name=small","https://pbs.twimg.com/card_img/1335906014516928512/tJwDI7wc?format=jpg&name=small","http://t.co/utbmTH82NV?amp=1","1"
"1","cnn.com","","Michael Schumacher in critical condition after skiing accident.","236","1.8K","344","https://pbs.twimg.com/card_img/1335906014516928512/tJwDI7wc?format=jpg&name=small","https://pbs.twimg.com/card_img/1335906014516928512/tJwDI7wc?format=jpg&name=small","http://t.co/utbmTH82NV?amp=1","1"
"1","CNN Breaking News","Dec 29, 2013","Some minimum wage workers will soon see higher paychecks.","69","397","225","","","","1"
"1","Minimum wage to rise in 13 states on Jan. 1","","Some minimum wage workers will soon see higher paychecks.","69","397","225","","","","1"
"1","Most increases amount to less than 15 cents per hour, but workers in New Jersey, Connecticut, New York and Rhode Island will see a bigger bump.","","Some minimum wage workers will soon see higher paychecks.","69","397","225","","","","1"
"1","money.cnn.com","","Some minimum wage workers will soon see higher paychecks.","69","397","225","","","","1"
"1","CNN Breaking News","Dec 29, 2013","Formula 1 champion Michael Schumacher injured in ski accident, French media report.","83","817","138","https://pbs.twimg.com/card_img/1335906014516928512/tJwDI7wc?format=jpg&name=small","https://pbs.twimg.com/card_img/1335906014516928512/tJwDI7wc?format=jpg&name=small","http://t.co/utbmTH82NV?amp=1","1"
"1","Michael Schumacher in critical condition after skiing accident","","Formula 1 champion Michael Schumacher injured in ski accident, French media report.","83","817","138","https://pbs.twimg.com/card_img/1335906014516928512/tJwDI7wc?format=jpg&name=small","https://pbs.twimg.com/card_img/1335906014516928512/tJwDI7wc?format=jpg&name=small","http://t.co/utbmTH82NV?amp=1","1"
"1","Retired Formula One driver Michael Schumacher is in critical condition after a skiing accident in the French Alps Sunday.","","Formula 1 champion Michael Schumacher injured in ski accident, French media report.","83","817","138","https://pbs.twimg.com/card_img/1335906014516928512/tJwDI7wc?format=jpg&name=small","https://pbs.twimg.com/card_img/1335906014516928512/tJwDI7wc?format=jpg&name=small","http://t.co/utbmTH82NV?amp=1","1"
"1","cnn.com","","Formula 1 champion Michael Schumacher injured in ski accident, French media report.","83","817","138","https://pbs.twimg.com/card_img/1335906014516928512/tJwDI7wc?format=jpg&name=small","https://pbs.twimg.com/card_img/1335906014516928512/tJwDI7wc?format=jpg&name=small","http://t.co/utbmTH82NV?amp=1","1"
"1","CNN Breaking News","Dec 29, 2013","More than 1.1 million people enrolled in Obamacare between October 1 and December 24, government says.","95","328","155","","","","1"
"1","CNN Breaking News","Dec 29, 2013","Report: 18 die as second bomb attack in 2 months strikes Russian city.","42","427","134","","","","1"
"1","CNN Breaking News","Dec 29, 2013","Report by The New York Times casts doubt on al Qaeda involvement in Benghazi.","53","294","162","","","","1"
"1","CNN Breaking News","Dec 29, 2013","Chinese icebreaker that got stuck in ice while coming to the aid of a research ship has turned back.","35","212","78","","","","1"
"1","CNN Breaking News","Dec 29, 2013","In a message to Pope Francis, Syrian President al-Assad says he's ready for peace talks.","69","594","278","","","","1"
"1","CNN Breaking News","Dec 29, 2013","500 Chinese lawmakers reportedly forced to quit over election fraud.","48","283","105","","","","1"
"1","CNN Breaking News","Dec 29, 2013","Landscaper rakes in $1 million after finding lottery ticket in pile of leaves.","153","784","531","","","","1"
"1","CNN Breaking News","Dec 28, 2013","Manhunt on for bank robbery suspect who killed one cop and wounded another.","70","466","165","https://pbs.twimg.com/media/BcnEvZ0CAAAwVUy?format=jpg&name=small","","","1"
"1","CNN Breaking News","Dec 28, 2013","Israel says it will release 26 Palestinian prisoners over next two days.","36","278","130","","","","1"
"1","CNN Breaking News","Dec 28, 2013","Secretary of State John Kerry will travel to Middle East next week for peace talks, State Department official says.","54","241","115","","","","1"
"1","CNN Breaking News","Dec 28, 2013","5.8-magnitude earthquake hits off coast of Turkey, U.S. Geological Survey reports.","23","449","96","","","","1"
"1","CNN Breaking News","Dec 28, 2013","Airstrike in Syrian city of Aleppo kills at least 20, Syrian opposition group says.","16","100","65","","","","1"
"1","CNN Breaking News","Dec 28, 2013","4 U.S. military personnel held in Libya were released, says Pentagon official.","22","161","124","","","","1"
"1","CNN Breaking News","Dec 28, 2013","4 U.S. military personnel detained in Libya, senior Pentagon official says.","20","168","65","","","","1"
"1","CNN Breaking News","Dec 28, 2013","#ItPaysToBeHonest","195","1K","887","","","","1"
"1","CNN Breaking News","Dec 28, 2013","Family seeks to move girl, brain-dead since tonsillectomy, to another facility.","50","243","117","","","","1"
"1","CNN Breaking News","Dec 27, 2013","72 peacekeepers arrive in South Sudan capital, United Nations says.","19","157","59","","","","1"
"1","CNN Breaking News","Dec 27, 2013","#DuckDynasty","134","299","186","","","","1"
"1","CNN Breaking News","Dec 27, 2013","A&E says it will resume filming ""Duck Dynasty"" with ""entire Robertson family.”","247","1K","633","","","","1"
"1","CNN Breaking News","Dec 27, 2013","Newtown school shooting final report is released.","16","283","186","","","","1"
"1","CNN Breaking News","Dec 27, 2013","Dow's run of 7 straight gains and S&P's 5-session winning streak end with modest losses.","7","124","45","","","","1"
"1","CNN Breaking News","Dec 27, 2013","This is awkward. Chinese icebreaker gets stuck en route to stranded ship near Antarctica.","107","668","326","","","","1"
"1","CNN Breaking News","Dec 27, 2013","Backers of Egypt's Muslim Brotherhood battle police; 3 dead, many hurt.","23","195","72","","","","1"
"1","CNN Breaking News","Dec 27, 2013","South Sudan's neighbors threaten to step in to end fighting","12","85","53","","","","1"
"1","CNN Breaking News","Dec 27, 2013","NSA gets win in court over bulk data collection.","65","164","71","","","","1"
"1","CNN Breaking News","Dec 27, 2013","Death toll in Beirut car bombing now at 6, state news says. More than 70 hurt.","25","288","108","","","","1"
"1","CNN Breaking News","Dec 27, 2013","ISAF: Suicide attack kills 3 coalition troops in Kabul on Friday.","8","122","45","","","","1"
"1","CNN Breaking News","Dec 27, 2013","Friday, according to the official Lebanese news agency, NAA. No details yet on injured or dead.","6","286","54","","","","1"
"1","CNN Breaking News","Dec 27, 2013","A Japanese governor has approved a measure to allow for the relocation of a controversial U.S. military base on Okinawa.","21","299","119","","","","1"
"1","CNN Breaking News","Dec 27, 2013","First U.S. priest imprisoned for covering up abuse has his conviction overturned.","69","342","191","","","","1"
"1","CNN Breaking News","Dec 27, 2013","Friday, according to the official Lebanese news agency, NAA. No details yet on injured or dead.","6","286","54","","","","1"
"1","CNN Breaking News","Dec 27, 2013","A Japanese governor has approved a measure to allow for the relocation of a controversial U.S. military base on Okinawa.","21","299","119","","","","1"
"1","CNN Breaking News","Dec 27, 2013","First U.S. priest imprisoned for covering up abuse has his conviction overturned.","69","342","191","","","","1"
"1","CNN Breaking News","Dec 27, 2013","Carnivorous fish hurt 70 people at a beach on the Parana River in Argentina.","145","558","321","","","","1"
"1","CNN Breaking News","Dec 27, 2013","Native Americans sue 'Out of the Furnace' filmmakers.","30","150","104","","","","1"
"1","CNN Breaking News","Dec 27, 2013","Man dressed as a woman gets past airport's $100 million security system.","163","728","353","","","","1"
"1","CNN Breaking News","Dec 26, 2013","Utah will appeal ruling allowing same-sex marriage to U.S. Supreme Court.","67","284","100","","","","1"
"1","CNN Breaking News","Dec 26, 2013","U.S. sending missiles, drones to help Iraq fight al Qaeda.","121","342","118","","","","1"
"1","CNN Breaking News","Dec 26, 2013","Dow hits 50th record-high close of 2013; S&P closes at record high; Nasdaq at 13-year high.","24","208","123","","","","1"
"1","CNN Breaking News","Dec 26, 2013","Jeffrey Ian Pollack, ""Fresh Prince of Bel-Air"" producer, dead at 54.","64","615","162","","","","1"
"1","CNN Breaking News","Dec 26, 2013","Man accused of killing TSA agent at LAX airport pleads not guilty to 11 federal charges.","25","258","72","","","","1"
"1","CNN Breaking News","Dec 26, 2013","Feds charge Texas man with hate crime over alleged ""knockout"" assault.","64","307","188","","","","1"
"1","CNN Breaking News","Dec 26, 2013","CNN poll: Republicans have a 49%-44% edge over Democrats in a generic pre-midterm ballot.","86","257","162","","","","1"
"1","CNNPolitics - Political News, Analysis and Opinion","","CNN poll: Republicans have a 49%-44% edge over Democrats in a generic pre-midterm ballot.","86","257","162","","","","1"
"1","Politics at CNN has news, opinion and analysis of American and global politics Find news and video about elections, the White House, the U.N and much more.","","CNN poll: Republicans have a 49%-44% edge over Democrats in a generic pre-midterm ballot.","86","257","162","","","","1"
"1","cnn.com","","CNN poll: Republicans have a 49%-44% edge over Democrats in a generic pre-midterm ballot.","86","257","162","","","","1"
"1","CNN Breaking News","Dec 26, 2013","is worst ever. Three-quarters say it's a ""do-nothing"" Congress.","101","556","312","","","","1"
"1","CNNPolitics - Political News, Analysis and Opinion","","is worst ever. Three-quarters say it's a ""do-nothing"" Congress.","101","556","312","","","","1"
"1","Politics at CNN has news, opinion and analysis of American and global politics Find news and video about elections, the White House, the U.N and much more.","","is worst ever. Three-quarters say it's a ""do-nothing"" Congress.","101","556","312","","","","1"
"1","cnn.com","","is worst ever. Three-quarters say it's a ""do-nothing"" Congress.","101","556","312","","","","1"
"1","CNN Breaking News","Dec 26, 2013","A prominent Ukrainian activist and journalist was beaten on Christmas by a group of men who dragged her from her car","36","380","154","","","","1"
"1","CNN Breaking News","Dec 26, 2013","Wife of blogger Raif Badawi clarifies that judge in Saudi Arabia recommends Badawi face apostasy charge.","35","224","141","","","","1"
"1","CNN Breaking News","Dec 26, 2013","Saudi Arabian blogger imprisoned under cybercrime law gets death penalty, says wife.","70","504","157","","","","1"
"1","CNN Breaking News","Dec 25, 2013","Iran media: Lawmakers draft bill to enrich uranium up to 60% if new sanctions are imposed.","52","303","132","","","","1"
"1","CNN Breaking News","Dec 25, 2013","Egypt's interim Cabinet labels Muslim Brotherhood a terrorist group.","52","281","143","","","","1"
"1","CNN Breaking News","Dec 25, 2013","Las Vegas cabbie finds $300,000 in backseat, returns it to poker player.","144","618","338","","","","1"
"1","CNN Breaking News","Dec 25, 2013","McDonald's takes down employee website that came out against fast-food burgers.","35","333","197","","","","1"
"1","CNN Breaking News","Dec 25, 2013","Tens of thousands in U.S., Canada without power days after ice storm.","26","255","91","","","","1"
"1","CNN Breaking News","Dec 25, 2013","18 people killed when boat capsizes in Caribbean, Turks and Caicos government says.","37","279","107","","","","1"
"1","17 migrants die when their boat capsizes at Turks and Caicos","","18 people killed when boat capsizes in Caribbean, Turks and Caicos government says.","37","279","107","","","","1"
"1","At least 17 people died and about 55 others were rescued after a boat capsizes near the Turks and Caicos Islands. 33 of rescued will be repatriated to Haiti.","","18 people killed when boat capsizes in Caribbean, Turks and Caicos government says.","37","279","107","","","","1"
"1","cnn.com","","18 people killed when boat capsizes in Caribbean, Turks and Caicos government says.","37","279","107","","","","1"
"1","CNN Breaking News","Dec 25, 2013","Laney Brown, 8-year-old girl whose wish inspired mass Christmas carol celebration, dies.","132","656","308","","","","1"
"1","CNN Breaking News","Dec 25, 2013","Third Turkish Cabinet minister resigns in wake of anti-corruption sting.","21","256","105","","","","1"
"1","CNN Breaking News","Dec 25, 2013","U.S. Embassy in Kabul attacked; no injuries, embassy says.","22","232","71","","","","1"
"1","CNN Breaking News","Dec 25, 2013","18 dead in Baghdad car bombs outside church, at outdoor market, police say.","36","171","63","","","","1"
"1","CNN Breaking News","Dec 25, 2013","Two ministers in government of Turkish Prime Minister Recep Tayyip Erdogan resign in light of anti-corruption sting","6","249","44","","","","1"
"1","CNN Breaking News","Dec 25, 2013","On Christmas Eve, a volunteer firefighter rushes to site of car crash only to find his own daughter dying in wreckage","230","1.3K","616","","","","1"
"1","CNN Breaking News","Dec 25, 2013","Ex-New York Gov. Eliot Spitzer, wife are splitting up","91","187","96","","","","1"
"1","CNN Breaking News","Dec 25, 2013","Kanye West sued by former child star singer over use of song.","86","428","257","","","","1"
"1","CNN Breaking News","Dec 25, 2013","Strangers from India to Jamaica spreading man's ashes after mom's plea on Facebook.","13","159","136","","","","1"
"1","CNN Breaking News","Dec 25, 2013","Colorado issues first retail marijuana licenses.","80","778","525","","","","1"
"1","CNN Breaking News","Dec 24, 2013","Pope Francis celebrates first Midnight Mass. Watch now on CNN.","29","374","251","","","","1"
"1","CNN Breaking News","Dec 24, 2013","'Bang' of display case hitting the floor spooks shoppers, locks down mall.","47","150","91","","","","1"
"1","CNN Breaking News","Dec 24, 2013","Judge says tonsillectomy patient, 13, is brain dead and that life support can end.","83","282","188","","","","1"
"1","CNN Breaking News","Dec 24, 2013","But a man dressed as the Grinch continues the toy giveaway. ""And his heart grew 3 sizes that day.""","24","372","188","","","","1"
"1","CNN Breaking News","Dec 24, 2013","Man dressed as Santa delivering gifts shot with a pellet gun ...","84","458","171","","","","1"
"1","CNN Breaking News","Dec 24, 2013","Pope at Christmas Eve Mass: ""Do not be afraid,"" God has given us ""a light in our darkness.""","51","936","668","","","","1"
"1","CNN Breaking News","Dec 24, 2013","Three 6 Mafia rapper Lord Infamous dies at age 40.","218","1.2K","325","","","","1"
"1","CNN Breaking News","Dec 24, 2013","Security Council OKs 5,500 more troops, 400 police officers for South Sudan.","43","290","102","","","","1"
"1","CNN Breaking News","Dec 24, 2013","New ammonia pump in place, astronauts return to International Space Station.","18","166","117","","","","1"
"1","CNN Breaking News","Dec 24, 2013","FBI says it nabbed suspect in robberies of 20 East Coast banks.","23","116","122","","","","1"
"1","CNN Breaking News","Dec 24, 2013","4-year-old girl killed by Israeli airstrike in Gaza, Hamas sources say.","91","383","125","","","","1"
"1","CNN Breaking News","Dec 24, 2013","Abuses growing in South Sudan conflict, U.N. says.","14","111","76","","","","1"
"1","CNN Breaking News","Dec 24, 2013","Gaza sniper kills Israeli near border, Israeli military says.","27","106","59","","","","1"
"1","CNN Breaking News","Dec 24, 2013","Spacewalk to repair part of International Space Station's cooling system begins.","11","138","94","","","","1"
"1","CNN Breaking News","Dec 24, 2013","CNN Poll: Pope's approval ratings are sky-high","71","338","312","","","","1"
"1","CNN Poll: Pope's approval rating sky-high","","CNN Poll: Pope's approval ratings are sky-high","71","338","312","","","","1"
"1","By Daniel Burke, CNN Belief Blog Co-Editor [twitter-follow screen_name='BurkeCNN'] (CNN) -- As Pope Francis prepares to celebrate his first Christmas at the Vatican, Americans' opinions of the...","","CNN Poll: Pope's approval ratings are sky-high","71","338","312","","","","1"
"1","religion.blogs.cnn.com","","CNN Poll: Pope's approval ratings are sky-high","71","338","312","","","","1"
"1","CNN Breaking News","Dec 24, 2013","Iraqi defense minister unhurt as convoy hits roadside bomb","8","55","30","","","","1"
"1","CNN Breaking News","Dec 24, 2013","#NSA","35","205","151","","","","1"
"1","CNN Breaking News","Dec 24, 2013","Pharmacy at center of last year's big meningitis outbreak agrees to create $100 million fund to compensate victims.","15","175","108","","","","1"
"1","CNN Breaking News","Dec 24, 2013","Pope at Christmas Eve Mass: ""Do not be afraid,"" God has given us ""a light in our darkness.""","51","936","668","","","","1"
"1","CNN Breaking News","Dec 24, 2013","Three 6 Mafia rapper Lord Infamous dies at age 40.","218","1.2K","325","","","","1"
"1","CNN Breaking News","Dec 24, 2013","Security Council OKs 5,500 more troops, 400 police officers for South Sudan.","43","290","102","","","","1"
"1","CNN Breaking News","Dec 24, 2013","New ammonia pump in place, astronauts return to International Space Station.","18","166","117","","","","1"
"1","CNN Breaking News","Dec 24, 2013","FBI says it nabbed suspect in robberies of 20 East Coast banks.","23","116","122","","","","1"
"1","CNN Breaking News","Dec 24, 2013","4-year-old girl killed by Israeli airstrike in Gaza, Hamas sources say.","91","383","125","","","","1"
"1","CNN Breaking News","Dec 24, 2013","Abuses growing in South Sudan conflict, U.N. says.","14","111","76","","","","1"
"1","CNN Breaking News","Dec 24, 2013","Gaza sniper kills Israeli near border, Israeli military says.","27","106","59","","","","1"
"1","CNN Breaking News","Dec 24, 2013","Spacewalk to repair part of International Space Station's cooling system begins.","11","138","94","","","","1"
"1","CNN Breaking News","Dec 24, 2013","CNN Poll: Pope's approval ratings are sky-high","71","338","312","","","","1"
"1","CNN Poll: Pope's approval rating sky-high","","CNN Poll: Pope's approval ratings are sky-high","71","338","312","","","","1"
"1","By Daniel Burke, CNN Belief Blog Co-Editor [twitter-follow screen_name='BurkeCNN'] (CNN) -- As Pope Francis prepares to celebrate his first Christmas at the Vatican, Americans' opinions of the...","","CNN Poll: Pope's approval ratings are sky-high","71","338","312","","","","1"
"1","religion.blogs.cnn.com","","CNN Poll: Pope's approval ratings are sky-high","71","338","312","","","","1"
"1","CNN Breaking News","Dec 24, 2013","Iraqi defense minister unhurt as convoy hits roadside bomb","8","55","30","","","","1"
"1","CNN Breaking News","Dec 24, 2013","#NSA","35","205","151","","","","1"
"1","CNN Breaking News","Dec 24, 2013","Pharmacy at center of last year's big meningitis outbreak agrees to create $100 million fund to compensate victims.","15","175","108","","","","1"
"1","CNN Breaking News","Dec 24, 2013","Egyptian media: Two blasts at government building kill at least 14, injure 130.","25","279","73","","","","1"
"1","CNN Breaking News","Dec 23, 2013","White House condemns ""indiscriminate"" bombing of civilians by Syrian government forces.","59","223","64","","","","1"
"1","CNN Breaking News","Dec 23, 2013","Egypt state-run media: Witnesses hear loud explosion at government building in Mansoura.","9","121","38","","","","1"
