"listing_value","tweets_Name","tweets_Date","tweets_Text","tweets_Replies","tweets_Retweets","tweets_Likes","tweets_Images","tweets_imageURL","tweets_hrefURL","remove"
"1","CNN Breaking News","Jul 31, 2013","DA: Airline employee, fiancee stole luggage in chaos after plane crash at SFO.","90","166","25","","","","1"
"1","CNN Breaking News","Jul 31, 2013","Feds: California teen alleges captivity, sexual abuse on marijuana farm.","27","122","30","","","","1"
"1","CNN Breaking News","Jul 31, 2013","Found: Stradivarius violin worth $1 million reported stolen in 2010.","49","316","123","","","","1"
"1","CNN Breaking News","Jul 31, 2013","Packaged salad mix blamed for cyclospora outbreak.","97","424","43","","","","1"
"1","CNN Breaking News","Jul 30, 2013","tonight at 8, 10 ET on CNN.","10","91","19","","","","1"
"1","CNN Breaking News","Jul 30, 2013","Head of IRS accused of hindering House committee investigation.","31","145","15","","","","1"
"1","CNN Breaking News","Jul 30, 2013","3 former Penn State officials ordered to stand trial in connection with Jerry Sandusky scandal.","21","160","31","","","","1"
"1","CNN Breaking News","Jul 30, 2013","Police: 1 of 3 malnourished men found this month in a Houston garage has died.","16","96","18","","","","1"
"1","CNN Breaking News","Jul 30, 2013","Eileen Brennan, who starred in ""Private Benjamin,"" has died, her representative says.","39","206","18","","","","1"
"1","CNN Breaking News","Jul 30, 2013","Children hurt as vehicle hits daycare center in Kansas City, Missouri, police say.","17","180","12","","","","1"
"1","CNN Breaking News","Jul 30, 2013","Bradley Manning found not guilty of aiding the enemy, guilty of most other charges.","61","657","88","","","","1"
"1","CNN Breaking News","Jul 30, 2013","Driver of derailed Spanish train was on phone with railway staff when crash happened, court says.","29","218","17","","","","1"
"1","CNN Breaking News","Jul 29, 2013","for more 8p ET.","1","15","3","","","","1"
"1","CNN Breaking News","Jul 29, 2013","Arkansas girl, 12, in critical condition with brain-eating amoeba.","193","716","104","","","","1"
"1","CNN Breaking News","Jul 29, 2013","Commuter trains collide in western Switzerland; Swiss media report 33 injured.","57","222","18","","","","1"
"1","CNN Breaking News","Jul 29, 2013","Verdict in Bradley Manning court-martial to be read Tuesday.","9","90","21","","","","1"
"1","CNN Breaking News","Jul 29, 2013","Firefighters in Philadelphia responding to building collapse.","24","147","17","","","","1"
"1","CNN Breaking News","Jul 29, 2013","Value of jewelry stolen in Cannes is close to $136M -- more than twice earlier figure -- official says.","40","239","38","","","","1"
"1","CNN Breaking News","Jul 29, 2013","FBI announces child prostitution crackdown: 150 arrested, 105 children rescued.","128","939","243","","","","1"
"1","CNN Breaking News","Jul 29, 2013","Martin Indyk, ex-U.S. ambassador to Israel, named U.S. special envoy for Israeli-Palestinian talks starting today.","9","66","18","","","","1"
"1","CNN Breaking News","Jul 29, 2013","Pope Francis on gay priests: “If someone is gay and he searches for the Lord ... who am I to judge?”","285","3.2K","1.2K","","","","1"
"1","CNN Breaking News","Jul 29, 2013","Multiple fatalities in helicopter crash in Pennsylvania, police say.","27","181","27","","","","1"
"1","CNN Breaking News","Jul 29, 2013","Death toll rises to at least 36 in Italy bus crash.","26","159","19","","","","1"
"1","CNN Breaking News","Jul 28, 2013","At least 30 killed when bus plunges off overpass in Italy, reports say.","42","340","34","","","","1"
"1","CNN Breaking News","Jul 28, 2013","Driver of train that derailed in Spain has been charged with 79 counts of homicide by professional recklessness.","35","616","81","","","","1"
"1","CNN Breaking News","Jul 28, 2013","At least seven people killed Sunday in bus crash in Italy's Avellino province, Italian news agency ANSA reported.","7","119","18","","","","1"
"1","CNN Breaking News","Jul 28, 2013","Body of man swept away while swimming in rain-swollen North Carolina creek has been found, official says.","10","86","23","","","","1"
"1","CNN Breaking News","Jul 28, 2013","Peace talks between Israelis and Palestinians will formally resume Monday in Washington, U.S. State Department says.","20","274","69","","","","1"
"1","CNN Breaking News","Jul 28, 2013","Authorities believe they have recovered body of second victim in Hudson River boating accident.","14","118","16","","","","1"
"1","CNN Breaking News","Jul 28, 2013","Merger will create world's largest ad agency.","82","360","70","","","","1"
"1","CNN Breaking News","Jul 28, 2013","Robber steals $53 million in jewels in Cannes, France, police say.","105","405","71","","","","1"
"1","CNN Breaking News","Jul 28, 2013","Israel votes to release 104 Palestinian prisoners.","21","166","59","","","","1"
"1","CNN Breaking News","Jul 28, 2013","Nationally syndicated morning radio show host ""Kidd"" Kraddick died Saturday at 53.","251","1.6K","223","","","","1"
"1","CNN Breaking News","Jul 27, 2013","Authorities ""have probable cause to believe"" driver of boat that hit barge was intoxicated.","29","96","19","","","","1"
"1","CNN Breaking News","Jul 27, 2013","Bus carrying teens from camp flips in Indianapolis, killing three people.","51","226","16","","","","1"
"1","CNN Breaking News","Jul 27, 2013","Driver of boat that hit barge, killing bride-to-be, faces vehicular manslaughter charge.","36","216","46","","","","1"
"1","CNN Breaking News","Jul 27, 2013","Police call deadly Florida apartment shooting ""irrational act,"" ID gunman.","40","126","21","","","","1"
"1","CNN Breaking News","Jul 27, 2013","Body found in Hudson River after boating accident identified as missing bride-to-be, sheriff's office says.","29","196","50","","","","1"
"1","CNN Breaking News","Jul 27, 2013","Authorities recover female body in search for two boaters missing after accident in Hudson river.","20","133","20","","","","1"
"1","CNN Breaking News","Jul 27, 2013","Musician JJ Cale, whose songs ""Cocaine"" and ""After Midnight"" were made famous by Eric Clapton, has died.","79","858","78","","","","1"
"1","CNN Breaking News","Jul 27, 2013","Bride-to-be and best man missing, 4 injured in Hudson River boating accident, Coast Guard says.","35","219","33","","","","1"
"1","CNN Breaking News","Jul 27, 2013","Police in Spain accuse driver of reckless homicide in deadly train crash, interior minister says.","21","209","29","","","","1"
"1","CNN Breaking News","Jul 27, 2013","6 people were shot dead in South Fla. standoff before police killed the gunman.","109","548","61","","","","1"
"1","CNN Breaking News","Jul 27, 2013","A gunman killed 6 people at a South Fla. apartment complex before police shot him dead, authorities said early this morning.","57","357","30","","","","1"
"1","CNN Breaking News","Jul 27, 2013","FDA warns to avoid particular brand of vitamin B supplement because it has potentially harmful anabolic steroids.","45","650","123","","","","1"
"1","CNN Breaking News","Jul 27, 2013","Death toll rises as protesters, police clash in Cairo.","25","176","18","","","","1"
"1","CNN Breaking News","Jul 27, 2013","Pro-gun activist Adam Kokesh charged with carrying shotgun in D.C.","59","154","54","","","","1"
"1","CNN Breaking News","Jul 26, 2013","Closing arguments end; Pfc. Bradley Manning's fate now with judge","10","94","20","","","","1"
"1","CNN Breaking News","Jul 26, 2013","Obama administration says it plans to transfer 2 Guantanamo detainees to Algeria.","27","111","13","","","","1"
"1","CNN Breaking News","Jul 26, 2013","San Diego Mayor Filner: My behavior is ""wrong,"" will enter clinic for 2 weeks of ""intensive therapy"" in August.","54","110","16","","","","1"
"1","CNN Breaking News","Jul 26, 2013","San Diego Mayor Filner, accused of sexual harassment, to make 3 p.m ET statement. Will be live on CNN.","18","67","3","","","","1"
"1","CNN Breaking News","Jul 26, 2013","Trayvon Martin's mom: Law kept Zimmerman from being held accountable ""for this awful crime""","133","198","57","","","","1"
"1","CNN Breaking News","Jul 26, 2013","Prosecution rests in 'Whitey' Bulger trial after 30 days.","5","45","9","","","","1"
"1","CNN Breaking News","Jul 26, 2013","Cleveland kidnapping suspect Castro agrees to plead guilty, serve life in prison without parole.","59","418","49","","","","1"
"1","CNN Breaking News","Jul 26, 2013","Officials hope to reopen vandalized Lincoln Memorial later today, after cleaning.","35","145","23","","","","1"
"1","CNN Breaking News","Jul 26, 2013","Italian police arrest more than 100 people in Mafia crackdown.","62","362","82","","","","1"
"1","CNN Breaking News","Jul 26, 2013","Prosecution rests in 'Whitey' Bulger trial after 30 days.","5","45","9","","","","1"
"1","CNN Breaking News","Jul 26, 2013","Cleveland kidnapping suspect Castro agrees to plead guilty, serve life in prison without parole.","59","418","49","","","","1"
"1","CNN Breaking News","Jul 26, 2013","Officials hope to reopen vandalized Lincoln Memorial later today, after cleaning.","35","145","23","","","","1"
"1","CNN Breaking News","Jul 26, 2013","Italian police arrest more than 100 people in Mafia crackdown.","62","362","82","","","","1"
"1","CNN Breaking News","Jul 26, 2013","Lincoln Memorial vandalized, will be closed until it can be cleaned up.","314","583","65","","","","1"
"1","CNN Breaking News","Jul 26, 2013","4 more women, including a retired Navy admiral, accused San Diego's mayor of making unwanted sexual advances.","34","179","19","","","","1"
"1","CNN Breaking News","Jul 26, 2013","OJ Simpson tells parole board he's been a model prisoner and should be released 5 years into his 33-year sentence.","131","407","58","","","","1"
"1","CNN Breaking News","Jul 25, 2013","Justice Dept.: Halliburton to plead guilty to destroying evidence after Deepwater Horizon spill.","77","394","77","","","","1"
"1","CNN Breaking News","Jul 25, 2013","NTSB: Southwest jet that crash-landed at LaGuardia touched nose-gear first.","35","117","14","","","","1"
"1","CNN Breaking News","Jul 25, 2013","Zimmerman juror tells ABC News the man who killed Trayvon Martin ""got away with murder.""","329","1.2K","157","","","","1"
"1","CNN Breaking News","Jul 25, 2013","Facebook soars 30% on strong earnings, lifting Nasdaq 0.7% higher. S&P adds 0.3%, Dow ends flat.","11","124","24","","","","1"
"1","CNN Breaking News","Jul 25, 2013","Ariel Castro close to a plea deal, court source says.","30","86","17","","","","1"
"1","CNN Breaking News","Jul 25, 2013","Holder wants court order forcing Texas to clear voting-rights changes with feds.","24","98","20","","","","1"
"1","CNN Breaking News","Jul 25, 2013","Natural gas has stopped flowing from damaged Gulf well, officials say.","9","127","26","","","","1"
"1","CNN Breaking News","Jul 25, 2013","More than 90 still in hospital after Spain train crash; death toll at 78, official says.","39","312","27","","","","1"
"1","CNN Breaking News","Jul 25, 2013","Police questioning driver in Spain train crash, official says; death toll at 77.","22","133","15","","","","1"
"1","CNN Breaking News","Jul 25, 2013","The woman involved in the latest Anthony Weiner scandal idealized the ex-Congressman, her friend says.","45","59","29","","","","1"
"1","CNN Breaking News","Jul 25, 2013","Star witness against ""Whitey"" Bulger says he cooperated with Feds because, ""I was dead either way.""","10","74","25","","","","1"
"1","CNN Breaking News","Jul 25, 2013","Local media report more than 50 killed in train derailment in northwestern Spain.","44","280","25","","","","1"
"1","CNN Breaking News","Jul 24, 2013","Senate OKs deal to lower interest rates on student loans. It's also expected to pass in House.","92","859","203","","","","1"
"1","CNN Breaking News","Jul 24, 2013","Judge temporarily bars Alabama from enforcing key provision in new abortion law.","19","125","34","","","","1"
"1","CNN Breaking News","Jul 24, 2013","Several deaths reported after fiery train derailment in Spain.","35","251","22","","","","1"
"1","CNN Breaking News","Jul 24, 2013","Source: Caroline Kennedy to be nominated as ambassador to Japan.","35","211","55","","","","1"
"1","CNN Breaking News","Jul 24, 2013","Fort Carson soldiers accused of sexual misconduct involving female minors.","21","98","16","","","","1"
"1","CNN Breaking News","Jul 24, 2013","Obama: 'America back' after recession, but wage inequality 'morally wrong.'","48","153","27","","","","1"
"1","CNN Breaking News","Jul 24, 2013","The Duke and Duchess of Cambridge have named their son George Alexander Louis.","200","1.9K","380","","","","1"
"1","CNN Breaking News","Jul 24, 2013","Lawyer: Snowden hasn't yet received document that would allow him outside of Moscow airport.","21","113","10","","","","1"
"1","CNN Breaking News","Jul 24, 2013","Reports: NSA leaker Snowden able to leave Moscow airport, enter rest of Russia.","36","261","33","","","","1"
"1","CNN Breaking News","Jul 24, 2013","Egyptian general calls for mass demonstrations Friday to back military.","28","98","14","","","","1"
"1","CNN Breaking News","Jul 24, 2013","Court: British man suspected in wife's death should be extradited to South Africa.","7","63","8","","","","1"
"1","CNN Breaking News","Jul 24, 2013","Police: Headmistress of Indian school where poisoned lunches served is arrested.","35","201","32","","","","1"
"1","CNN Breaking News","Jul 24, 2013","2nd of 3 women found slain in Cleveland has been ID'd. Her mother had another child who was killed in December.","13","130","25","","","","1"
"1","CNN Breaking News","Jul 24, 2013","A natural gas rig in the Gulf of Mexico exploded after having had a blowout earlier Tuesday.","32","225","27","","","","1"
"1","CNN Breaking News","Jul 24, 2013","Las Vegas Police officer plunged to death while attempting helicopter rescue of stranded hiker. The hiker survived.","53","411","51","","","","1"
"1","CNN Breaking News","Jul 24, 2013","Taco Bell says it will will drop kid's meals.","374","415","74","","","","1"
"1","CNN Breaking News","Jul 24, 2013","California court denies county clerk's bid to halt same-sex marriages.","25","183","65","","","","1"
"1","CNN Breaking News","Jul 23, 2013","Huma Abedin on husband, Anthony Weiner: ""I love him. I have forgiven him.""","75","88","16","","","","1"
"1","CNN Breaking News","Jul 23, 2013","Weiner admitted that his online sexting continued after he resigned from Congress.","91","161","23","","","","1"
"1","CNN Breaking News","Jul 23, 2013",".","27","59","9","","","","1"
"1","CNN Breaking News","Jul 23, 2013","Analysts: Construction appears to have stopped at North Korean long-range missile site.","12","97","23","","","","1"
"1","CNN Breaking News","Jul 23, 2013","Prince William on new son: ""He's got her looks, thankfully.""","116","719","322","","","","1"
"1","CNN Breaking News","Jul 23, 2013","NTSB to conduct full probe of Southwest nose-gear collapse in NY on Monday.","9","44","11","","","","1"
"1","CNN Breaking News","Jul 23, 2013","Will Rolling Stone's Dzhokhar Tsarnaev cover hurt sales?","75","91","27","","","","1"
"1","CNN Breaking News","Jul 23, 2013","ACLU wants probes into death of man with ties to late Boston bombing suspect.","10","74","25","","","","1"
"1","CNN Breaking News","Jul 23, 2013","U.N. report: 30 million girls still at risk of genital mutilation.","65","386","44","","","","1"
"1","CNN Breaking News","Jul 23, 2013","Analysts: Construction appears to have stopped at North Korean long-range missile site.","12","97","23","","","","1"
"1","CNN Breaking News","Jul 23, 2013","Prince William on new son: ""He's got her looks, thankfully.""","116","719","322","","","","1"
"1","CNN Breaking News","Jul 23, 2013","NTSB to conduct full probe of Southwest nose-gear collapse in NY on Monday.","9","44","11","","","","1"
"1","CNN Breaking News","Jul 23, 2013","Will Rolling Stone's Dzhokhar Tsarnaev cover hurt sales?","75","91","27","","","","1"
"1","CNN Breaking News","Jul 23, 2013","ACLU wants probes into death of man with ties to late Boston bombing suspect.","10","74","25","","","","1"
"1","CNN Breaking News","Jul 23, 2013","U.N. report: 30 million girls still at risk of genital mutilation.","65","386","44","","","","1"
"1","CNN Breaking News","Jul 23, 2013","Suicide bomber in Afghanistan kills 3 coalition soldiers, 1 interpreter.","17","129","12","","","","1"
"1","CNN Breaking News","Jul 23, 2013","Port Authority: Minor injuries for 10 on Southwest jet at LaGuardia. ""Strong jolt"" felt.","23","129","19","","","","1"
"1","CNN Breaking News","Jul 22, 2013","5 passengers hurt when jet’s nose gear fails during LaGuardia landing, source says.","34","234","27","","","","1"
"1","CNN Breaking News","Jul 22, 2013","suspended for rest of MLB season for violating drug policy.","46","257","40","","","","1"
"1","CNN Breaking News","Jul 22, 2013","#RoyalBaby","167","323","97","","","","1"
"1","CNN Breaking News","Jul 22, 2013","#RoyalBaby","120","2.1K","410","","","","1"
"1","CNN Breaking News","Jul 22, 2013","#RoyalBaby","171","2.5K","417","","","","1"
"1","CNN Breaking News","Jul 22, 2013","Snowden did not access 'crown jewels' of NSA intel, official says.","30","99","26","","","","1"
"1","CNN Breaking News","Jul 22, 2013","Judge blocks North Dakota's restrictive abortion law.","26","214","74","","","","1"
"1","CNN Breaking News","Jul 22, 2013","Dennis Farina, well-known TV and film character actor, has died, his representative says..","100","555","55","","","","1"
"1","CNN Breaking News","Jul 22, 2013","Morsy supporters, opponents fight in Cairo; 1 dead, 7 hurt, state news says.","20","85","13","","","","1"
"1","CNN Breaking News","Jul 22, 2013","Man charged days after three bodies found in East Cleveland. Bail at $6 million.","22","131","10","","","","1"
"1","CNN Breaking News","Jul 22, 2013","EU puts Hezbollah military wing on terror list.","27","150","65","","","","1"
"1","CNN Breaking News","Jul 22, 2013","Royal baby is on the way; Catherine enters hospital","215","1.6K","282","","","","1"
"1","CNN Breaking News","Jul 21, 2013","Quake rattles New Zealand, but no deaths reported.","37","181","34","","","","1"
"1","CNN Breaking News","Jul 21, 2013","Chris Froome becomes the second successive Briton to win the Tour de France.","26","150","40","https://pbs.twimg.com/card_img/1334768855441432576/PlyR0n8c?format=jpg&name=small","https://pbs.twimg.com/card_img/1334768855441432576/PlyR0n8c?format=jpg&name=small","http://t.co/78vLUzgNGF?amp=1","1"
"1","Tour De France 2013 Stage 21 Results: Winner, Leaderboard and Highlights","","Chris Froome becomes the second successive Briton to win the Tour de France.","26","150","40","https://pbs.twimg.com/card_img/1334768855441432576/PlyR0n8c?format=jpg&name=small","https://pbs.twimg.com/card_img/1334768855441432576/PlyR0n8c?format=jpg&name=small","http://t.co/78vLUzgNGF?amp=1","1"
"1","German Marcel Kittel was able to emerge from the field in Stage 21 along a flat, 133.5-kilometer (83-mile) course that took the racers from Versailles to Paris...","","Chris Froome becomes the second successive Briton to win the Tour de France.","26","150","40","https://pbs.twimg.com/card_img/1334768855441432576/PlyR0n8c?format=jpg&name=small","https://pbs.twimg.com/card_img/1334768855441432576/PlyR0n8c?format=jpg&name=small","http://t.co/78vLUzgNGF?amp=1","1"
"1","bleacherreport.com","","Chris Froome becomes the second successive Briton to win the Tour de France.","26","150","40","https://pbs.twimg.com/card_img/1334768855441432576/PlyR0n8c?format=jpg&name=small","https://pbs.twimg.com/card_img/1334768855441432576/PlyR0n8c?format=jpg&name=small","http://t.co/78vLUzgNGF?amp=1","1"
"1","CNN Breaking News","Jul 21, 2013","For victim of roller coaster accident, it was her first trip to Six Flags. For family, experience has been nightmare.","77","490","75","","","","1"
"1","CNN Breaking News","Jul 21, 2013","Phil Mickelson wins British Open championship after shooting 66 in final round and finishing 3 under par overall.","34","434","144","https://pbs.twimg.com/card_img/1334392376530522114/55whMUDQ?format=jpg&name=small","https://pbs.twimg.com/card_img/1334392376530522114/55whMUDQ?format=jpg&name=small","http://t.co/PHRlMCajJ5?amp=1","1"
"1","British Open 2013 Leaderboard: Live Day 4 Scores and Results","","Phil Mickelson wins British Open championship after shooting 66 in final round and finishing 3 under par overall.","34","434","144","https://pbs.twimg.com/card_img/1334392376530522114/55whMUDQ?format=jpg&name=small","https://pbs.twimg.com/card_img/1334392376530522114/55whMUDQ?format=jpg&name=small","http://t.co/PHRlMCajJ5?amp=1","1"
"1","Phil Mickelson is your 2013 British Open champion after shooting a 66 in the final round and finishing -3 overall. Full results...","","Phil Mickelson wins British Open championship after shooting 66 in final round and finishing 3 under par overall.","34","434","144","https://pbs.twimg.com/card_img/1334392376530522114/55whMUDQ?format=jpg&name=small","https://pbs.twimg.com/card_img/1334392376530522114/55whMUDQ?format=jpg&name=small","http://t.co/PHRlMCajJ5?amp=1","1"
"1","bleacherreport.com","","Phil Mickelson wins British Open championship after shooting 66 in final round and finishing 3 under par overall.","34","434","144","https://pbs.twimg.com/card_img/1334392376530522114/55whMUDQ?format=jpg&name=small","https://pbs.twimg.com/card_img/1334392376530522114/55whMUDQ?format=jpg&name=small","http://t.co/PHRlMCajJ5?amp=1","1"
"1","CNN Breaking News","Jul 21, 2013","Cleveland police: 3 bodies found; man in custody.","40","210","30","","","","1"
"1","CNN Breaking News","Jul 21, 2013","Correction: U.S. Marine jets dropped the bombs near the Great Barrier Reef.","84","230","50","","","","1"
"1","CNN Breaking News","Jul 21, 2013","US Navy aircraft, running low on fuel, dumped 4 bombs - 2 inert, 2 disarmed - near Australia's Great Barrier Reef.","55","409","51","","","","1"
"1","CNN Breaking News","Jul 21, 2013","King Albert II of Belgium, 79, is abdicating his throne today. His son will take over.","53","381","53","","","","1"
"1","CNN Breaking News","Jul 21, 2013","Bail was set at $200,000 for the man suspected of holding four men captive in a garage in Houston.","24","113","37","","","","1"
"1","CNN Breaking News","Jul 20, 2013","Grandson of homeowner charged in garage captives case.","21","115","21","","","","1"
"1","CNN Breaking News","Jul 20, 2013","Helen Thomas covered 10 presidents over nearly half a century.","74","375","65","","","","1"
"1","CNN Breaking News","Jul 20, 2013","Longtime White House journalist Helen Thomas has died at age 92, sources tell CNN.","100","594","55","","","","1"
"1","CNN Breaking News","Jul 20, 2013","Israel to free some Palestinian prisoners as deal to resume talks emerges.","30","149","29","","","","1"
"1","CNN Breaking News","Jul 20, 2013","5 convicted in deadly Costa Concordia cruise liner wreck in Italy.","9","144","19","","","","1"
"1","CNN Breaking News","Jul 20, 2013","Man sets off explosives inside Beijing airport.","40","424","25","","","","1"
"1","CNN Breaking News","Jul 20, 2013","A U.S. veteran went to North Korea to try to find remains of a fellow pilot.","25","189","82","","","","1"
"1","CNN Breaking News","Jul 20, 2013","Witnesses say the woman who died on a Texas roller coaster fell off during the ride.","226","758","98","","","","1"
"1","CNN Breaking News","Jul 20, 2013","Rallies in 100 cities today to urge Justice Department to investigate civil rights case in Trayvon Martin's death.","98","648","122","","","","1"
"1","CNN Breaking News","Jul 20, 2013","Woman arrested in alleged $480,000 scam of Boston bombing victims' fund.","131","318","35","","","","1"
"1","CNN Breaking News","Jul 20, 2013","Woman dies riding roller coaster at Six Flags Over Texas, park says.","296","1.1K","109","","","","1"
"1","CNN Breaking News","Jul 19, 2013","One of Oskar Schindler's life-saving lists for sale on eBay.","42","292","69","","","","1"
"1","CNN Breaking News","Jul 19, 2013","FISA court renews U.S. surveillance program exposed by NSA leaker Snowden.","33","183","26","","","","1"
"1","CNN Breaking News","Jul 19, 2013","Judge orders Detroit to withdraw bankruptcy filing.","57","423","36","","","","1"
"1","CNN Breaking News","Jul 19, 2013","S&P closes at record high for second straight day.","19","83","22","","","","1"
"1","CNN Breaking News","Jul 19, 2013","More from Kerry: Initial Palestinian-Israeli talks may happen in Washington within next week or so.","13","70","13","","","","1"
"1","CNN Breaking News","Jul 19, 2013","Kerry: Israel, Palestinians agree on ""basis for resuming direct final status"" talks.","14","73","22","","","","1"
"1","CNN Breaking News","Jul 19, 2013","Obama: Americans have been changing attitudes on race, but ""we have to be vigilant and work on these issues.""","44","322","60","","","","1"
"1","CNN Breaking News","Jul 19, 2013","Police: People held captive in Houston home -- some of them for as many as 10 years.","31","303","38","","","","1"
"1","CNN Breaking News","Jul 19, 2013","Asiana Airlines passenger killed by rescue vehicle, was alive at time, authorities say.","64","249","26","","","","1"
"1","CNN Breaking News","Jul 19, 2013","American wanted by Italy in rendition case released in Panama.","5","49","6","","","","1"
"1","CNN Breaking News","Jul 19, 2013","Lab: DNA test links confessed Boston Strangler to woman's 1964 death.","15","133","28","","","","1"
"1","CNN Breaking News","Jul 19, 2013","Florida governor: Sunday ""day of prayer for unity"" over Trayvon Martin case.","71","174","26","","","","1"
"1","CNN Breaking News","Jul 19, 2013","Another school food poisoning case in India: More than 20 sickened during lunch, police say.","35","234","20","","","","1"
"1","CNN Breaking News","Jul 19, 2013","Blast during sermon in Iraq Sunni mosque kills at least 16, officials say.","21","91","9","","","","1"
