"listing_value","tweets_Name","tweets_Date","tweets_Text","tweets_Replies","tweets_Retweets","tweets_Likes","tweets_Images","tweets_imageURL","tweets_hrefURL","remove"
"","cnn.com","","Patricia and Mark McCloskey, the St. Louis homeowners who pointed guns at protesters, plead not guilty to weapons and evidence tampering charges","137","127","347","https://pbs.twimg.com/card_img/1318971369023959040/4LjHfRlG?format=jpg&name=small","https://pbs.twimg.com/card_img/1318971369023959040/4LjHfRlG?format=jpg&name=small","https://t.co/zT3DMSrI4R?amp=1","1"
"","CNN Breaking News","Oct 14","Idaho college investigates reports of students intentionally contracting Covid-19 to sell their plasma","228","736","932","https://pbs.twimg.com/media/EkTp2GsXsAIZRSs?format=jpg&name=small","","","1"
"","CNN Breaking News","Oct 14","Italy records its highest daily coronavirus case increase since the pandemic began","71","307","499","https://pbs.twimg.com/media/EkToUexXgAYvebB?format=jpg&name=small","","","1"
"","CNN Breaking News","Oct 14","New York state will withhold funding to local governments not enforcing closures in Covid-19 cluster areas, Gov. Andrew Cuomo says","145","197","1K","https://pbs.twimg.com/media/EkTcTx8WoAQftQa?format=jpg&name=small","","","1"
"","CNN Breaking News","Oct 14","Supreme Court nominee Amy Coney Barrett says she's never spoken in favor of the Affordable Care Act","220","181","428","https://pbs.twimg.com/media/EkTZxV4WsAQ8MWR?format=jpg&name=small","","","1"
"","CNN Breaking News","Oct 14","Supreme Court nominee Amy Coney Barrett said that ""no one is above the law,"" but would not say one way or another if a president has the right to pardon him or herself","121","227","453","https://pbs.twimg.com/media/EkTRTHFXcAAu7Ka.jpg","","","1"
"","CNN Breaking News","Oct 14","The Manhattan District Attorney's Office files a misdemeanor charge against the White woman who called police on a Black man birdwatching in Central Park in May, revealing that she had made a second 911 call about the encounter","225","690","2.5K","https://pbs.twimg.com/card_img/1316442369403883527/u0iHJPs1?format=jpg&name=small","https://pbs.twimg.com/card_img/1316442369403883527/u0iHJPs1?format=jpg&name=small","https://t.co/V0wuIgCl1q?amp=1","1"
"","Amy Cooper made second 911 call about Black birdwatcher in Central Park, prosecutors say","","The Manhattan District Attorney's Office files a misdemeanor charge against the White woman who called police on a Black man birdwatching in Central Park in May, revealing that she had made a second 911 call about the encounter","225","690","2.5K","https://pbs.twimg.com/card_img/1316442369403883527/u0iHJPs1?format=jpg&name=small","https://pbs.twimg.com/card_img/1316442369403883527/u0iHJPs1?format=jpg&name=small","https://t.co/V0wuIgCl1q?amp=1","1"
"","The Manhattan District Attorney's Office filed a misdemeanor charge Wednesday against the White woman who called police on a Black man birdwatching in Central Park in May and revealed that she had...","","The Manhattan District Attorney's Office files a misdemeanor charge against the White woman who called police on a Black man birdwatching in Central Park in May, revealing that she had made a second 911 call about the encounter","225","690","2.5K","https://pbs.twimg.com/card_img/1316442369403883527/u0iHJPs1?format=jpg&name=small","https://pbs.twimg.com/card_img/1316442369403883527/u0iHJPs1?format=jpg&name=small","https://t.co/V0wuIgCl1q?amp=1","1"
"","cnn.com","","The Manhattan District Attorney's Office files a misdemeanor charge against the White woman who called police on a Black man birdwatching in Central Park in May, revealing that she had made a second 911 call about the encounter","225","690","2.5K","https://pbs.twimg.com/card_img/1316442369403883527/u0iHJPs1?format=jpg&name=small","https://pbs.twimg.com/card_img/1316442369403883527/u0iHJPs1?format=jpg&name=small","https://t.co/V0wuIgCl1q?amp=1","1"
"","CNN Breaking News","Oct 14","Sen. Diane Feinstein, the top Democrat on the Senate Judiciary Committee, has announced a set of outside witnesses who will appear before the committee on the final day of Amy Coney Barrett's confirmation hearing","317","343","1.5K","https://pbs.twimg.com/media/EkS9pBnXgAE-m4B?format=jpg&name=small","","","1"
"","CNN Breaking News","Oct 14","Senators get a second chance to question Trump's Supreme Court pick Amy Coney Barrett after an 11-hour session where she sidestepped saying how she'd rule on key issues","396","144","528","https://pbs.twimg.com/card_img/1318606050598227970/Gom4d5Vh?format=jpg&name=small","https://pbs.twimg.com/card_img/1318606050598227970/Gom4d5Vh?format=jpg&name=small","https://t.co/hzmeTwQQV9?amp=1","1"
"","October 14 Senate Supreme Court confirmation hearing","","Senators get a second chance to question Trump's Supreme Court pick Amy Coney Barrett after an 11-hour session where she sidestepped saying how she'd rule on key issues","396","144","528","https://pbs.twimg.com/card_img/1318606050598227970/Gom4d5Vh?format=jpg&name=small","https://pbs.twimg.com/card_img/1318606050598227970/Gom4d5Vh?format=jpg&name=small","https://t.co/hzmeTwQQV9?amp=1","1"
"","The Senate Judiciary holds its third day of confirmation hearings for President Trump's Supreme Court nominee Amy Coney Barrett. Watch live and follow here for the latest updates.","","Senators get a second chance to question Trump's Supreme Court pick Amy Coney Barrett after an 11-hour session where she sidestepped saying how she'd rule on key issues","396","144","528","https://pbs.twimg.com/card_img/1318606050598227970/Gom4d5Vh?format=jpg&name=small","https://pbs.twimg.com/card_img/1318606050598227970/Gom4d5Vh?format=jpg&name=small","https://t.co/hzmeTwQQV9?amp=1","1"
"","cnn.com","","Senators get a second chance to question Trump's Supreme Court pick Amy Coney Barrett after an 11-hour session where she sidestepped saying how she'd rule on key issues","396","144","528","https://pbs.twimg.com/card_img/1318606050598227970/Gom4d5Vh?format=jpg&name=small","https://pbs.twimg.com/card_img/1318606050598227970/Gom4d5Vh?format=jpg&name=small","https://t.co/hzmeTwQQV9?amp=1","1"
"","CNN Breaking News","Oct 14","Biden and Trump will participate in competing, televised town halls on the night they were originally scheduled to debate","343","274","821","https://pbs.twimg.com/card_img/1317261161700745216/zKLjcjYa?format=jpg&name=small","https://pbs.twimg.com/card_img/1317261161700745216/zKLjcjYa?format=jpg&name=small","https://t.co/ABbQIRscf1?amp=1","1"
"","Trump and Biden will participate in competing town halls after cancellation of second debate","","Biden and Trump will participate in competing, televised town halls on the night they were originally scheduled to debate","343","274","821","https://pbs.twimg.com/card_img/1317261161700745216/zKLjcjYa?format=jpg&name=small","https://pbs.twimg.com/card_img/1317261161700745216/zKLjcjYa?format=jpg&name=small","https://t.co/ABbQIRscf1?amp=1","1"
"","President Donald Trump will participate in a town hall with NBC News on Thursday night, setting up a competing television event with Joe Biden in lieu of a presidential debate in which voters would...","","Biden and Trump will participate in competing, televised town halls on the night they were originally scheduled to debate","343","274","821","https://pbs.twimg.com/card_img/1317261161700745216/zKLjcjYa?format=jpg&name=small","https://pbs.twimg.com/card_img/1317261161700745216/zKLjcjYa?format=jpg&name=small","https://t.co/ABbQIRscf1?amp=1","1"
"","cnn.com","","Biden and Trump will participate in competing, televised town halls on the night they were originally scheduled to debate","343","274","821","https://pbs.twimg.com/card_img/1317261161700745216/zKLjcjYa?format=jpg&name=small","https://pbs.twimg.com/card_img/1317261161700745216/zKLjcjYa?format=jpg&name=small","https://t.co/ABbQIRscf1?amp=1","1"
"","CNN Breaking News","Oct 13","The Supreme Court has granted the Trump administration's request to halt the census count while an appeal plays out, a win for the administration","86","152","238","https://pbs.twimg.com/card_img/1318987677606289410/YjR04QX4?format=jpg&name=small","https://pbs.twimg.com/card_img/1318987677606289410/YjR04QX4?format=jpg&name=small","https://t.co/WrlDmr6RIM?amp=1","1"
"","Supreme Court grants Trump administration's request to halt census count while appeal plays out","","The Supreme Court has granted the Trump administration's request to halt the census count while an appeal plays out, a win for the administration","86","152","238","https://pbs.twimg.com/card_img/1318987677606289410/YjR04QX4?format=jpg&name=small","https://pbs.twimg.com/card_img/1318987677606289410/YjR04QX4?format=jpg&name=small","https://t.co/WrlDmr6RIM?amp=1","1"
"","The Supreme Court on Tuesday granted a request from the Trump administration to halt the census count while an appeal plays out over a lower court's order that it continue.","","The Supreme Court has granted the Trump administration's request to halt the census count while an appeal plays out, a win for the administration","86","152","238","https://pbs.twimg.com/card_img/1318987677606289410/YjR04QX4?format=jpg&name=small","https://pbs.twimg.com/card_img/1318987677606289410/YjR04QX4?format=jpg&name=small","https://t.co/WrlDmr6RIM?amp=1","1"
"","cnn.com","","The Supreme Court has granted the Trump administration's request to halt the census count while an appeal plays out, a win for the administration","86","152","238","https://pbs.twimg.com/card_img/1318987677606289410/YjR04QX4?format=jpg&name=small","https://pbs.twimg.com/card_img/1318987677606289410/YjR04QX4?format=jpg&name=small","https://t.co/WrlDmr6RIM?amp=1","1"
"","CNN Breaking News","Oct 13","An elderly Dutch woman has become the first known person to die from catching Covid-19 twice, according to experts, raising serious questions about how long immunity and antibodies can last","251","2.2K","2.6K","https://pbs.twimg.com/card_img/1318916211615387649/Ih_u-US4?format=jpg&name=small","https://pbs.twimg.com/card_img/1318916211615387649/Ih_u-US4?format=jpg&name=small","https://t.co/fZYjW7wIOq?amp=1","1"
"","Dutch woman dies after catching Covid-19 twice","","An elderly Dutch woman has become the first known person to die from catching Covid-19 twice, according to experts, raising serious questions about how long immunity and antibodies can last","251","2.2K","2.6K","https://pbs.twimg.com/card_img/1318916211615387649/Ih_u-US4?format=jpg&name=small","https://pbs.twimg.com/card_img/1318916211615387649/Ih_u-US4?format=jpg&name=small","https://t.co/fZYjW7wIOq?amp=1","1"
"","An elderly Dutch woman has become the first known person to die from catching Covid-19 twice, according to experts, raising serious questions about how long immunity and antibodies can last.","","An elderly Dutch woman has become the first known person to die from catching Covid-19 twice, according to experts, raising serious questions about how long immunity and antibodies can last","251","2.2K","2.6K","https://pbs.twimg.com/card_img/1318916211615387649/Ih_u-US4?format=jpg&name=small","https://pbs.twimg.com/card_img/1318916211615387649/Ih_u-US4?format=jpg&name=small","https://t.co/fZYjW7wIOq?amp=1","1"
"","cnn.com","","An elderly Dutch woman has become the first known person to die from catching Covid-19 twice, according to experts, raising serious questions about how long immunity and antibodies can last","251","2.2K","2.6K","https://pbs.twimg.com/card_img/1318916211615387649/Ih_u-US4?format=jpg&name=small","https://pbs.twimg.com/card_img/1318916211615387649/Ih_u-US4?format=jpg&name=small","https://t.co/fZYjW7wIOq?amp=1","1"
"","CNN Breaking News","Oct 13","World No. 1 ranked golfer Dustin Johnson has tested positive for Covid-19, the PGA Tour says in a statement","51","167","372","https://pbs.twimg.com/media/EkPGFaXXgAIvL2E?format=jpg&name=small","","","1"
"","CNN Breaking News","Oct 13","Drugmaker Eli Lilly says it is pausing its trial of a combination antibody treatment for coronavirus due to safety reasons","68","344","670","https://pbs.twimg.com/media/EkOz10VXsAMGTEn?format=jpg&name=small","","","1"
"","CNN Breaking News","Oct 13","Apple unveils iPhones with 5G connectivity and a new model that is smaller, thinner and has double the pixels of the iPhone 11. Follow live updates:","77","185","690","https://pbs.twimg.com/media/EkOiB5fXsAMBECL?format=jpg&name=small","","","1"
"","CNN Breaking News","Oct 13","A computer outage caused by a cut fiber cable has taken down Virginia's voter registration system on the final day to register before the election","557","1.1K","1.1K","https://pbs.twimg.com/card_img/1321130210620805131/gKY0S1Rs?format=jpg&name=small","https://pbs.twimg.com/card_img/1321130210620805131/gKY0S1Rs?format=jpg&name=small","https://t.co/wsDa1fBqwZ?amp=1","1"
"","Virginia's online voter registration system restored after final day crash","","A computer outage caused by a cut fiber cable has taken down Virginia's voter registration system on the final day to register before the election","557","1.1K","1.1K","https://pbs.twimg.com/card_img/1321130210620805131/gKY0S1Rs?format=jpg&name=small","https://pbs.twimg.com/card_img/1321130210620805131/gKY0S1Rs?format=jpg&name=small","https://t.co/wsDa1fBqwZ?amp=1","1"
"","The online voter registration system in Virginia was coming back online Tuesday evening after a multi-hour outage on the final day for new voters to sign up.","","A computer outage caused by a cut fiber cable has taken down Virginia's voter registration system on the final day to register before the election","557","1.1K","1.1K","https://pbs.twimg.com/card_img/1321130210620805131/gKY0S1Rs?format=jpg&name=small","https://pbs.twimg.com/card_img/1321130210620805131/gKY0S1Rs?format=jpg&name=small","https://t.co/wsDa1fBqwZ?amp=1","1"
"","cnn.com","","A computer outage caused by a cut fiber cable has taken down Virginia's voter registration system on the final day to register before the election","557","1.1K","1.1K","https://pbs.twimg.com/card_img/1321130210620805131/gKY0S1Rs?format=jpg&name=small","https://pbs.twimg.com/card_img/1321130210620805131/gKY0S1Rs?format=jpg&name=small","https://t.co/wsDa1fBqwZ?amp=1","1"
"","CNN Breaking News","Oct 13","The group charged with plotting to kidnap Michigan Gov. Whitmer also discussed targeting Virginia Gov. Northam, an FBI agent says","158","635","1K","https://pbs.twimg.com/card_img/1321115825240264705/wsMuICLy?format=jpg&name=small","https://pbs.twimg.com/card_img/1321115825240264705/wsMuICLy?format=jpg&name=small","https://t.co/SFH5Fvmsuz?amp=1","1"
"","Group charged in Michigan governor kidnap plot discussed targeting Virginia governor, FBI agent says","","The group charged with plotting to kidnap Michigan Gov. Whitmer also discussed targeting Virginia Gov. Northam, an FBI agent says","158","635","1K","https://pbs.twimg.com/card_img/1321115825240264705/wsMuICLy?format=jpg&name=small","https://pbs.twimg.com/card_img/1321115825240264705/wsMuICLy?format=jpg&name=small","https://t.co/SFH5Fvmsuz?amp=1","1"
"","The group charged with plotting to kidnap Michigan Gov. Gretchen Whitmer also discussed kidnapping Virginia Gov. Ralph Northam, an FBI agent testified in court on Tuesday.","","The group charged with plotting to kidnap Michigan Gov. Whitmer also discussed targeting Virginia Gov. Northam, an FBI agent says","158","635","1K","https://pbs.twimg.com/card_img/1321115825240264705/wsMuICLy?format=jpg&name=small","https://pbs.twimg.com/card_img/1321115825240264705/wsMuICLy?format=jpg&name=small","https://t.co/SFH5Fvmsuz?amp=1","1"
"","cnn.com","","The group charged with plotting to kidnap Michigan Gov. Whitmer also discussed targeting Virginia Gov. Northam, an FBI agent says","158","635","1K","https://pbs.twimg.com/card_img/1321115825240264705/wsMuICLy?format=jpg&name=small","https://pbs.twimg.com/card_img/1321115825240264705/wsMuICLy?format=jpg&name=small","https://t.co/SFH5Fvmsuz?amp=1","1"
"","CNN Breaking News","Oct 13","Soccer superstar Cristiano Ronaldo has tested positive for coronavirus, Portuguese sports officials say","141","807","1.7K","","","","1"
"","Cristiano Ronaldo tests positive for coronavirus","","Soccer superstar Cristiano Ronaldo has tested positive for coronavirus, Portuguese sports officials say","141","807","1.7K","","","","1"
"","Cristiano Ronaldo has tested positive for coronavirus, the Portuguese Football Federation said in a statement Tuesday.","","Soccer superstar Cristiano Ronaldo has tested positive for coronavirus, Portuguese sports officials say","141","807","1.7K","","","","1"
"","cnn.com","","Soccer superstar Cristiano Ronaldo has tested positive for coronavirus, Portuguese sports officials say","141","807","1.7K","","","","1"
"","CNN Breaking News","Oct 13","Live: Senators get the chance to question Trump's Supreme Court pick Amy Coney Barrett on a critical day for her nomination","161","76","292","https://pbs.twimg.com/media/EkNiG-_XgAEBtug?format=jpg&name=small","","","1"
"","CNN Breaking News","Oct 13","Johnson & Johnson pauses the advanced clinical trial of its experimental Covid-19 vaccine due to an unexplained illness in a volunteer","430","2.6K","3.2K","https://pbs.twimg.com/card_img/1318366298439512064/3vdb1uYQ?format=jpg&name=small","https://pbs.twimg.com/card_img/1318366298439512064/3vdb1uYQ?format=jpg&name=small","https://t.co/srnlNoyY77?amp=1","1"
"","Johnson & Johnson pauses Covid-19 vaccine trial after 'unexplained illness'","","Johnson & Johnson pauses the advanced clinical trial of its experimental Covid-19 vaccine due to an unexplained illness in a volunteer","430","2.6K","3.2K","https://pbs.twimg.com/card_img/1318366298439512064/3vdb1uYQ?format=jpg&name=small","https://pbs.twimg.com/card_img/1318366298439512064/3vdb1uYQ?format=jpg&name=small","https://t.co/srnlNoyY77?amp=1","1"
"","Johnson&Johnson said its Janssen arm had paused its coronavirus vaccine trial after an ""unexplained illness"" in one of the volunteers testing its experimental Covid-19 shot.","","Johnson & Johnson pauses the advanced clinical trial of its experimental Covid-19 vaccine due to an unexplained illness in a volunteer","430","2.6K","3.2K","https://pbs.twimg.com/card_img/1318366298439512064/3vdb1uYQ?format=jpg&name=small","https://pbs.twimg.com/card_img/1318366298439512064/3vdb1uYQ?format=jpg&name=small","https://t.co/srnlNoyY77?amp=1","1"
"","cnn.com","","Johnson & Johnson pauses the advanced clinical trial of its experimental Covid-19 vaccine due to an unexplained illness in a volunteer","430","2.6K","3.2K","https://pbs.twimg.com/card_img/1318366298439512064/3vdb1uYQ?format=jpg&name=small","https://pbs.twimg.com/card_img/1318366298439512064/3vdb1uYQ?format=jpg&name=small","https://t.co/srnlNoyY77?amp=1","1"
"","CNN Breaking News","Oct 12","Trump has tested negative for Covid-19 on consecutive days, White House physician Sean Conley says as the President heads to a crowded Florida rally","1.6K","603","2.1K","https://pbs.twimg.com/card_img/1320347944277676035/oHNkWXuz?format=jpg&name=small","https://pbs.twimg.com/card_img/1320347944277676035/oHNkWXuz?format=jpg&name=small","https://t.co/zQTyIhYqnL?amp=1","1"
"","Trump's doctor says the President has tested negative on consecutive days","","Trump has tested negative for Covid-19 on consecutive days, White House physician Sean Conley says as the President heads to a crowded Florida rally","1.6K","603","2.1K","https://pbs.twimg.com/card_img/1320347944277676035/oHNkWXuz?format=jpg&name=small","https://pbs.twimg.com/card_img/1320347944277676035/oHNkWXuz?format=jpg&name=small","https://t.co/zQTyIhYqnL?amp=1","1"
"","White House physician Sean Conley said Monday President Donald Trump has tested negative for Covid-19 on consecutive days, as the President heads to a crowded campaign rally in Florida.","","Trump has tested negative for Covid-19 on consecutive days, White House physician Sean Conley says as the President heads to a crowded Florida rally","1.6K","603","2.1K","https://pbs.twimg.com/card_img/1320347944277676035/oHNkWXuz?format=jpg&name=small","https://pbs.twimg.com/card_img/1320347944277676035/oHNkWXuz?format=jpg&name=small","https://t.co/zQTyIhYqnL?amp=1","1"
"","cnn.com","","Trump has tested negative for Covid-19 on consecutive days, White House physician Sean Conley says as the President heads to a crowded Florida rally","1.6K","603","2.1K","https://pbs.twimg.com/card_img/1320347944277676035/oHNkWXuz?format=jpg&name=small","https://pbs.twimg.com/card_img/1320347944277676035/oHNkWXuz?format=jpg&name=small","https://t.co/zQTyIhYqnL?amp=1","1"
"","CNN Breaking News","Oct 12","Disney announced a major reorganization of its media and entertainment business on Monday to ""further accelerate"" its streaming strategy","83","148","400","https://pbs.twimg.com/card_img/1319632996077654016/4qVY5Gka?format=jpg&name=small","https://pbs.twimg.com/card_img/1319632996077654016/4qVY5Gka?format=jpg&name=small","https://t.co/MFobxsgYYM?amp=1","1"
"","Disney to overhaul its entertainment business with focus on streaming","","Disney announced a major reorganization of its media and entertainment business on Monday to ""further accelerate"" its streaming strategy","83","148","400","https://pbs.twimg.com/card_img/1319632996077654016/4qVY5Gka?format=jpg&name=small","https://pbs.twimg.com/card_img/1319632996077654016/4qVY5Gka?format=jpg&name=small","https://t.co/MFobxsgYYM?amp=1","1"
"","If there was any question that Disney+ is the center of Disney's media empire, the company took away all doubt on Monday.","","Disney announced a major reorganization of its media and entertainment business on Monday to ""further accelerate"" its streaming strategy","83","148","400","https://pbs.twimg.com/card_img/1319632996077654016/4qVY5Gka?format=jpg&name=small","https://pbs.twimg.com/card_img/1319632996077654016/4qVY5Gka?format=jpg&name=small","https://t.co/MFobxsgYYM?amp=1","1"
"","cnn.com","","Disney announced a major reorganization of its media and entertainment business on Monday to ""further accelerate"" its streaming strategy","83","148","400","https://pbs.twimg.com/card_img/1319632996077654016/4qVY5Gka?format=jpg&name=small","https://pbs.twimg.com/card_img/1319632996077654016/4qVY5Gka?format=jpg&name=small","https://t.co/MFobxsgYYM?amp=1","1"
"","CNN Breaking News","Oct 12","Roberta McCain, mother of the late Sen. John McCain, died Monday at the age of 108, Cindy McCain says","312","804","5.4K","https://pbs.twimg.com/card_img/1320816842462511104/wFA9avy9?format=jpg&name=small","https://pbs.twimg.com/card_img/1320816842462511104/wFA9avy9?format=jpg&name=small","https://t.co/n501GgZaqW?amp=1","1"
"","John McCain's mother, Roberta, dies at 108","","Roberta McCain, mother of the late Sen. John McCain, died Monday at the age of 108, Cindy McCain says","312","804","5.4K","https://pbs.twimg.com/card_img/1320816842462511104/wFA9avy9?format=jpg&name=small","https://pbs.twimg.com/card_img/1320816842462511104/wFA9avy9?format=jpg&name=small","https://t.co/n501GgZaqW?amp=1","1"
"","The late Sen. John McCain's mother died on Monday at age 108, according to his widow Cindy McCain.","","Roberta McCain, mother of the late Sen. John McCain, died Monday at the age of 108, Cindy McCain says","312","804","5.4K","https://pbs.twimg.com/card_img/1320816842462511104/wFA9avy9?format=jpg&name=small","https://pbs.twimg.com/card_img/1320816842462511104/wFA9avy9?format=jpg&name=small","https://t.co/n501GgZaqW?amp=1","1"
"","cnn.com","","Roberta McCain, mother of the late Sen. John McCain, died Monday at the age of 108, Cindy McCain says","312","804","5.4K","https://pbs.twimg.com/card_img/1320816842462511104/wFA9avy9?format=jpg&name=small","https://pbs.twimg.com/card_img/1320816842462511104/wFA9avy9?format=jpg&name=small","https://t.co/n501GgZaqW?amp=1","1"
"","CNN Breaking News","Oct 12","Covid-19 cases are rising in North Dakota, and hospitals are struggling to meet the demand for care, with fewer than 20 beds available across the state. Follow live updates:","276","450","823","https://pbs.twimg.com/media/EkI75v1XYAIPz3D?format=jpg&name=small","","","1"
"","CNN Breaking News","Oct 11","Rafael Nadal beat Novak Djokovic to win his 13th French Open and 20th grand slam title, tying Roger Federer for the all-time men's lead in majors","145","496","2.8K","https://pbs.twimg.com/card_img/1320394965730508801/KMzZKMMV?format=jpg&name=small","https://pbs.twimg.com/card_img/1320394965730508801/KMzZKMMV?format=jpg&name=small","https://t.co/QLiQSe2IqA?amp=1","1"
"","Rafael Nadal beats Novak Djokovic at French Open for record tying 20th major","","Rafael Nadal beat Novak Djokovic to win his 13th French Open and 20th grand slam title, tying Roger Federer for the all-time men's lead in majors","145","496","2.8K","https://pbs.twimg.com/card_img/1320394965730508801/KMzZKMMV?format=jpg&name=small","https://pbs.twimg.com/card_img/1320394965730508801/KMzZKMMV?format=jpg&name=small","https://t.co/QLiQSe2IqA?amp=1","1"
"","Rafael Nadal beat Novak Djokovic 6-0 6-2 7-5 to win his 13th French Open and 20th grand slam title to tie Roger Federer for the all-time men's lead in majors.","","Rafael Nadal beat Novak Djokovic to win his 13th French Open and 20th grand slam title, tying Roger Federer for the all-time men's lead in majors","145","496","2.8K","https://pbs.twimg.com/card_img/1320394965730508801/KMzZKMMV?format=jpg&name=small","https://pbs.twimg.com/card_img/1320394965730508801/KMzZKMMV?format=jpg&name=small","https://t.co/QLiQSe2IqA?amp=1","1"
"","cnn.com","","Rafael Nadal beat Novak Djokovic to win his 13th French Open and 20th grand slam title, tying Roger Federer for the all-time men's lead in majors","145","496","2.8K","https://pbs.twimg.com/card_img/1320394965730508801/KMzZKMMV?format=jpg&name=small","https://pbs.twimg.com/card_img/1320394965730508801/KMzZKMMV?format=jpg&name=small","https://t.co/QLiQSe2IqA?amp=1","1"
