"listing_value","tweets_Name","tweets_Date","tweets_Text","tweets_Replies","tweets_Retweets","tweets_Likes","tweets_Images","tweets_imageURL","tweets_hrefURL","remove"
"","CNN Poll: Americans are divided over Amy Coney Barrett","","Americans are divided over Supreme Court nominee Amy Coney Barrett, with 46% saying they don't want her confirmed, according to a new CNN Poll","385","254","1K","https://pbs.twimg.com/card_img/1317168557986357249/Qq-EgN5F?format=jpg&name=small","https://pbs.twimg.com/card_img/1317168557986357249/Qq-EgN5F?format=jpg&name=small","https://t.co/ZZ9JvqO8sY?amp=1","1"
"","Americans are split on Supreme Court nominee Amy Coney Barrett, with 46% saying they do not want the Senate to send her to the high court and 42% saying the Senate should confirm her in a new CNN...","","Americans are divided over Supreme Court nominee Amy Coney Barrett, with 46% saying they don't want her confirmed, according to a new CNN Poll","385","254","1K","https://pbs.twimg.com/card_img/1317168557986357249/Qq-EgN5F?format=jpg&name=small","https://pbs.twimg.com/card_img/1317168557986357249/Qq-EgN5F?format=jpg&name=small","https://t.co/ZZ9JvqO8sY?amp=1","1"
"","cnn.com","","Americans are divided over Supreme Court nominee Amy Coney Barrett, with 46% saying they don't want her confirmed, according to a new CNN Poll","385","254","1K","https://pbs.twimg.com/card_img/1317168557986357249/Qq-EgN5F?format=jpg&name=small","https://pbs.twimg.com/card_img/1317168557986357249/Qq-EgN5F?format=jpg&name=small","https://t.co/ZZ9JvqO8sY?amp=1","1"
"","CNN Breaking News","Oct 7","Two high-profile ISIS fighters have been indicted on terrorism charges related to the hostage-taking and deaths of four Americans","77","150","539","https://pbs.twimg.com/card_img/1318596560788377600/vOS3RqX8?format=jpg&name=small","https://pbs.twimg.com/card_img/1318596560788377600/vOS3RqX8?format=jpg&name=small","https://t.co/putCSeHroy?amp=1","1"
"","Two ISIS fighters charged in deaths of American journalists and aid workers in Syria","","Two high-profile ISIS fighters have been indicted on terrorism charges related to the hostage-taking and deaths of four Americans","77","150","539","https://pbs.twimg.com/card_img/1318596560788377600/vOS3RqX8?format=jpg&name=small","https://pbs.twimg.com/card_img/1318596560788377600/vOS3RqX8?format=jpg&name=small","https://t.co/putCSeHroy?amp=1","1"
"","Two high-profile ISIS fighters have been indicted on terrorism charges related to the hostage-taking and deaths of four Americans, the US government announced Wednesday.","","Two high-profile ISIS fighters have been indicted on terrorism charges related to the hostage-taking and deaths of four Americans","77","150","539","https://pbs.twimg.com/card_img/1318596560788377600/vOS3RqX8?format=jpg&name=small","https://pbs.twimg.com/card_img/1318596560788377600/vOS3RqX8?format=jpg&name=small","https://t.co/putCSeHroy?amp=1","1"
"","cnn.com","","Two high-profile ISIS fighters have been indicted on terrorism charges related to the hostage-taking and deaths of four Americans","77","150","539","https://pbs.twimg.com/card_img/1318596560788377600/vOS3RqX8?format=jpg&name=small","https://pbs.twimg.com/card_img/1318596560788377600/vOS3RqX8?format=jpg&name=small","https://t.co/putCSeHroy?amp=1","1"
"","CNN Breaking News","Oct 7","Former CIA and NSA Director Michael Hayden warns that reelecting President Trump would be ""very bad for America"" while endorsing Democratic nominee Joe Biden for president","503","2.7K","9.8K","https://pbs.twimg.com/card_img/1316412228342550530/axJr_T-Y?format=jpg&name=small","https://pbs.twimg.com/card_img/1316412228342550530/axJr_T-Y?format=jpg&name=small","https://t.co/5Ea7tMVwZS?amp=1","1"
"","Former CIA Director Hayden backs Biden, warns reelecting Trump would be 'very bad' for America","","Former CIA and NSA Director Michael Hayden warns that reelecting President Trump would be ""very bad for America"" while endorsing Democratic nominee Joe Biden for president","503","2.7K","9.8K","https://pbs.twimg.com/card_img/1316412228342550530/axJr_T-Y?format=jpg&name=small","https://pbs.twimg.com/card_img/1316412228342550530/axJr_T-Y?format=jpg&name=small","https://t.co/5Ea7tMVwZS?amp=1","1"
"","Former CIA and NSA Director Michael Hayden on Wednesday warned that reelecting President Donald Trump would be ""very bad for America"" while endorsing Democratic nominee Joe Biden for president.","","Former CIA and NSA Director Michael Hayden warns that reelecting President Trump would be ""very bad for America"" while endorsing Democratic nominee Joe Biden for president","503","2.7K","9.8K","https://pbs.twimg.com/card_img/1316412228342550530/axJr_T-Y?format=jpg&name=small","https://pbs.twimg.com/card_img/1316412228342550530/axJr_T-Y?format=jpg&name=small","https://t.co/5Ea7tMVwZS?amp=1","1"
"","cnn.com","","Former CIA and NSA Director Michael Hayden warns that reelecting President Trump would be ""very bad for America"" while endorsing Democratic nominee Joe Biden for president","503","2.7K","9.8K","https://pbs.twimg.com/card_img/1316412228342550530/axJr_T-Y?format=jpg&name=small","https://pbs.twimg.com/card_img/1316412228342550530/axJr_T-Y?format=jpg&name=small","https://t.co/5Ea7tMVwZS?amp=1","1"
"","CNN Breaking News","Oct 7","The Manhattan district attorney can obtain Trump's tax returns, a federal appeals court rules. The case is likely to head to the Supreme Court.","329","664","3K","https://pbs.twimg.com/card_img/1318706241682636801/nKY2Eshk?format=jpg&name=small","https://pbs.twimg.com/card_img/1318706241682636801/nKY2Eshk?format=jpg&name=small","https://t.co/OPrqQgVp9r?amp=1","1"
"","Subpoena for Trump tax returns heading back to Supreme Court after President dealt another setback","","The Manhattan district attorney can obtain Trump's tax returns, a federal appeals court rules. The case is likely to head to the Supreme Court.","329","664","3K","https://pbs.twimg.com/card_img/1318706241682636801/nKY2Eshk?format=jpg&name=small","https://pbs.twimg.com/card_img/1318706241682636801/nKY2Eshk?format=jpg&name=small","https://t.co/OPrqQgVp9r?amp=1","1"
"","The Manhattan district attorney can obtain President Donald Trump's tax returns a federal appeals court ruled, dealing the president another setback in his effort to shield his tax returns from...","","The Manhattan district attorney can obtain Trump's tax returns, a federal appeals court rules. The case is likely to head to the Supreme Court.","329","664","3K","https://pbs.twimg.com/card_img/1318706241682636801/nKY2Eshk?format=jpg&name=small","https://pbs.twimg.com/card_img/1318706241682636801/nKY2Eshk?format=jpg&name=small","https://t.co/OPrqQgVp9r?amp=1","1"
"","cnn.com","","The Manhattan district attorney can obtain Trump's tax returns, a federal appeals court rules. The case is likely to head to the Supreme Court.","329","664","3K","https://pbs.twimg.com/card_img/1318706241682636801/nKY2Eshk?format=jpg&name=small","https://pbs.twimg.com/card_img/1318706241682636801/nKY2Eshk?format=jpg&name=small","https://t.co/OPrqQgVp9r?amp=1","1"
"","CNN Breaking News","Oct 6","Stephen Miller, a top Trump aide, has tested positive for coronavirus. There are now at least 11 positive cases from an outbreak at the White House.","878","1.2K","3K","https://pbs.twimg.com/card_img/1319266955497385986/7wBNMJWO?format=jpg&name=small","https://pbs.twimg.com/card_img/1319266955497385986/7wBNMJWO?format=jpg&name=small","https://t.co/GPTnAXcn2J?amp=1","1"
"","Top White House aide Stephen Miller tests positive for Covid-19","","Stephen Miller, a top Trump aide, has tested positive for coronavirus. There are now at least 11 positive cases from an outbreak at the White House.","878","1.2K","3K","https://pbs.twimg.com/card_img/1319266955497385986/7wBNMJWO?format=jpg&name=small","https://pbs.twimg.com/card_img/1319266955497385986/7wBNMJWO?format=jpg&name=small","https://t.co/GPTnAXcn2J?amp=1","1"
"","Stephen Miller, a top policy adviser to President Donald Trump, has tested positive for coronavirus, he confirmed in a statement Tuesday.","","Stephen Miller, a top Trump aide, has tested positive for coronavirus. There are now at least 11 positive cases from an outbreak at the White House.","878","1.2K","3K","https://pbs.twimg.com/card_img/1319266955497385986/7wBNMJWO?format=jpg&name=small","https://pbs.twimg.com/card_img/1319266955497385986/7wBNMJWO?format=jpg&name=small","https://t.co/GPTnAXcn2J?amp=1","1"
"","cnn.com","","Stephen Miller, a top Trump aide, has tested positive for coronavirus. There are now at least 11 positive cases from an outbreak at the White House.","878","1.2K","3K","https://pbs.twimg.com/card_img/1319266955497385986/7wBNMJWO?format=jpg&name=small","https://pbs.twimg.com/card_img/1319266955497385986/7wBNMJWO?format=jpg&name=small","https://t.co/GPTnAXcn2J?amp=1","1"
"","CNN Breaking News","Oct 6","Vice President Pence will not have to use plexiglass barriers around him at Wednesdays debate, the debate commission says, but both Sen. Harris and the debate moderator will be allowed to have the barriers between them and Pence","1.4K","1.3K","4.2K","https://pbs.twimg.com/card_img/1321198867837321217/dZ0ORuJ4?format=jpg&name=small","https://pbs.twimg.com/card_img/1321198867837321217/dZ0ORuJ4?format=jpg&name=small","https://t.co/XrhpuCFzss?amp=1","1"
"","Pence team agrees to allow plexiglass barrier near him at debate after back-and-forth over Covid...","","Vice President Pence will not have to use plexiglass barriers around him at Wednesdays debate, the debate commission says, but both Sen. Harris and the debate moderator will be allowed to have the barriers between them and Pence","1.4K","1.3K","4.2K","https://pbs.twimg.com/card_img/1321198867837321217/dZ0ORuJ4?format=jpg&name=small","https://pbs.twimg.com/card_img/1321198867837321217/dZ0ORuJ4?format=jpg&name=small","https://t.co/XrhpuCFzss?amp=1","1"
"","Mike Pence's team agreed Tuesday night to allow the Commission on Presidential Debates to erect a plexiglass barrier near the vice president for Wednesday's debate in Salt Lake City, a Pence aide and...","","Vice President Pence will not have to use plexiglass barriers around him at Wednesdays debate, the debate commission says, but both Sen. Harris and the debate moderator will be allowed to have the barriers between them and Pence","1.4K","1.3K","4.2K","https://pbs.twimg.com/card_img/1321198867837321217/dZ0ORuJ4?format=jpg&name=small","https://pbs.twimg.com/card_img/1321198867837321217/dZ0ORuJ4?format=jpg&name=small","https://t.co/XrhpuCFzss?amp=1","1"
"","cnn.com","","Vice President Pence will not have to use plexiglass barriers around him at Wednesdays debate, the debate commission says, but both Sen. Harris and the debate moderator will be allowed to have the barriers between them and Pence","1.4K","1.3K","4.2K","https://pbs.twimg.com/card_img/1321198867837321217/dZ0ORuJ4?format=jpg&name=small","https://pbs.twimg.com/card_img/1321198867837321217/dZ0ORuJ4?format=jpg&name=small","https://t.co/XrhpuCFzss?amp=1","1"
"","CNN Breaking News","Oct 6","Rep. Salud Carbajal, a California Democrat, has announced that he has contracted coronavirus","94","214","443","https://pbs.twimg.com/card_img/1316279158788567040/Dn7XKWEM?format=jpg&name=small","https://pbs.twimg.com/card_img/1316279158788567040/Dn7XKWEM?format=jpg&name=small","https://t.co/kItJhfFTSR?amp=1","1"
"","California congressman announces he tested positive for Covid-19","","Rep. Salud Carbajal, a California Democrat, has announced that he has contracted coronavirus","94","214","443","https://pbs.twimg.com/card_img/1316279158788567040/Dn7XKWEM?format=jpg&name=small","https://pbs.twimg.com/card_img/1316279158788567040/Dn7XKWEM?format=jpg&name=small","https://t.co/kItJhfFTSR?amp=1","1"
"","US Rep. Salud Carbajal, a California Democrat, has contracted coronavirus, he announced on social media Tuesday evening.","","Rep. Salud Carbajal, a California Democrat, has announced that he has contracted coronavirus","94","214","443","https://pbs.twimg.com/card_img/1316279158788567040/Dn7XKWEM?format=jpg&name=small","https://pbs.twimg.com/card_img/1316279158788567040/Dn7XKWEM?format=jpg&name=small","https://t.co/kItJhfFTSR?amp=1","1"
"","cnn.com","","Rep. Salud Carbajal, a California Democrat, has announced that he has contracted coronavirus","94","214","443","https://pbs.twimg.com/card_img/1316279158788567040/Dn7XKWEM?format=jpg&name=small","https://pbs.twimg.com/card_img/1316279158788567040/Dn7XKWEM?format=jpg&name=small","https://t.co/kItJhfFTSR?amp=1","1"
"","CNN Breaking News","Oct 6","A 16-month congressional investigation into Amazon, Apple, Google and Facebook has found that the tech giants hold ""monopoly power"" in key business segments and have abused their dominance in the marketplace","310","1K","1.9K","https://pbs.twimg.com/card_img/1319761441688342531/1vvf5VRg?format=jpg&name=small","https://pbs.twimg.com/card_img/1319761441688342531/1vvf5VRg?format=jpg&name=small","https://t.co/SJIMIVxLSa?amp=1","1"
"","Congress' Big Tech investigation finds companies wield 'monopoly power'","","A 16-month congressional investigation into Amazon, Apple, Google and Facebook has found that the tech giants hold ""monopoly power"" in key business segments and have abused their dominance in the marketplace","310","1K","1.9K","https://pbs.twimg.com/card_img/1319761441688342531/1vvf5VRg?format=jpg&name=small","https://pbs.twimg.com/card_img/1319761441688342531/1vvf5VRg?format=jpg&name=small","https://t.co/SJIMIVxLSa?amp=1","1"
"","A 16-month congressional investigation into Amazon, Apple, Google and Facebook has found that the tech giants hold ""monopoly power"" in key business segments and have abused their dominance in the...","","A 16-month congressional investigation into Amazon, Apple, Google and Facebook has found that the tech giants hold ""monopoly power"" in key business segments and have abused their dominance in the marketplace","310","1K","1.9K","https://pbs.twimg.com/card_img/1319761441688342531/1vvf5VRg?format=jpg&name=small","https://pbs.twimg.com/card_img/1319761441688342531/1vvf5VRg?format=jpg&name=small","https://t.co/SJIMIVxLSa?amp=1","1"
"","cnn.com","","A 16-month congressional investigation into Amazon, Apple, Google and Facebook has found that the tech giants hold ""monopoly power"" in key business segments and have abused their dominance in the marketplace","310","1K","1.9K","https://pbs.twimg.com/card_img/1319761441688342531/1vvf5VRg?format=jpg&name=small","https://pbs.twimg.com/card_img/1319761441688342531/1vvf5VRg?format=jpg&name=small","https://t.co/SJIMIVxLSa?amp=1","1"
"","CNN Breaking News","Oct 6","Eddie Van Halen, the renowned lead guitarist of iconic rock group Van Halen, has died. He was 65.","248","2K","3.9K","https://pbs.twimg.com/card_img/1318653250653093892/1IL9kKW5?format=jpg&name=small","https://pbs.twimg.com/card_img/1318653250653093892/1IL9kKW5?format=jpg&name=small","https://t.co/WbAy26p3aO?amp=1","1"
"","Eddie Van Halen dies at 65 after cancer battle","","Eddie Van Halen, the renowned lead guitarist of iconic rock group Van Halen, has died. He was 65.","248","2K","3.9K","https://pbs.twimg.com/card_img/1318653250653093892/1IL9kKW5?format=jpg&name=small","https://pbs.twimg.com/card_img/1318653250653093892/1IL9kKW5?format=jpg&name=small","https://t.co/WbAy26p3aO?amp=1","1"
"","Eddie Van Halen, the renowned lead guitarist of iconic rock group Van Halen, has died, according to a social media post by his son.","","Eddie Van Halen, the renowned lead guitarist of iconic rock group Van Halen, has died. He was 65.","248","2K","3.9K","https://pbs.twimg.com/card_img/1318653250653093892/1IL9kKW5?format=jpg&name=small","https://pbs.twimg.com/card_img/1318653250653093892/1IL9kKW5?format=jpg&name=small","https://t.co/WbAy26p3aO?amp=1","1"
"","cnn.com","","Eddie Van Halen, the renowned lead guitarist of iconic rock group Van Halen, has died. He was 65.","248","2K","3.9K","https://pbs.twimg.com/card_img/1318653250653093892/1IL9kKW5?format=jpg&name=small","https://pbs.twimg.com/card_img/1318653250653093892/1IL9kKW5?format=jpg&name=small","https://t.co/WbAy26p3aO?amp=1","1"
"","CNN Breaking News","Oct 6","US stocks take a dive after Trump says he has ordered an end to stimulus negotiations until after the November election","360","891","1.5K","https://pbs.twimg.com/card_img/1318644953233358851/E-BkyACX?format=jpg&name=small","https://pbs.twimg.com/card_img/1318644953233358851/E-BkyACX?format=jpg&name=small","https://t.co/Jdo83fqpF2?amp=1","1"
"","Dow swings 600 points after Trump rejects stimulus plan","","US stocks take a dive after Trump says he has ordered an end to stimulus negotiations until after the November election","360","891","1.5K","https://pbs.twimg.com/card_img/1318644953233358851/E-BkyACX?format=jpg&name=small","https://pbs.twimg.com/card_img/1318644953233358851/E-BkyACX?format=jpg&name=small","https://t.co/Jdo83fqpF2?amp=1","1"
"","Stocks took a dive Tuesday afternoon after President Donald Trump said he ordered an end to stimulus negotiations until after the November election.","","US stocks take a dive after Trump says he has ordered an end to stimulus negotiations until after the November election","360","891","1.5K","https://pbs.twimg.com/card_img/1318644953233358851/E-BkyACX?format=jpg&name=small","https://pbs.twimg.com/card_img/1318644953233358851/E-BkyACX?format=jpg&name=small","https://t.co/Jdo83fqpF2?amp=1","1"
"","cnn.com","","US stocks take a dive after Trump says he has ordered an end to stimulus negotiations until after the November election","360","891","1.5K","https://pbs.twimg.com/card_img/1318644953233358851/E-BkyACX?format=jpg&name=small","https://pbs.twimg.com/card_img/1318644953233358851/E-BkyACX?format=jpg&name=small","https://t.co/Jdo83fqpF2?amp=1","1"
"","CNN Breaking News","Oct 6","President Trump says he is ending negotiations with congressional Democrats for a follow-up Covid-19 stimulus bill until after the election","1.9K","1.6K","2.2K","https://pbs.twimg.com/card_img/1321182359996289024/y0C8pnJd?format=jpg&name=small","https://pbs.twimg.com/card_img/1321182359996289024/y0C8pnJd?format=jpg&name=small","https://t.co/csM4iVPcoa?amp=1","1"
"","Trump abruptly scraps stimulus talks, punting on economic relief until after Election Day","","President Trump says he is ending negotiations with congressional Democrats for a follow-up Covid-19 stimulus bill until after the election","1.9K","1.6K","2.2K","https://pbs.twimg.com/card_img/1321182359996289024/y0C8pnJd?format=jpg&name=small","https://pbs.twimg.com/card_img/1321182359996289024/y0C8pnJd?format=jpg&name=small","https://t.co/csM4iVPcoa?amp=1","1"
"","President Donald Trump has ordered his negotiators to halt talks over a new stimulus package, after the two sides have struggled for months to reach a deal, a stunning move that puts an end to...","","President Trump says he is ending negotiations with congressional Democrats for a follow-up Covid-19 stimulus bill until after the election","1.9K","1.6K","2.2K","https://pbs.twimg.com/card_img/1321182359996289024/y0C8pnJd?format=jpg&name=small","https://pbs.twimg.com/card_img/1321182359996289024/y0C8pnJd?format=jpg&name=small","https://t.co/csM4iVPcoa?amp=1","1"
"","cnn.com","","President Trump says he is ending negotiations with congressional Democrats for a follow-up Covid-19 stimulus bill until after the election","1.9K","1.6K","2.2K","https://pbs.twimg.com/card_img/1321182359996289024/y0C8pnJd?format=jpg&name=small","https://pbs.twimg.com/card_img/1321182359996289024/y0C8pnJd?format=jpg&name=small","https://t.co/csM4iVPcoa?amp=1","1"
"","CNN Breaking News","Oct 6","The top US general, Gen. Mark Milley, and several other senior Pentagon leaders are quarantining after exposure to coronavirus, sources say","190","749","1.5K","https://pbs.twimg.com/card_img/1318959448946343939/tKdblur8?format=jpg&name=small","https://pbs.twimg.com/card_img/1318959448946343939/tKdblur8?format=jpg&name=small","https://t.co/sSaXDj5Pcm?amp=1","1"
"","Senior Pentagon leadership quarantining after exposure to coronavirus","","The top US general, Gen. Mark Milley, and several other senior Pentagon leaders are quarantining after exposure to coronavirus, sources say","190","749","1.5K","https://pbs.twimg.com/card_img/1318959448946343939/tKdblur8?format=jpg&name=small","https://pbs.twimg.com/card_img/1318959448946343939/tKdblur8?format=jpg&name=small","https://t.co/sSaXDj5Pcm?amp=1","1"
"","The top US general, Joint Chiefs of Staff Chairman Mark Milley, and several members of the Pentagon's senior leadership are quarantining after a top Coast Guard official tested positive for coronav...","","The top US general, Gen. Mark Milley, and several other senior Pentagon leaders are quarantining after exposure to coronavirus, sources say","190","749","1.5K","https://pbs.twimg.com/card_img/1318959448946343939/tKdblur8?format=jpg&name=small","https://pbs.twimg.com/card_img/1318959448946343939/tKdblur8?format=jpg&name=small","https://t.co/sSaXDj5Pcm?amp=1","1"
"","cnn.com","","The top US general, Gen. Mark Milley, and several other senior Pentagon leaders are quarantining after exposure to coronavirus, sources say","190","749","1.5K","https://pbs.twimg.com/card_img/1318959448946343939/tKdblur8?format=jpg&name=small","https://pbs.twimg.com/card_img/1318959448946343939/tKdblur8?format=jpg&name=small","https://t.co/sSaXDj5Pcm?amp=1","1"
"","CNN Breaking News","Oct 6","Hurricane Delta is rapidly intensifying in the Caribbean and is expected to make landfall across northern portions of the Yucatan Peninsula in Mexico by Wednesday","42","133","306","https://pbs.twimg.com/card_img/1318919772097097731/BKcYesJB?format=jpg&name=small","https://pbs.twimg.com/card_img/1318919772097097731/BKcYesJB?format=jpg&name=small","https://t.co/aOZ845Une5?amp=1","1"
"","Hurricane Delta is intensifying rapidly and is now a Category 4 storm","","Hurricane Delta is rapidly intensifying in the Caribbean and is expected to make landfall across northern portions of the Yucatan Peninsula in Mexico by Wednesday","42","133","306","https://pbs.twimg.com/card_img/1318919772097097731/BKcYesJB?format=jpg&name=small","https://pbs.twimg.com/card_img/1318919772097097731/BKcYesJB?format=jpg&name=small","https://t.co/aOZ845Une5?amp=1","1"
"","Hurricane Delta is an ""extremely dangerous"" major hurricane on a collision course with the Yucatan Peninsula and the US Gulf Coast. It will directly impact Cancun as a dangerous Category 4 storm on...","","Hurricane Delta is rapidly intensifying in the Caribbean and is expected to make landfall across northern portions of the Yucatan Peninsula in Mexico by Wednesday","42","133","306","https://pbs.twimg.com/card_img/1318919772097097731/BKcYesJB?format=jpg&name=small","https://pbs.twimg.com/card_img/1318919772097097731/BKcYesJB?format=jpg&name=small","https://t.co/aOZ845Une5?amp=1","1"
"","cnn.com","","Hurricane Delta is rapidly intensifying in the Caribbean and is expected to make landfall across northern portions of the Yucatan Peninsula in Mexico by Wednesday","42","133","306","https://pbs.twimg.com/card_img/1318919772097097731/BKcYesJB?format=jpg&name=small","https://pbs.twimg.com/card_img/1318919772097097731/BKcYesJB?format=jpg&name=small","https://t.co/aOZ845Une5?amp=1","1"
"","CNN Breaking News","Oct 6","Southwest Airlines says it will ask employees to take pay cuts to keep their jobs, according to a new company-wide memo obtained by CNN","129","275","454","https://pbs.twimg.com/card_img/1321110187219001344/apEez8c3?format=jpg&name=small","https://pbs.twimg.com/card_img/1321110187219001344/apEez8c3?format=jpg&name=small","https://t.co/ntVl3qppTw?amp=1","1"
"","Southwest Airlines wants workers to take pay cuts to avoid furloughs","","Southwest Airlines says it will ask employees to take pay cuts to keep their jobs, according to a new company-wide memo obtained by CNN","129","275","454","https://pbs.twimg.com/card_img/1321110187219001344/apEez8c3?format=jpg&name=small","https://pbs.twimg.com/card_img/1321110187219001344/apEez8c3?format=jpg&name=small","https://t.co/ntVl3qppTw?amp=1","1"
"","Southwest Airlines says it will ask employees to take pay cuts to keep their jobs.","","Southwest Airlines says it will ask employees to take pay cuts to keep their jobs, according to a new company-wide memo obtained by CNN","129","275","454","https://pbs.twimg.com/card_img/1321110187219001344/apEez8c3?format=jpg&name=small","https://pbs.twimg.com/card_img/1321110187219001344/apEez8c3?format=jpg&name=small","https://t.co/ntVl3qppTw?amp=1","1"
"","cnn.com","","Southwest Airlines says it will ask employees to take pay cuts to keep their jobs, according to a new company-wide memo obtained by CNN","129","275","454","https://pbs.twimg.com/card_img/1321110187219001344/apEez8c3?format=jpg&name=small","https://pbs.twimg.com/card_img/1321110187219001344/apEez8c3?format=jpg&name=small","https://t.co/ntVl3qppTw?amp=1","1"
"","CNN Breaking News","Oct 6","Only four US states are showing downward trends in Covid-19 cases, according to data from Johns Hopkins University. Follow live updates:","190","621","1.1K","https://pbs.twimg.com/media/Ejpot2tXYAIy50q?format=jpg&name=small","","","1"
"","CNN Breaking News","Oct 6","Biden holds his widest advantage over Trump just weeks before the election in a new CNN poll of likely voters","849","910","6K","https://pbs.twimg.com/card_img/1318950593440997380/38QmRfHx?format=jpg&name=small","https://pbs.twimg.com/card_img/1318950593440997380/38QmRfHx?format=jpg&name=small","https://t.co/fccdil2YaY?amp=1","1"
"","CNN Poll: Biden expands lead over Trump after contentious debate and President's Covid diagnosis","","Biden holds his widest advantage over Trump just weeks before the election in a new CNN poll of likely voters","849","910","6K","https://pbs.twimg.com/card_img/1318950593440997380/38QmRfHx?format=jpg&name=small","https://pbs.twimg.com/card_img/1318950593440997380/38QmRfHx?format=jpg&name=small","https://t.co/fccdil2YaY?amp=1","1"
